InIN eyesNNS libtardVBD raceNN problemNN problemNN usPRP,1
IPRP purchasingVBG kitNNS nextIN weekNN,0
strangeNN wantsVBZ rememberVB calledVBN sixCD millionCD diedVBD communismNN,0
WePRP newJJ versionNN oldJJ systemNN everyDT whiteJJ personNN earthNN makesVBZ millionsNNS dollarsNNS enslavedVBD laborNN nonWhitesNNS worldNN,1
httpcareuterscomarticletopNewsidCATRE75S52620110629NN,0
IPRP knowVBP peopleNNS postedVBD linkJJ IPRP thinkVBP oneCD easiestJJS waysNNS becomeVBP involvedJJ,0
PerhapsRB wouldMD likeVB commentNN linkNN,0
httpwwwnewnationvgforumsshowthreadphpp325910JJ OfIN AfterIN FindingVBG 8CD 2010CD 9CD 42CD 9CD 2010CD httpwwwclickorlandocomeducatio82detailhtmlNN,0
allegeVBD manNN describedVBD blackJJ 17CD 20CD gotVBD carNN walkedVBD backRB sittingVBG shotNN,0
agreeJJ peopleNNS fullJJ whiteJJ nothingNN wrongJJ differentJJ skinNN colorNN whiteJJ peopleNNS betterVBP anyoneNN elseRB,0
IfIN standJJ asiansNNS wouldMD findVB schoolNN breathNN freshJJ airNN,1
IPRP evenRB nicerVBD suburbanJJ areaNN IPRP gettingVBG darkerNN darkerNN,1
InIN pastJJ whiteJJ kidsNNS playingVBG basketballNN schoolNN goVBP homeNN littleRB videoJJ gamesNNS smokeVBD dopeNN watchNN televisionNN,0
IPRP sickVBP weekNN lostVBD 400CD bucksNNS payVBP IPRP takeVBP timeNN workNN,0
ExactlyRB wantVBP usPRP layVBD dieNN,1
DoVBP meanVB oneCD classroomNN oneCD whiteJJ childNN,0
TheyPRP knowVBP destoryJJ civilizationNN,1
infestedVBD centuriesNNS centreVBP propagandaNN millNN,1
ThatDT negroJJ placeNN teacherCC ntJJ sendNN,1
IPRP hateVBP wordNN racistNN makesVBZ peopleNNS calledVBD racistNN thinkNN somethingNN wrongJJ immigrantsNNS comingVBG somethingNN wrongJJ,1
InIN TheDT physicalJJ incarnationNN creationNN TheDT,1
IPRP likeVBP seeVBP wipeNN mapNN,1
letNN gorillaNN sakeVBP longRB gotVBD bodyNN waxNN,1
WowNN,0
ItsPRP$ goingVBG getVB badJJ comesVBZ,0
soundNN likeIN nameNN personNN ratherRB nameJJ placeNN,0
TheDT speciesNNS constantlyRB grabsVBP crotchNN frontNN othersNNS wavesVBZ armsNNS aroundIN furiouslyRB 1CD monkeysNNS 2CD blacksNNS 3CD NeedNN IPRP sayVBP,1
meansVBZ muslimNN,0
RightRB IPRP thinkVBP WASPIN IPRP thinkVBP liberalsVBZ neverRB tasteNN diversityNN lifeNN,1
playedVBN foxJJ newsNN todaysaidVBD wentVBD apeNN schmidtNN punNN intendedVBD baffroomsfoxJJ newsNN sucksNNS leastVBP peopleNNS getVBP coupleJJ secondsNNS realJJ newsNN secondlyRB iveJJ neverRB heardVBN sheboonNN beforeaJJ newJJ specieNN chimpoutNN familyNN,1
CFNN,0
IPRP wonderingVBG thingNN,0
IPRP wouldMD ntVB surprisedJJ governmentNN tookVBD taxesNNS payNN checksNNS couldMD feedVB houseNN rapeugeesNNS floodingVBG countryNN,1
ItsPRP$ easyJJ multiplyJJ AfricanJJ genesNNS incrediblyRB pronouncedVBD,1
ThereEX alwaysRB survivorsNNS judenVBP neverRB letVBN goVB holahoaxVB,1
IPRP mountainVBP uJJ,0
ItPRP goodJJ readNN tellsNNS truthVBP,0
LiberalsNNS changeVBP factsNNS fitVBP deludedJJ narrativeJJ intelligentNN peopleNNS changeVBP narrativeJJ fitNN factsNNS,1
ADT hundredCD yardsNNS,0
TheyPRP makeVBP knowJJ bookNN friendsNNS knowVBP likeIN thingsNNS needVBP whitesNNS knowVBP likeIN thingsNNS JewishJJ threatNN negroidJJ raceNN,1
goingVBG antiwhiteJJ peopleNNS 2012CD,0
HowWRB hardJJ AmericansNNPS getVBP,0
ToTO honestVB dontNN thinkVBP killedVBD thoughtJJ swedishJJ boyNN lookedVBD likeIN racistNN probablyRB excuseVB,1
JustRB layVB crackNN ecstasyNN,0
YourselfPRP,1
ItsPRP$ hardJJ,0
FinallyRB goingVBG makeJJ endNN summerNN,0
IPRP wouldMD likeVB sayVB warmJJ welcomeJJ newJJ membersNNS workingVBG wayNN introJJ postsNNS,0
ThisDT filthNN sectarianJJ BritishJJ songNN folkNN songNN sortNN scumNN wroteVBD admireJJ filthNN placeNN forumNN yetRB aloneRB IrishJJ forumNN,1
sanityNN speakingVBG lastJJ,0
YouPRP getVBP spaceNN apartmentNN clearJJ 6x6CD footJJ spaceNN floorNN floorNN exercisesVBZ stretchJJ deepNN breathingNN getVBP coupleNN dumbbellsNNS,0
TheyPRP culturalVBP threatsNNS,1
ItPRP seemsVBZ tryingVBG sayVB whiteJJ wrongJJ placeNN wrongJJ timeNN anywhereJJ,0
gunsNNS fightVBD,0
IndeedRB,0
wellNN liberalsNNS wouldMD goVB apeNN crazyNN,1
IfIN wantJJ fireNN leftistJJ moonbatsNNS replaceVB genuineJJ conservativesNNS IPRP,1
11CD capsNNS uselessJJ particularJJ gunNN goVBP aroundIN cylinderJJR leastJJS oneCD fullJJ revolutionNN actuallyRB seatVBZ fullyRB fireVB,0
AnyDT expressingVBG homosexualityNN outsideIN homeNN howeverRB mustMD stoppedVB,1
ItsPRP$ goneVBN fullJJ retardNN,0
ИскористиJJ сликаNN,1
ThatDT realJJ religionNN worshipNN falseJJ godNN everythingNN elseRB everyDT dayNN,1
IPRP sightedVBD 350CD yardsNNS,0
shirtNN,0
WellRB makesVBZ factNN scumJJ sendingVBG millionsNNS kinFW countryNN takingVBG jobsNNS inhabitantsNNS killingVBG peopleNNS mongrelizingVBG raceNN alrightNN,1
iveJJ seenVBN beautifulJJ whiteJJ womenNNS nothingNN sickensNNS seeVBP pullJJ mallNN groceryNN storeNN gasNN stationNN thinkVBP damnNN shesNNS beautifulJJ seeVBP openJJ backRB doorNN walkNN oreoIN babyNN kindaNN makesVBZ wishNN stillRB 1940CD alabamaNN 16CD,1
MarxistJJ SubversionNN happenedVBD,1
TheDT futureNN longJJ sitNN waitNN overrunNN subhumansNNS,1
EveryoneNN dutyNN makeVBP lifeNN difficultJJ blacksNNS possibleJJ childrenNNS kindNN futureNN,1
BeautifulJJ placeNN,0
ByIN wordsNNS deedsNNS declareVBP staunchlyRB favorJJ genocideNN peopleNNS,1
WhileIN prisonNN kikesNNS getVBP foodNN regularJJ prisonNN populationNN getsVBZ,1
TeachersNNS careVBP lessRBR tendJJ chalkNN rebellionNN,0
LetVB blackJJ peopleNNS joinVBP resultJJ diversityNN glassNN milkNN exampleNN putVBD dropNN inkNN putVBD sugarJJ spicesNNS putVBD iceJJ drinkNN milkNN completelyRB darkJJ putNN inkVBP becomeNN uselessJJ junkNN,1
SAfricanJJ policeNN clashNN poorJJ protestersNNS countryNN expectVBP,1
IfIN houseNN doorNN lockedVBD midnightJJ neighborNN openedVBD doorNN muslimsNNS comeVBP insideRB takeVBP stuffJJ rapeNN wifeNN beatVBD nearlyRB deathNN wouldMD stillRB thinkVB neighborJJ niceJJ guyNN,1
MillionsNNS comingVBG pushNN alreadystrugglingVBG infrastructureNN pastIN breakingNN pointNN,0
GettingVBG someoneNN elseRB dirtyJJ workNN gotVBD usPRP messNN todayNN,0
WereWRB lettingVBG creaturesNNS flowJJ openlyRB airNN seaNN portsVBZ performingVBG muchJJ backgroundNN testNN,1
TakeVB backRP saidVBD IPRP reportVBP,0
CanMD suggestVB localsNNS getVB behindsNNS letsVBZ traitorsNNS knowVBP antiwhiteJJ festivalJJ welcomeJJ townNN 828CD,1
TheDT professesVBZ NationalistNN,1
RightJJ mainstreamNN,0
WhyWRB tryVB civilizeNN cannotNN domesticatedVBN civilJJ,1
AgreedVBD TheDT HispanicsNNPS schoolNN worseJJR educationNN childrenNNS whitesNNS likeIN mightMD competeVB childrenNNS whitesNNS,1
WhenWRB IPRP lastJJ timeNN wentVBD sawVBD littleJJ blackJJ monkeyNN childrenNNS swimmingVBG funniestJJS thingNN watchingVBG dryingJJ waterNN facesVBZ looksVBZ exactlyRB likeJJ baboonNN somethingNN wayNN whitesVBZ certainJJ mannerismsJJ thingsNNS completelyRB apelikeIN onesNNS,1
TheyPRP showVBP footballNN iceNN hockeyJJ AmericanJJ garbageNN showsNNS,0
HonestlyRB everRB firedVBN IPRP expectVBP damageNN sinceIN averageJJ negroJJ lacksNNS intellectVBP basicJJ firearmsNNS trainingVBG,1
IPRP blameVBP likeIN citiesNNS multiculturalJJ hellNN,1
iveJJ feltVBD angerJJ readVB forumJJ partNN speakingVBG loudJJ voiceNN factNN exampleNN europeVBP factNN pasedVBN tvNN newsNN newsNN paperNN knowsVBZ enemiesNNS firstJJ passNN vicoryNN,1
WellRB thinkVB factNN goesVBZ showVB mustMD colonisedVBN landNN somaliesNNS,0
YouTubeNN,0
heyNN definitlyRB knowVBP goingVBG reserveJJ officerNN townNN bustJJ crackNN dealersNNS betterRBR enjoymentNN watchNN oneCD squirmNN sentVBD riverNN townNN mostlyRB alreadyRB knowVB busyJJ officerNN,0
SoRB getJJ reparationsNNS greatJJ grandJJ parentsNNS sufferingVBG plusCC,1
OneCD ChineseJJ getVB teethJJ countryNN takeVB,1
MaybeRB spreadJJ intoleranceNN,1
forcingVBG cultureNN usPRP,1
ManyJJ mastersNNS desireVBP,1
SinceIN littleJJ kidsNNS ntRB wantVBP rudeJJ uglyRB blackJJ kidNN comparedVBN othersNNS evenRB adorableJJ kindaNN scaryJJ lolNN,1
TheyPRP receiveVBP housingNN welfareNN taxpayerNN expenseNN breedingNN likeIN cockroachesNNS,1
messageNN,0
TheDT poorJJ sodNN srceamingVBG wholeJJ timeNN,0
TheDT thingNN disgustingVBG womanNN groidNN womanNN dragsVBZ childNN filthNN,1
TheirPRP$ singingNN cuteNN,0
ToTO ReportedVBD LastJJ 425CD 9CD 01CD pmNN ThisDT happensVBZ makeVB friendsNNS spearchuckersNNS,1
YouTubeNN,0
WhyWRB LeadsVBZ MathematicsNNS,0
OhUH IPRP ntVBP knowJJ possibilityNN sentenceNN useNN valuesNNS,1
TheyPRP StVBP freeJJ bookNN,0
laughingVBG TheDT usingVBG lostVBD goVB eatJJ watermelonNN shootNN diceNN somethingNN,1
WhenWRB someoneNN goingVBG standVBP lawsNNS OrdersNNS,0
halfNN scottishJJ halfJJ germanJJ,0
SomethingVBG,0
SometimesRB picturesVBZ worthJJ thousandCD wordsNNS,0
JustRB watchVB likeIN blackJJ sportNN playersNNS slangVBP,1
TheyPRP sellVBP mayMD neededVB oneCD dayNN,0
WellIN ItPRP wouldMD upliftingVBG peopleNNS threwVBD headfirstRB behindIN racialJJ loyaltyNN makeVBP individualJJ sacrificeNN groupNN individualJJ makeNN decisionNN,0
TheDT ghettoJJ northNN,1
IPRP sentVBD applicationNN daysNNS agoRB curiousJJ,0
ThisDT landNN foundedVBD whitesNNS whitesNNS IPRP preferVBP punishJJ symptomJJ urbanJJ decayNN ratherRB zowgCD figureheadNN,1
playedVBD fundamentalJJ roleNN journeyNN revisionNN alwaysRB gratitudeVBP,0
soundsNNS likeIN leicesterNN mateNN stillRB porrVBZ comradesNNS liveVBP brightonNN lookNN windowWP seeVBP sightJJ 50CD thousandJJ queersNNS strttingVBG streetNN,1
deserveNN leastJJS tasteNN helpingVBG whiteJJ liberalsNNS JewsNNPS pushVBP usPRP IPRP ntVBP thinkVB allowJJ destroyNNS thoughIN,1
IPRP gotVBD pmJJ cliamsNNS writeVBP magazineNN enoughNN saidVBD,0
ItPRP wholeVBD newJJ wormsNNS governmentNN,1
IPRP wouldMD ntVB marryNN asianJJ evenRB cirurgyVBP,1
httpsNN petitionswhitehousegovpetNN nment1wrvtnglIN httpsNN petitionswhitehousegovpetNN nmentBmdWCP8BRB httpsNN petitionswhitehousegovpetNN nmentD87Rv7yJJJ httpsNN petitionswhitehousegovpetNN nmentl76dWhwNJJ httpsNN petitionswhitehousegovpetNN nmentRskKYzB6JJ httpsNN petitionswhitehousegovpetNN nment51jYVZ5LIN httpsNN petitionswhitehousegovpetNN nmentKL6qrls8JJ httpsNN petitionswhitehousegovpetNN nmentpgJ9JLY3JJ httpsNN petitionswhitehousegovpetNN nmentRYvjgdDTJJ httpsNN petitionswhitehousegovpetNN nmentrx1KDYTsJJ httpsNN petitionswhitehousegovpetNN ationX3kWX8kFNN httpsNN petitionswhitehousegovpetNN nmentVd92R3YGJJ httpsNN petitionswhitehousegovpetNN nment2TvhJSSCJJ httpsNN petitionswhitehousegovpetNN rnmen9M9rdL8nNN httpsNN petitionswhitehousegovpetNN nmentlWDshfl3JJ httpsNN petitionswhitehousegovpetNN nmentlqPGbvVlJJ httpsNN petitionswhitehousegovpetNN nmentRSBkpCf9JJ httpsNN petitionswhitehousegovpetNN nmentk6LhPsBXJJ 2CD httpsNN petitionswhitehousegovpetNN nmentzXYY751DFW httpsVBZ petitionswhitehousegovpetNN nment022SsMWpJJ httpsNN petitionswhitehousegovpetNN nmentkT8FL7NgNN,0
tryNN createNN largerJJR protestNN,0
thankJJ supportNN UkrainianJJ brothersNNS,0
AmericansNNPS actingVBG likeIN knowNNS talkingVBG,0
AlsoRB IPRP agreeVBP fairJJ monkeysNNS compareVBP blackJJ peopleNNS,1
anyoneNN elseRB heardVBD,0
StillRB snoopingVBG ehNN,0
showingVBG AsianJJ functionalJJ illiteracyNN,1
YouPRP differentJJ manipulatingVBG JewNN,1
saveVB usPRP,0
IPRP ntVBP hateJJ AsiansNNPS IPRP respectVBP AsiansNNS,0
TheDT problemNN wellRB eventuallyRB runVB placesNNS hideJJ gameNN,1
ThoseDT AsiansNNPS wouldMD continueVB imitateVB WhitesNNS gainVBP upperJJ handNN showNN superiorJJ,0
majdNN egyutestJJS alakitokNN esNN csinalunkNN joNN hazafiasNN bulikatNN,1
HowWRB muchJJ wantVBP betJJ ntJJ blackJJ maleNN runningVBG operationNN YouPRP countVBP whiteJJ peopleNNS innovativeJJ,1
TheDT JewsNNPS RomansNNPS murderNN falselyRB accusingVBG turningVBG chanceNN pardonNN,1
ÞáJJ varNN ogVBZ miklirJJ umbrotatímarJJ íNN,1
AndCC floodJJ whiteJJ countriesNNS muchRB,1
ThenRB liveJJ globalJJ utopiaJJ runningVBG showNN cantJJ waitNN shortJJ brainNN transplantNN goingVBG raiseNN,1
ThisDT baseNN coreNN packNN ratherRB 3CD dayNN sevenCD dayNN trunkVB foreverRB kitNN,0
httpmoviesnytimescom20090206movies06shorhtmlYouTubeNewBoyhttpwwwgetthebigpicturenetblogmnewboyhtmlNN,0
WePRP needVBP makeJJ sureJJ everyDT whiteJJ childNN adultNN fedVBN worryJJ helplessJJ peopleNNS eatVBP cowJJ crapNN orderNN surviveNN,1
IPRP summerNN jobNN planedVBD imJJ goinNN 10thCD nextJJ yearNN,0
shamelessNN,0
generalJJ looksVBZ badJJ shapeNN,0
endedVBD hawkingVBG cannonJJ salvageNN companyNN 13000CD blockNN easternJJ accordingVBG policeNNS reportNN filedVBN conjunctionNN arrestNN,0
ConstantJJ movementNN,0
IPRP guaranteeVBP worseJJR,0
NothingNN everRB harmfulJJ societyNN jewsNNS savageNN beastsVBZ thoughtlessJJ gimmiegruntsNNS,1
subNN humanJJ groupNN negroidNN belongIN poorJJ horseNN gotVBD infectionJJ dirtyNN pervertNN,1
NOWNN,0
ItPRP alwaysRB niceJJ meetNN peopleNNS viewsNNS,0
TheyPRP wantVBP mixedJJ kidsNNS,0
OrCC stayVB hellRB awayRB cheapJJ crapNN ar15sNN getVBP damnVBN reliableJJ plinkerNN 700CD brandNN newJJ,0
IPRP liveVBP racemixingVBG hugeJJ problemNN,1
TheDT peopleNNS runningVBG groundNN wantVBP wipeNN,0
ItPRP nothingNN bunchNN mexicansNNS,1
CongratsNNS IPRP hopeVBP happyJJ longJJ livesVBZ togetherRB,0
YourPRP$ courageNN honestlyRB apprecatedVBD,0
IfIN IPRP UkrainianVBP IPRP signVBP pactNN devilJJ getNN ridJJ jewdoislamNN,1
IPRP pmVBP suggestionJJ placeNN goVBP IPRP wantVBP postNN IPRP thinkVBP nonwhitesNNS readVBP siteNN proceedVBN tryNNS moveVBP,1
WhitesNNS gloryNN impossiblyRB largeJJ hordesNNS nonwhitesNNS,1
WhyWRB wouldMD IPRP wantVB contributeNN spicNN wellbeingVBG,1
TheseDT idiotsNNS hastenVBP getVBP freeJJ rideNN heavenNN,1
AndCC stillRB waterNN endsVBZ topJJ oilNN bottomNN,0
IPRP hopeVBP IPRP seeVBP dayNN theaseVB worthlessNN piecesNNS crapVBP,1
alsoRB linkedVBD 2009CD murderNN rapeNN caseNN,0
TheDT wayNN dealNN animalsNNS giveVBP oneCD wayNN ticketNN filthyJJ pigNN godNN,1
MyPRP$ strategyNN targetingVBG churchesNNS rideVBP bikeIN aroundIN churchNN parkingNN lotNN massNN tossNN businessNN cardsNNS parkedVBD carsNNS IPRP ridingVBG,0
ItPRP welcomeJJ changeNN seeVBP fellowJJ seeingVBG hundredsNNS leftyJJ bastardsNNS goingVBG seeNN,1
WhenWRB nonwhitesVBZ comeVBP standVBP togetherRB sendVB emRB packingVBG likeIN usPRP,1
PerhapsRB proudJJ indigenousJJ inhabitantsNNS ntNN wantVBP cultureNN enrichingVBG ruiningVBG tripeNN likeIN,1
EveryDT actionNN takenVBN revealsNNS completelyRB unacceptableJJ citizenJJ societiesNNS blacksNNS brownsVBP wreckNN destroyNN doneVBN,1
awayRB,0
SoRB thereforeRB dumbJJ brutesNNS likeIN blacksNNS,1
88CD InIN endNN victoryNN,0
NoDT needNN allowVB getVB wayNN goodJJ guiltNN messageNN jewNN laughsVBZ loudlyRB,1
legtobbVBZ antirasszistaNN akiNN megNN nemJJ azNN felNN kimondaniNN azNN erzelmeitNN mertNN ezJJ sajnosNNS multikulturalizmusVBP oraszagaNN,1
TheDT guyNN givingVBG beatingNN couldMD possiblyRB IPRP wouldMD seeVB muchJJ clearerJJR videoNN IPRP giveVBP honorJJ callingVBG,0
skinVBD althoughIN headNN shavedVBD timesNNS,0
IPRP poppedVBD minuteNNS sayVBP quickJJ TheDT friendNN,0
IPRP sawVBD showVBP longRB agoRB,0
IPRP thinkingVBG wouldMD lookVB slightlyRB placeNN ghettoNN heyNN opinionNN,0
looksVBZ likeIN prettyRB goodJJ placeNN liveVBP anywhereRB lotsNNS snowVBP alwaysRB looksRB goodJJ,0
gayNN negroRB forcedVBD workNN firstRB jobNN highJJ schoolNN sunnyVBD floridaNNS,1
ShePRP probablyRB victimVBD groidJJ rageNN rapeNN alsoRB,1
ItsPRP$ blacksNNS fallVBP goodJJ uppercutJJ directJJ chinNN twoCD wellRB fitJJ blacksNNS causeVBP weakerJJR chinsNNS whitesNNS,0
TheyPRP ntVBD evenRB claimJJ whiteJJ parentNN,0
ThenRB nonwhitesVBZ seekVBP usPRP findVBP usPRP whitesVBZ hideNN,1
YourselfPRP,1
IPRP longRB lovedVBD balletsNNS operasVBP IPRP enjoyVBP RussianJJ traditionalJJ musicNN wellNN,0
EverythingVBG symbiosisNN westernJJ nationNN becomingVBG comeVBD anythingNN representsVBZ JewishJJ traditionsNNS symbolNN hateNN,0
IPRP remindedVBD quoteNN IPRP heardVBD fellowJJ whiteJJ nationalistNN saidVBD cleanJJ pileNN middleNN,1
NothingVBG specialJJ brandNN spankingVBG newJJ wordNN,0
nuCC harJJ jagNN ocksaNN forloradNN minNN ochMD farRB inteVB harJJ enFW nyaFW,1
NoDT truthNN 88WHITECD,1
IfIN linkVBN sendVBP perhapsRB figureNN basedVBN contextNN,0
ActualJJ namesNNS placesNNS couldMD transmittedVB usingVBG functionNN,0
happensVBZ wantVBP takeVB thinkNN wantVBP dateNN oneCD negroNN womenNNS,1
EveryoneNN keepVB spreadingVBG videosVBP aroundIN internetNN soonRB winJJ warNN,0
longJJ ntRB paradeJJ cityNN demandNN gayNN rightsNNS keepVB closedVBD godNN damnitNN homosexualityNN ntRB exatlyRB somethingNN proudJJ,1
SomethingVBG mustMD doneVBN haltNN terribleJJ waveNN immigrantsNNS enteringVBG,1
ledVBD believeVBP soccerNN inventedVBD 1066CD,0
IPRP lookingVBG joinNN emailNN antoniopuffihotmailcomNN IPRP loyalVBP whiteJJ readyJJ fightNN,0
WePRP wentVBD feetNNS floorNN IPRP woundVBD topJJ securedVBN rightJJ armNN gotVBD rollingJJ armbarNN,0
ItPRP quiteRB farcicalJJ actuallyRB,0
TheDT babyNN wavingVBG armsNNS legsNNS,0
TheyPRP putVBD careersNNS firstRB,0
TNBNN,1
femaleJJ negroidJJ assaultingVBG womanNN,0
SoRB sickJJ wayNN workingVBG IPRP rememberVBP IPRP growingVBG littleJJ shopsNNS whiteJJ runnedVBD ownedVBN wouldMD hireVB peopleNNS communityNN greatJJ helpedVBD peopleNNS keptVBD streetsNNS safeJJ evenRB thoughIN othersNNS wouldMD causeVB bullNN wasntNN anythingNN,1
YeahNN IPRP sawVBD newsNN segmentNN mixedJJ raceNN coupleNN lostVBD homeNN mudslideNN,1
YourselfPRP,1
SomehowRB IPRP thinkVBP maybeRB trollNN,1
IPRP escortedVBD campjailNN 2CD polishJJ policemanNN denyingquestioningVBG hoaxacuastJJ illegalJJ,1
IPRP drivingVBG nearIN ItPRP darkiesNNS,1
IfIN liesNNS moneyNN wouldMD richestVB negroJJ worldNN,1
YouPRP forgetVBP,0
IPRP substituteVBP teacherRB lateJJ 1990CD,0
ThenRB seeVB afraidJJ leaveVBP thierVBN homesNNS darkJJ ventureNN wrongJJ hoodNN,1
ImNN allowedVBN useIN negroJJ inventionsNNS,1
TheDT powersNNS wantVBP WhitesNNS dumbedVBD bloodNN,1
ThereEX doubtVB ChineseJJ givingVBG worldNN cultureNN,0
imJJ irishJJ nsNN skinNN idNN likeIN hearJJ skinNN nonskinFW nsJJ girlsNNS aroundIN worldNN 88CD,0
HowWRB muchJJ longerJJR goingVBG waitRBR takeVB careNN,1
ÐJJ 34CD YouTubeNN,1
TheDT FansNNS,0
cartNN backRB poopNN riverNN nextIN deadJJ grandJJ parentsNNS,1
yesCD yearNN 2014CD stillRB hidingVBG behindIN wallsNNS militaryJJ insteadRB embracingVBG fellowJJ HumansNNS,0
ntCC killingVBG fastRB enoughRB,1
ThisDT completelyRB disgustingVBG continueJJ houseNN peopleNNS completeJJ contemptVBP usPRP lawsNNS customsNNS,1
ekoNN soccerNN playerNN ekoJJ peopleNNS,0
AsIN soonRB getVB littleJJ smarterJJ figureNN attachNN picsNNS oneCD ntNN workNN,0
MyPRP$ momNN blueJJ eyesNNS dadVBP greenJJ eyesNNS IPRP gotVBD eyesNNS,0
12CD 2011CD 1pmCD,0
YouPRP eitherCC standVB peopleNNS standVBP deadJJ bodyNN,1
GoingVBG signNN ThroughIN rightJJ mailNN firstJJ thingNN tomorrowNN morningNN,0
MeanwhileRB nonwhitesNNS continueVBP breedVB evenRB nonwhiteJJ societiesNNS continueVBP inflictJJ harshNN uncivilizedJJ nonwhiteJJ cultureNN usPRP,1
IPRP ntVBP evenRB watchVBP TVNN anymoreRB constantJJ antiWhiteNN biasNN madeVBD completelyRB worthJJ,0
IPRP knowVBP fullJJ blacksNNS reallyRB badJJ realJJ whiteJJ folksNNS tryingVBG moveNN overpricedVBD liberalJJ assumptionNN,0
HePRP despisedVBD nationalistNN thereforeRB stoodVBD everythingNN ieJJ proFW familyNN valuesNNS proudJJ cultureNN etcNN,0
IPRP findVBP BBCJJ storyNN impossibleJJ believeVBP httpnewsbbccouk2hiafrica4971848stmNN ntCC lookVB latrinesNNS businessNN whereverNN happenVB,0
IPRP sayVBP,0
YourselfPRP,1
ThenRB createJJ styleNN schoolNN systemNN dumbJJ reduceVB obedientNN globalJJ citizensNNS,1
AimeeNN,0
PutVBN TogetherRB ADT 52mCD PackageNN ForIN InIN TheDT OfIN,0
ItPRP storyNN anotherDT fifteenJJ yearsNNS,0
AndCC secondJJ whitesNNS smarterRBR asiansNNS everRB lookVBP bodybuildingVBG contestsNNS seeVBP whitesNNS maybeRB oneCD 2CD blacksNNS,1
TheyPRP probablyRB slowlyRB removeVB disciplineNN whateverWDT makeVBP schoolsNNS worseJJR worseJJR,1
greatJJ depresionNN manyJJ yearsNNS goVBP wentVBD outsideJJ lawNN makeVBP livingVBG cantNN findVB jobNN nothingNN eatNN peopleNNS mentionedVBD neverRB wentVBD trialNN neverRB convictedVBD,0
TheyPRP needVBP whiteJJ maleNN distractedVBD muchJJ possibleJJ courseNN glorificationNN groidVBD twoCD birdsNNS oneCD stoneNN,1
IntellectualJJ moronsNNS educatedVBN idiotsRB goodJJ phrasesNNS describeVBP,1
HowWRB oneCD commercialsVBZ homeNN burglaryNN alarmNN keepVB runningVBG televisiontheJJ criminalsNNS breakingVBG surprisealwaysNNS whiteJJ,0
sureJJ heardVBN dayNN friendVB toldVBD heardVBN soonRB governmentNN requireVBP usPRP chipNN putVBD skinJJ handNN,0
undNN,1
sensiNN knowsVBZ breakVB kataJJ showNN moveNN moviesNNS applyVBP certianJJ kindNN attackNN,0
SoRB pleaseJJ goodJJ littleJJ kaffirNNS takeVBP landNN,1
TheDT nonJJ whiteJJ homelandsNNS muchJJ trashNN crimeNN nonNN whitesVBZ mainlyRB chooseJJ stayVB awayRB,1
hopeNN patriotsNNS throuVBP eggsNNS sayVBP thingNN likeIN getVBP jungleJJ thinkVBP coachNNS makeVBP goVB trainnigJJ minusCC 30CCD 50FCD uuuuJJ neverRB ableJJ playNN aganeNN flyNN africaIN firstJJ tranningNN 2508CD,1
ItPRP reallyRB pissesVBZ liberalJJ leftistNN,1
DoVB nonDT reallyRB thinkVBP measureNN WhitesNNS,1
MenNN detVBZ serJJR utJJ somNN omNN duNN erNN littNN usikkerNN mhtNN degNN selvNN nårNN duNN frågarNN omNN nesenCD dinNN,1
IPRP sawVBD firstJJ timeNN dayNN IPRP wouldMD sayVB,0
talkNN ganderNN mountainNN wayNN wantedVBD 700CD bucksNNS glockVBP 19CD toldVBD 549CD acadamysNNS matchedVBD,0
YouPRP knowVBP wheatJJ cornNN growNN prettyIN fastNN,0
ThanksNNS,0
WhitesNNS getVBP alongRB AsiansNNPS muchJJ blacksNNS HispanicsNNS,0
IPRP readVBP FrenchJJ diedVBD bombingVBG casualtiesNNS sustainedVBD fightingVBG GermansNNS 1940CD,0
ItsPRP$ timeNN nationNN takeVB mattersNNS handsNNS throwJJ governmentNN stopVBD whiteJJ genocideJJ deportNN immigrantsNNS establishVB governmentNN helpNN indigenousJJ whiteJJ BritonsNNPS rebuildVBP countryNN,1
TheyPRP wasteVBP spaceNN filthyJJ taxNN payerNN robbingVBG mentallyRB challengedVBN primitiveJJ unintelligentJJ culturalJJ trashNN,1
IPRP guessRB goodJJ thingNN ntJJ letNN walkVB moonVB heavenJJ knowsNNS wouldMD happennedVB,0
IPRP ntVBP wantJJ throwJJ lifeNN awayRB,0
lookingVBG intelligentJJ manNN senseNN humorNN agesNNS 2132CD,0
NoDT wonderNN badJJ shapeNN tribeJJ chargeNN,1
YouPRP defendVBP riotsNNS happeningVBG acrossIN countryNN invadersNNS floodingVBG acrossIN bordersNNS,1
LetVB useVB longJJ armsNNS throwVBP monkeyJJ punchesNNS letVBP usPRP WhitesVBZ useIN wrestlingVBG takedownsNNS submissionsNNS,1
WhatWP,0
IPRP speakVBP twoCD,0
holeJJ areaNN naturalJJ resourcesNNS madeVBN mudNN hutsNNS wildJJ lifeNN ableJJ makeVB evenRB betterJJR hutsNNS ieJJ birdsNNS,1
IPRP cannotVBP comprehendJJ EuropeansNNPS liveJJ dailyJJ livesNNS,0
TheDT filthyJJ apeNN gaveVBD horseNN infectionNN,1
IPRP wouldMD ntVB worryRB muchJJ,0
ADT becsületNN napjásNN videóNN nagyonJJ tutiNN mindigNN amikorNN nézekNN felvételeketNN vagyNN ismerőseimNN barátaimNN mesélikNN hihetetlenVBN sajnálomJJ hNN tanévNN pontNN esikVBZ hJJ nemJJ tudokNN ottNN lenniNN,1
IPRP wantedVBD getNN opinionsNNS membersNNS crapNN sonNN broughtVBD homeRB publicJJ schoolNN,1
ItPRP importantJJ peopleNNS realizeVBP gaysNNS wantVBP gayJJ marriageNN desireNN sortNN governmentNN paperworkNN seekingVBG rightJJ adoptNN defenselessNN childrenNNS,1
IPRP thinkVBP funnyJJ premedVBN studentNN ntJJ blackJJ personNN withinIN hundredVBN milesNNS classesNNS everRB,1
IPRP thinkVBP greatJJ siteNN informativeJJ,0
OnlyRB mindVBZ couldMD evilVB machinationNN tickerNN tapeNN paradeNN liesVBZ cookedVBN,1
foundVBD newJJ pageNN groidJJ reportNN rapeNN,1
withmitVBP andundNN,1
ItPRP sittingVBG shelfPRP IPRP planVBP readJJ chapterNN everyDT eveningNN,0
WhatWP talkingVBG,0
IfIN stopVBN eatingNN costNN muchJJ,0
tellingVBG somewhereRB putVBN claimNN abusedVBN orphanageNN oneCD religiousJJ ordersNNS,0
ThisDT disgustingVBG wantsVBZ liveJJ,1
knowsVBZ prettyRB muchJJ thirdJJ worldNN countryNN,0
IPRP littleVBP kidJJ IPRP usedVBD schoolNN somehowRB spokeVBD jewJJ dudeNN gotVBD narcissisticJJ laughNN everyDT blondeNN jokeNN favoriteJJ blondNN wentVBD donateJJ semenNNS usingVBG mouthJJ containerNN sadJJ blondsNNS faultNN alsoRB letVBD happenVB,1
ForIN callJJ soulNN economicalJJ meanNN,0
NearlyRB everythingNN actsNNS liberalsNNS carryVBP damageVB nationNN peopleNNS,1
goVB wwwlimerickpostieJJ storyNN typicalJJ liesVBZ blackJJ laughingVBG wayNN bankNN robNN manNN,0
courseNN woMD ntVB wantJJ stealNN landNN wouldMD ntVB stopVB deadJJ neitherDT wouldMD,1
TheDT attacksNNS comingVBG wankersNNS liveVBP maybeRB evenRB bornJJ littleJJ EnglishJJ ancestryNN callNN BritishJJ,1
stopVB tryingVBG negroJJ proveVB rightJJ,1
ProbablyRB twoCD minimumJJ wageNN partNN timeNN jobsNNS waitNN whitesNNS needVBP applyVB,0
TheseDT sadJJ timesNNS,1
princeNN marriedVBD asianJJ freakNN imagineNN halfNN halfJJ kidsNNS growingVBG tryingVBG marryNN royalNN familiesNNS,1
bottomNN lineNN withoutIN strongJJ familyNN behindIN youngJJ girlNNS vulnerableJJ TheDT knowsVBZ usingVBG mediaNNS powerNN seeVBP resultsNNS,1
TheyPRP alwaysRB takeVBP somethingNN someoneNN elseRB makeVB,1
TheyPRP ntVBP knowVBP stopVB breedingNN,0
SometimesRB IPRP wonderVBP BecauseIN WhitesNNS muchJJ smarterJJR findVB harderRBR runVB togetherRB opposedVBN independentlyRB,1
IPRP greenJJ eyesNNS wellRB mineVB blueJJ ringVBG aroundIN outsideIN,0
IPRP wouldMD surprisedVBD womanNN specificallyRB targetedVBD localJJ townNN abominableJJ treatmentNN,1
NoDT doubtNN bulkNN votesNNS cameVBD everRB growingVBG chineseJJ immigrantJJ communityNN aroundIN,1
YeaNN IPRP hateVBP geysersNNS bloodVBD comeJJ shootingNN gravesNNS,0
TheirPRP$ godsNNS oftenRB paleJJ skinFW blueJJ eyesNNS IPRP supposeVBP literacyNN ntJJ valuedVBN highlyRB culturalJJ intelligenciaNN,1
