TheDT contextNN seemsVBZ usedVBN describeNNS personNN EuropeanJJ heritageNN pureNN bloodNN lineNN ieVBP JewishJJ bloodNN ectNN,0
BreaksNNS heartNN,1
StoriesNNS likeIN sadNN,0
YetRB daughterNN stillRB wantsVBZ goVB outsideJJ playNN thingNN,1
BeingVBG copJJ quicklyRB openJJ eyesNNS joysVBZ diversityNN,0
TheDT wayNN ableJJ photoNN likeIN todayNN hireNN actorsNNS,0
WePRP manyJJ foreignersNNS countryNN fearVBP futureJJ EnglishJJ peopleNNS,1
putVB awayRP goodJJ,1
IPRP knowVBP feelVB luckilyRB lastJJ yearNN schoolNN almostRB otherwiseRB IPRP wouldMD sayVB lookVB independentJJ studyNN putVBD filthRB publicJJ educationNN systemNN,1
HereRB oneCD videoNN IPRP madeVBD uploadJJ youtubeNNS hopeVBP likeIN,0
IPRP understandVBP proudJJ peopleNNS wellRB definedVBN beliefsRP fightingVBG amongstNNS reallyRB counterproductiveJJ,0
YahNN IPRP guessVBP,0
httpswwwstormfrontorgforumt1020784NN httpsNN wwwstormfrontorgforumt102NN ghlightVBD swedenJJ httpsNN wwwstormfrontorgforumt102NN ghlightVBD swedenJJ httpsNN wwwstormfrontorgforumt101NN ghlightVBD swedenJJ httpsNN wwwstormfrontorgforumt101NN ghlightVBD swedenJJ httpsNN wwwstormfrontorgforumt100NN ghlightVBD swedenJJ httpsNN wwwstormfrontorgforumt100NN ghlightVBD swedenJJ httpsNN wwwstormfrontorgforumt100NN ghlightVBD swedenJJ saveNN,1
TheyPRP beatingVBG deathNN everywhereRB lookVBP,1
IfIN wayNN wouldMD whitesVB payVB taxesNNS blacksNNS couldMD collectVB welfareNN provedVBN incapableJJ feedingNN,1
TheDT whiteJJ blackJJ factNN voteNN reichVB fightingVBG menNNS,0
ManyJJ manyJJ wantedVBD opportunityNN rapeNN murderNN whitesNNS guiseVBP warNN,1
IPRP guessVBP retailJJ districtNN smashedVBD lootedJJ,1
IPRP likeVBP outfitRB dressedVBN simianJJ looksNNS regalVBP,1
tottaNN kaiNN,1
IPRP wentVBD oldJJ friendNN dayNN drinksNNS,0
2508CD,0
surprisedVBD wasntNN mentionedVBD alwaysRB smashNN neoNN nazisRB pressNN bestJJS,1
makingVBG tagNNS alongIN,0
ItPRP becameVBD boomingJJ blackJJ townNN ranVBD straightRB groundNN,1
IPRP ntVBP blameJJ yuckyJJ nonwhiteJJ DNANN pawingVBG foodNN passNN scannerNN disgustingVBG,1
BecauseIN communistNN partyNN almostRB jewNN killNN gentileJJ stoodVBD wayNN propertyNN jewNN communistNN wantedVBD,1
NextJJ weekNN ThanksgivingVBG,0
YouPRP loyalVBP punkJJ deadJJ menNNS wouldMD underbidVB laborNN slavesNNS negroVBP raceNN,1
AnotherDT updateNN videoNN photosNNS gvideoVBP httpvideogooglecomvideoplayNN docidNN 5268894597794277031CD gvideoNN,0
FirstRB worldNN WePRP afraidVBP standVBP SovietJJ terrorNN IPRP takeVBP greatJJ prideNN seeVBP TheDT largerJJR articleNN mayMD findVB httpwwwmblismmfrettirinnlentJJ mlNN nidNN 1083256CD,0
TheyPRP movingVBG townNN,0
IPRP thinkVBP asiansNNS hotJJ arentJJ girlsNNS IPRP wannaVBP getVB withAJJ wolfNN prettyRB wannaJJ petJJ oneCD girlsNNS onesNNS trustedVBD,1
CheckVB,0
IPRP actuallyRB takeVBP lawNN classesNNS degreeVBP WhatWP citedVBD impossibleJJ treatNN peopleNNS equallyRB behaviorVBP,0
actuallyRB noticedVBD copsNNS tendVBP shareNN beliefsJJ governmentNN relatedVBD professionNN,0
IPRP hopeVBP classesNNS futureJJ,1
TheirPRP$ nonwhiteJJ societiesNNS failingVBG everyDT areaNN yetRB tryingVBG forceNN civilizationNN acceptRB backwardRB nonwhiteJJ cultureNN,1
IPRP meetVBP lotRB weeksNNS backRB shockedVBD seeNN lightJJ skinnedVBD lightJJ brownJJ hairNN blueJJ eyesNNS EuropeanJJ facialJJ featuresNNS,0
MyPRP$ beautifulJJ blondeJJ hairNN blueJJ eyedVBN nieceJJ turnedVBD 2CD yesterdayNN dutyNN educateVB teachJJ whiteJJ valuesNNS heritageVB futureJJ whiteJJ raceNN somedayNN bringVB beautifulJJ whiteJJ childrenNNS wolrdNN,0
disgraceNN placeNN looksVBZ likeIN townNN africaVBP nowTheJJ dayNN becomesVBZ muslimJJ countryNN dayNN stopVB breathingNN,1
IPRP wantedVBD runNN politicsNNS wellRB IPRP realizedVBD hopeNN societyNN wayNN liberalJJ,0
23CD SupremacistNNPS TheDT 23rdCD letterNN alphabetNN OverIN svegaVBD 100CD 100CD 100CD postoNN,0
ButCC IPRP wantVBP brownJJ babyNN likeIN girlsNNS estateNN,1
MyPRP$ tracedVBD familyNN treeNN backRB quiteRB farRB,0
welcomeVBD,0
headingVBG putVBD signJJ gatesVBZ readVBP NoDT savageNN negroRB,1
IPRP useVBP YouTubeJJ lotNN IPRP seeingVBG phraseNN,0
YouPRP weatherVBP zionistJJ stormNN wellRB brotherRB,1
OftenRB rosyJJ cheeksNNS wellRB,0
IPRP ntVBP knowJJ standNN livingVBG HispanicJJ 279456CD 700CD aloneRB 64993CD 163CD aloneRB 47622CD 119CD AsianJJ aloneRB 3649CD 09CD TwoCD racesNNS 2642CD 07CD OtherJJ raceNN aloneRB 676CD 02CD AmericanJJ aloneRB 361CD 009CD NativeJJ HawaiianJJ OtherJJ aloneRB 58CD 001CD profileJJ populationNN mapsNNS realJJ estateNN averagesNNS homesNNS statisticsNNS relocationVBP travelNN jobsNNS hospitalsNNS schoolsNNS crimeNN movingVBG housesNNS newsNN sexNN offendersNNS,1
loveVBP liveCD OntarioNN,1
jobNN fagsNNS keepVB searchingVBG cureNN neverRB findVBP oneCD keepsVBZ changingVBG mutatingVBG alreadyRB 60CD percentNN faggotVBD apesNNS continuesVBZ growVB,1
WhatWP happenedVBD songsVBZ gamesNNS ntIN likeIN singingVBG EnglishJJ sentNN thunderNN lightingVBG somethingNN offtopicNN IPRP postVBP somewhereRB ntJJ wantVBP makeVBP newJJ topicNN,0
WhenWRB refuseNN convertNN learnJJ endNN,0
RaisingVBG 1CD healthyJJ raciallyRB awareJJ childJJ worthNN libtardRB mudJJ childrenNNS worldNN,1
ADT 20CD yardsNNS IfIN 3CD feetNNS 1CD yardRB WhatWP distanceNN feetNNS 20CD yardNN footballNN passNN,0
IPRP reallyRB worriedVBD oneCD IPRP thoughtVBD bunchNN groidsNNS goingVBG hopNN carsNNS signifyingVBG townNN getNN excitedJJ womenNNS removeVB clothingNN,1
nothingNN moralityNN geneticsNNS,0
YouPRP mayMD wantVB cutJJR milkNN watchNN,0
YouPRP tryVBP thingNN buildJJ thingsNNS,0
CowardlyRB scumJJ countrysideNN biggingVBG armyJJ jacketsNNS,1
IPRP ratherRB cleanJJ dozenNN tioletsNNS dayNN walkVBP bathroomNN seeVBP mongrelJJ standingVBG mopNN givingVBG glassyeyedVBN stareNN,1
OnlyRB brainwashNN followersNNS,1
MyPRP$ fatherNN sisterNN blondeNN hairNN lightJJ blueJJ eyesNNS,0
JustRB placeNN calledVBD placeNN calledVBD,1
IfIN smallJJ nonwhitesNNS wouldMD everywhereRB manyJJ whitesNNS liveVBP rurallyRB smallJJ townsNNS ntJJ seeVBP racialJJ disasterNN unfoldingVBG,1
stinkVBP bombNN eventNN getsVBZ darkJJ chuckNN bunchJJ floorNN differentJJ spotsNNS chimpsNNS startVBP jivingVBG groovingVBG stepNN,1
sortNN understandVBP comingVBG plentyNN whitesNNS soldVBD usPRP riverVB speakJJ althoughIN jewNN alwaysRB backgroundRB complicatedVBN everRB findVBP truthJJ somaliansNNS scumaliansNNS,1
entanglementNN wouldMD indicateVB quantaJJ communicateNN fasterRBR speedNN lightNN,0
AsIN alwaysRB videoNN filledVBD truthNN,0
NotRB goodJJ newsNN happensNNS EuropeanJJ nationsNNS doubtVBP pushedVBN likesNNS JewsNNS likeIN,1
IPRP hopeVBP UkrainiansNNPS becomeJJ expertsNNS identifingVBG toxicNN mushroomsNNS springingVBG,1
IPRP wouldMD jumpedVBD chanceNN getNN gunJJ birthdayNN,0
IPRP alsoRB dontVBP drinkNNS driveVBP,0
ItPRP madeVBD sickJJ lookingVBG BlacksNNS AsiansNNPS,1
IPRP thinkVBP linkJJ forumNN IPRP mistakenVBP IPRP believeVBP suburbNN,0
cheeseJJ neverRB takingVBG kidsNNS IPRP kidsVBP,0
TheDT kindNN savageryNN femalesVBZ becomeVBN expectedJJ negroidsNNS todaysNNS societyNN,1
DoVB dischargeNN soldiersNNS militaryJJ getVBP lettingVBG stayNN allowingVBG putVBD comradesNNS riskNN,0
IsVBZ universityNN,0
GoodJJ luckNN 11CD,0
ADT mainJJ heroesNNS whiteJJ,0
SoRB excludesRB uneducatedJJ thirdJJ worldersNNS,1
endNN kidsNNS wouldMD preferVB homeNN schoolNN worryVBP thoughIN intelligentJJ experienceNN kidsNNS educatingVBG guessNN couldntRB muchJJ worseJJR publicJJ schoolsNNS thoughIN kindNN planNN farRB socialJJ skillsNNS wouldMD putVB kidsNNS sportsNNS classesNNS likeIN gymnasticsNNS karateVBP,0
IPRP shakeVBP headJJ everyDT timeNN threadNN comesVBZ frontJJ pageNN,0
AtIN distanceNN narrowbandNN compositeJJ imageNN wouldMD 300CD lightyearsNNS acrossIN,0
YouPRP mustMD metVB pointNN timeNN,0
ThereEX hundredsNNS skinsNNS espVBP areaNN,0
returnedVBD 20CD yearsNNS,1
IPRP dispatchedVBD nemberJJ staffNN politelyRB suggestingVBG forumNN wouldMD properlyRB renamedVB landNN playpenVBZ trollsvilleFW,0
TheDT penguinsNNS ntRB indoctrinatedVBN yetRB,1
PutVB mudracesNNS countriesNNS buildVBP fenceNN aroundIN waitNN decadeNN twoCD soonRB backRB stateNN foundVBD numbersNNS decimatedVBN diseasesNNS warsNNS,1
IPRP 25yoCD,0
TheDT absurdJJ thingNN IPRP everRB heardVBD nigNNS sayVBP IPRP quoteVBP,1
IPRP wonderVBP paintJJ plusCC 1millionCD illegalsNNS workingVBG serviceNN industryNN livingVBG bossesNNS cupboardsNNS,1
IfIN wantJJ seeVBP blackJJ kenyanNN muslimeNN createdVBD goVB lookNN latestJJS flickNN UnchainedVBD,1
ToTO whiteJJ patriotsNNS watchVBP learnNN agendaNN criminalsNNS JewishJJ bankersNNS,1
EveryDT timeNN IPRP seeVBP blackJJ securityNN guardNN eitherDT satVBD phoneNN proffesionalismNN whatsoeverNN,1
IPRP spentVBD quiteRB bitJJ timeNN drivingVBG aroundRB newJJ vanNN,0
BeingVBG smallerJJR countryNN quickerNN fillNN ethnicJJ scumNN,1
BecauseIN kosherPRP$ pseudoNN ConservativesNNPS mateVBP ItPRP sadJJ seeVB partiesNNS defameVBP actualJJ revolutionNN,0
GermanJJ,0
MyPRP$ theoryNN diversityNN popularJJ wagonNN burnersNNS wouldMD usPRP believeVB,0
IPRP thinkVBP IPRP tigerVBP momJJ schoolNN aroundRB ageNN 3CD memoriesNNS vagueVBP cueNN songNN saidVBD hoolaPRP$ hoopsNNS satVBD wheneverWRB kidNN steppedVBD mineNN IPRP slappedVBD himherNN,0
YeahUH wayNN IPRP goingVBG schoolNN problemNN likeIN 8CD kidsNNS 12CD childrenNNS usuallyRB,0
WithIN girlsNNS takesVBZ baseballNN batNN carriesVBZ muffRBS baseballNN batNN dateNN,1
IPRP gonnaVBP suggestJJ oldJJ 783CD IPRP rememberedVBD 22CD,0
ItPRP wasntVBZ reallyRB dangerousJJ perseNN stinkyNN dumbJJ poorJJ 5CD whiteJJ kidsNNS outcastsNNS madeVBD hooligansNNS crazyJJ,1
ThoseDT JewishJJ murderersNNS millionsNNS WhitesNNS forgivenRB,1
IPRP knowVBP oneCD thingNN whiteJJ everRB giveVBP oneCD nickelJJ secondJJ thoughtNN repaidVBD goodJJ evilNN,1
IPRP guessVBP organicJJ chemNN hardNN,1
eatingVBG mexicanJJ foodNN placesNNS,1
PleaseVB feelVB welcomeJJ learnJJ historyNN traditionalJJ characterNN activitiesNNS organizationNN providedVBN communityNN goalsNNS purposesNNS todayNN,0
ThoseDT poorJJ kikesNNS cantVBP evenRB escapeVBP antisemetismNN countryNN punishableJJ deathNN IPRP talkingVBG palestiniansNNS,1
IPRP thinkVBP abusiveJJ parentsNNS worseJJR gaysNNS oneCD,1
IPRP usuallyRB turnVBP lightsNNS refuseVB answerJJR doorNN 7CD 30CD,0
ЧестоJJ иVBD 828CD iveoNN ČastNN,1
minuPRP kõrvaleVBD,1
WhitesNNS woMD ntVB existVB anymoreRB leftVBD mixedJJ awayRB basicallyRB leavingVBG becomeVB largeJJ ghettoNNS,1
IndeedRB needMD feedVB educateVB policeNNS adNN nauseumNN,1
TheDT raceNN traitorsNNS sickenVBP,1
getVB sayingVBG thousandsNNS nonRB irishJJ neverRB contributeVBP anythingNN landNN,1
11CD iNtuitiveJJ 38CD iNtuitiveJJ ThinkingVBG 38CD JudgingVBG 22CD YouPRP slightVBD preferenceNN 11CD YouPRP moderateVBP preferenceJJ SensingVBG 38CD YouPRP moderateVBP preferenceNN 38CD YouPRP slightVBD preferenceNN JudgingVBG PerceivingVBG 22CD,0
jomfureNN HousesomethingVBG,1
IfIN raheemJJ gatNN witNN 17CD bumpsNNS joseRB disedVBD frontJJ peepsNNS cappedVBD datJJ bitchNN twiceRB denRB doubleJJ tappNN hectorNN jusNN causeNN dereJJ moniqueNN pregnantJJ sayVBP raheemVBP babyNN daddyRB muchJJ welfareNN getVB multiplyRB foodNN stampsNNS projectNN housingNN addVB freeJJ utilitiesNNS stolenVBN carsNNS drugsNNS soldVBD findNN stillRB poorJJ,1
TheDT liberalsNNS goingVBG getNN pantiesNNS bunchVBP peopleNNS likeIN sayingVBG mustMD learnVB defendVB,1
introduceVBP newJJ formsNNS enrichedVBD prevailingJJ GermanJJ styleNN robustJJ contrapuntalNN techniqueNN unrivaledVBD controlNN harmonicJJ motivicJJ organizationNN adaptationNN rhythmsNN formsNNS texturesNNS abroadRB particularlyRB,0
IPRP disgustedVBD amountNN whiteJJ hateNN brownVBN loveNN teachersNNS tryVBP pumpNN 16CD yearNN oldsNNS headVBP,1
TheDT regimeNN wantsVBZ GermansNNPS hateJJ badJJ alreadyRB brownJJ MuslimsNNS,1
IPRP wentVBD outsideJJ nigletNN momNN toldVBD daughterNN hitVBD firstRB,1
TheyPRP forcedVBD wearJJ hijabJJ showNN differentJJ usPRP,1
14CD AthenianJJ,0
IPRP lookingVBG websiteRB sellVB deliverRB flagsNNS,0
IPRP caMD ntVB waitJJ moveNN areaNN IPRP surroundedVBD racistNN whiteJJ folksNNS gunsNNS,0
IfIN ntJJ findVBP wayNN kickJJ brownJJ cloudNN alreadyRB DanishJJ geneNN poolNN lostVBD,1
TwoCD weeksNNS rapingVBG killingVBG rapedVBD collegeNN studentNN,0
AtIN leastJJS rightNN ideaNN somethingNN AmericansNNPS lookVBP towardsNNS,0
IPRP likeVBP,0
IPRP wouldMD ntVB evenRB considerVB knackerspykiesNNS respectNN raceNN loyaltyNN putVBD likeIN dogsNNS,1
aroundIN fourCD yearsNNS seenVBN almostRB classNN divideNN,0
IPRP acceptVBP likeIN whiteJJ americansNNS,0
OhUH waitNN thatsNNS whitesVBZ kindNN likeIN zooNN,1
InIN whiteJJ menNNS foughtVBN heavyJJ weaponsNNS,0
IPRP dontVBP doubtNN sayingVBG hopeNN wellRB,0
ThoseDT nogsNNS ntNN belongNN showNN unrulyJJ,1
AwaitsNNS,0
JustRB likeIN,0
TheseDT disgustingVBG pervertedVBD whiteJJ menNNS differentJJ whiteJJ womenNNS sexNN blackJJ menNNS biggerJJR penisNN,1
MaybeRB IPRP tryVBP laterRB,0
RestrictionsNNS basketballNN hoopsVBZ parksVBZ curbNN complaintsNNS playersNNS ntVBP happyJJ putsVBZ curfewJJ 5pmCD putsNNS steeringVBG wheelNN locksNNS cityNN parkNN hoopsVBZ curbNN TNBNN,0
EveryDT whiteJJ personNN knowsVBZ negrosNN worstJJS,1
julNN,1
SadJJ thingNN whiteJJ nationalistsNNS DOVBP judgeNN contentNN characterNN,0
liberalsNNS hateVBP foxJJ newsNN obamaNN hatesVBZ foxJJ newsNN mustMD somethingNN leastRB littleJJ bitNN lessRBR evilJJ stationsNNS,0
fNN kedVBD,0
UnfortunatelyRB poorJJ JapaneseJJ islandNN gettingVBG crowdedVBD,0
AlsoRB usPRP likeIN believeVBP genocideNN anotherDT raceNN abortionNN raceNN 92CD abortionNN clinicsNNS communitiesNNS ntRB believeVBP raceNN mixingNN,1
SoRB IPRP TheDT smallJJ dogsNNS likeIN malteseJJ thingsNNS callVBP stoepJJ kakkersNNS goodJJ leavingVBG turdsNNS stoopNN,1
MyPRP$ momNN IPRP wentVBD weekendNN splitNN hamNN cheddarNN veggieNN crepeNN,0
AlthoughIN manyJJ askedVBD usPRP putVB asideRP politicsNNS threadVBP seeVB NEEDVBP,1
ApparentlyRB caMD ntVB takeVB truthNN spokenNNS,1
IPRP liveVBP nearJJ likeIN wiggersNNS minorityNN supportersNNS aroundIN townNN standingVBG leftistJJ ntRB mindVB knowingVBG peopleNNS,0
ItPRP makesVBZ fleshJJ crawlNN IPRP seeVBP whiteJJ girlsNNS feltVBD walkNN hallwaysNNS bigJJ lippedVBD spearJJ chuckersNNS attackVBP,1
IPRP hearVBP jewsNNS lookingVBG openJJ centerNN nextJJ yearNN,1
TheyPRP closeVBP manyJJ believeVBP interbredVBN caMD ntVB interbreedNN chimpNN,1
IPRP alsoRB unfortuantelyRB spentJJ 78thCD gradeNN 95CD monkeyNN houseNN,1
complimentNN,0
SinceIN threadNN gettingVBG longRB buggingJJ timeNN startVB newJJ oneCD IPRP startVBP IPRP,0
ShouldMD ntVB fluffingVBG pillowsNNS feedingVBG grapesNNS watchVBP footballNN gameNN,0
WhenWRB populationsNNS seperatedVBD racialJJ mixingNN occursNNS genocideVBP,1
terribleJJ blacksNNS muslimsNNS everywhereRB WePRP greatJJ greatJJ monkeysNNS transformingVBG zooNN lawNN respectedVBD,1
EventuallyRB woMD ntVB ableJJ tellNN sadNN,1
chicagoRB uJJ liveVBP,0
IPRP feelVBP dirtyJJ touchingVBG railingVBG oneCD thingsNNS,1
AndCC peopleNNS laughVBP shakeJJ headNN tellVB dangerousJJ groupNN peopleNNS,1
OneCD thingNN seeminglyRB cannotVBZ graspthatJJ messiahNN kingdomNN earthlyRB,1
WhatWP tensVBZ millionsNNS negroesNNS nothingNN criminalsNNS parasitesVBZ nothingNN breedNN criminalsNNS parasitesNNS,1
SoRB solelyRB responsibleJJ racistNN attacksNNS lolRB rightJJ workNN ersNNS neverRB happyJJ,1
AndCC nerveVB preachNN antiSemitismNN pulpitNN,0
HePRP nordicJJ courseNN whiteJJ,0
falseJJ religionNN howeverRB unlikeIN falseJJ religionsNNS crudeVBP appealsNNS crudeVBP peopleNNS arabsNNS,1
IPRP goVBP sleepJJ IPRP wakeVBP reasonablyRB earlyJJ morrowNN,0
everyoneNN doesntNN speakNN RomanianJJ lookNN getNN moveNN backRB homelandNN,1
ntJJ getNN intimidatedVBN enemiesNNS landVBP freedomNN antifaNN scumNN,1
YouPRP siteNN OdinsVBZ hostNN pictureNN zipNN filesNNS somewhereRB elseRB likeIN geocitiescomNN causeNN doesntVBD giveJJ muchJJ roomNN,0
IPRP doubtVBP cessNN poolNN,1
InterestingVBG articleNN evilJJ personsNNS keepVB tellingVBG truthNN wantJJ surrenderNN DanishVB,1
IPRP neverRB seenVBN thingNN countryNN,0
IPRP betRB stuffNN hitVBD listJJ lookJJ startNN disappearingVBG memoryNN holeNN,0
AndCC teachVB carryJJ placeNN getVBP quicklyRB,0
TheDT indiansNNS stanisVBP spitJJ streetNN,1
IPRP getVBP usedVBN lookingVBG likeIN lookedVBD obviouslyRB fakeJJ,0
EveryDT culturedVBD societyNN thingsNNS thereinRB createdVBD whitesNNS,1
ItPRP monthlyJJ feeNN learnNN 1900CD coursesNNS,0
OneCD blackJJ looksVBZ whiteJJ,1
IPRP locatedVBD,0
IPRP urgeVBP areaNN,0
ForIN practiceNN useNN 22CD learnNN,0
surpriseVB jewsNNS promoteVBP faggotryNN,1
YourselfPRP,1
IPRP likeVBP farRB,0
IPRP lookedVBD discussionNN obviousJJ outnumberedVBD nonwhitesNNS raceNN traitorsNNS followVBP followersNNS typesNNS,1
ThanksNNS,0
YouTubeNN,0
IPRP sureVBP fullJJ sickNN selfNN hatingVBG whitesNNS thinkVBP goodJJ blackJJ brownNN yellowJJ peoplesNNS worldNN whitesNNS needVBP commitVBP racialJJ suicideNN disappearJJ faceNN earthNN sakeVBP woMD ntVB dandyNN,1
ThoseDT countriesNNS muchRB betterRBR governmentNN terrorNN madeVBD,1
oftenRB pointedVBD negroesNNS stupidJJ IPRP evenRB imagineVBP actuallyRB thinkVBP gonnaJJ winVBP raceNN warNN,1
FreeholdNN,0
ntMD tryVB comeJJ modernJJ dayNN,1
ThisDT famousJJ incidentNN formerJJ gaveVBD fingerNN groupNN protestersNNS yellingVBG antifrenchJJ sayingsNNS,0
pleaseNN blessNN wisdomNN judgeNN juryNN groupNN thugsNNS mightMD hangedVB,1
ThereEX problemsNNS differentJJ classesNNS insideIN raceNN whiteJJ sinceIN whitesNNS joinedVBD fightJJ nonwhitesNNS enemiesNNS,1
WhoWP elseVBD houseNN blockNN,0
IndeedRB quiteRB oddJJ somethingNN likeIN postedVBN forumNN,0
blacksNNS getVBP awfulJJ madJJ signNN sayingVBG blackJJ becomesVBZ wrongJJ,1
ToTO meansNNS JewishJJ supremacistsNNS neverRB allowVBP WhitesNNS sayVBP,1
MaybeRB differentJJ,0
rollingVBG graveNN knowingVBG apeNN electedVBD whiteJJ houseNN,1
WhitesNNS forcedVBD atheisticJJ viewNN inkindNN,0
800CD gegenNN demNN demostrationNN todayNN,1
oneCD infoNN austinNN texasNN bandNN infoJJ pleaseNN contactNN skinrangeryahoocomVBD whiteJJ powerNN 88CD,0
PerhapsRB IPRP walkVBP backRB startsVBZ getVB systemNN sayVBP IPRP wantVBP tieJJ backRB carNN dragNN acrossIN groundNN tillNN dieVBP sayVBP IPRP jokingVBG,1
WhatWP kindNN moronNN throwsVBZ awayRB schoolNN districtNN moneyNN fruitNN seasonNN,0
ForIN studentsNNS testNN startsVBZ 40CD passingNN scoreNN 99CD,1
TheyPRP scumVBP traitorsNNS,1
IPRP swearVBP IPRP wouldMD getVB teeNN shirtNN wearJJ schoolNN,0
IPRP wouldMD ratherRB whiteJJ personNN highJJ schoolNN diplomaIN whiteJJ highJJ schoolNN teachVBP kidNN readVBP negroJJ collegeNN degreeNN teachVBP kidNN readVBD evenRB gettingVBG paidVBN,1
videoNN 10CD minutesNNS seeVBP eventuallyRB biracialJJ minorityNN butcheredVBD,1
762x25CD httpwwwsportsmansguidecomnetb95s987stk19x18INSTOCKhttpwwwsportsmansguidecomnetb95s958stk1HURRYONTHIS762X39ARABICWOLFINSTOCKhttpwwwsportsmansguidecomnetb96s953stk1223ANDPLENTYOFIThttpwwwsportsmansguidecomnetbVBD 96CD 907CD stkNN 1CD spgNN stocksNNS rightRB getVBP fastJJ jgsalesNNS almostRB everythingNN alotNN 308CD surplusNN ammoNN stockNN placeNN seenVBN stockNN 308CD ammoNN httpwwwjgsalescomindexphpammNN ocPath12VBD 43CD checkNN restNN stuffNN alotNN ammoNN gunsNNS stockNN rightRB sureJJ weatherJJR postNN muchJJ brassNN goingVBG ampleJJ supplyNN 223CD 3006CD anyoneNN interestedJJ pmNN barterNN 762x39CD 38CD specNN,0
WePRP putVBD torchesNNS goVBP homeNN suckNN dcKNN,1
wiggerNN sisterNN parentsNNS hauntedVBN deathNN restNN livesVBZ effectNN handsNNS actionsNNS sisterVBP daughterNN murderedVBN beastNN,1
fallingVBG houseNN pricesNNS bringVBP anotherDT reasonNN neverRB findVBP livingVBG nearIN politicansNNS,1
TheDT 59937CD usPRP beautifulJJ WhitefishJJ twoCD weekendsNNS authenticJJ beerNN foodNN musicNN funNN,0
14HailCD attackNN,0
anyoneNN elseRB fedVBN peopleNNS usingVBG calledVBN raceNN cardNN tellVBP usPRP,0
yeRB heardRB oneCD cameVBD wayNN doseJJ matterNN answerNN evolvedVBD betterRBR,1
MyPRP$ recommendationNN firstRB handgunJJ alwaysRB XDVBP,0
YesUH difficultJJ obtainVB firearmsJJ,0
IPRP gotVBD sloppyJJ secondsNNS MuslimsNNS usedVBD girlNN,1
IfIN stoppedVBN worthlessJJ thingNN wouldMD starveVB,1
TheyPRP whiteJJ nationsNNS,1
IPRP thinkVBP anyoneNN looksVBZ whiteJJ blackJJ onesNNS becomeVBP wiggersNNS,1
EvenRB queersNNS smallJJ townsNNS emboldenedVBD goVB peddleJJ homosexualJJ agendaNN,1
WhatWP IPRP knowVBP IPRP liveVBP smallJJ seemsVBZ lotJJ peopleNNS variousJJ countriesNNS worldNN willingJJ desertNN homelandsVBZ familiesNNS comeVBP mindNN tellsNNS lotNN saidVBD peopleNNS homeNN countriesNNS highlightsVBP weaknessesNNS countriesNNS letVBP feelVB needVB feedVBN somebodyNN elsesVBZ countryNN interpretNN withoutIN soundingVBG rudeNN locustJJ parasiteNN tellNN,1
ButCC IPRP neverRB likedVBD workingVBG metalNN muchRB woodNN,0
wordNN specialJJ meaningNN AmericansNNS,1
YouTubeNN,0
AtIN resturantJJ PresNNS ordersNNS ordersNNS ordersNNS ordersNNS cupVBP teaNN,0
IPRP agreeVBP postNN exceptIN whiteJJ sayVBP,0
AllDT sayVBP noneNN crapNN happeningVBG worldNN goingVBG changeNN unlessIN peopleNNS largeJJ scaleJJ actuallyRB standVBP sayVBP enoughJJ dragNN scumJJ streetsNNS dealVBP violentJJ wayNN,1
ItPRP goingVBG viralJJ warningVBG lesbianJJ groidJJ getsVBZ aggressiveJJ whitesNNS whateverWDT reasonNN OnIN GoingVBG OnIN InIN,1
YourselfPRP,1
englandNN spanishJJ flagNN probablyRB kosherRBR flyNN withoutIN gettingVBG collarJJ feltVBD flagJJ worldNN wouldMD okVB jackNN stNN georgeNN,0
ItPRP bothersVBZ muchJJ makesVBZ wantVBP vomitJJ whiteJJ womanNN layVBD beastRB needJJ tryNN comeVB backRB goVB blackJJ wantedVBN backRP,1
JewsNNS poisoningVBG wellsNNS sinceIN timesNNS,1
InIN interviewsNNS sailorsNNS learnsVBZ highpressureNN policeNN interrogationNN techniquesNNS includingVBG threatNN deathNN penaltyNN sleepNN deprivationNN intimidationNN ledVBD confessNN despiteIN lackJJ evidenceNN linkingVBG crimeNN,0
HePRP patheticJJ littleJJ chimpNN,1
ItsPRP$ probablyRB combinationNN sexualJJ tastesNNS homosexualsNNS towardIN adolescentJJ agencyNN racialJJ agendaNN liberalsNNS agencyNN,1
BeforeIN comingVBG wasisNN historyNN,1
ohUH definitelyRB pushJJ upsNNS sitVBP upsJJ timeNN ntJJ schoolNN weightNN roomNN useNN goVBP,0
sharingVBG freeJJ peacefulJJ homeNN oneCD,0
TheyPRP killVBP fastRB wouldMD killVB enemyVB,1
SurelyRB suggestingVBG teachingVBG bunchNN shootNN,0
youngestJJS 5CD brothersNNS youngestJJS 3CD brotherNN,0
IPRP feelVBP,0
ThereEX timesNNS IPRP walkedVBD pastJJ nigerianJJ skinnyNN coughNN handNN sideNN withoutIN careNN aroundIN,1
TheyPRP probablyRB 150CD threeCD combinedVBD,1
EvenRB stopVB pouringVBG intentionNN goingVBG backRB polandNN,1
wantedVBN thankNN meetingNN weekendNN,0
OnIN shortJJ holidayNN backRB somethingNN countryNN stopVB puttingVBG crapJJ doorstepNN,1
TheyPRP dressVBP likeIN blacksNNS talkVBP actNN stupidNN,1
IPRP planVBP makingVBG tripNN earlyRB,0
MostJJS picturesNNS neverRB seenVBN greatJJ seeVBP newJJ picturesNNS timeNN,0
ExplainNN liberalsNNS liarsVBZ antiWhiteRB tellJJ crimeNN statisticsNNS,1
cousinNN goodJJ friendsNNS anotherDT IPRP liveVBP sanJJ bernardinoNN sendNN pmNN,0
IPRP livedVBD 16CD yearsNNS yesRB hardRB surroundedVBD manyJJ browniesNNS mestizosVBP indigenousJJ,1
reallyRB surprisedVBD goingVBG collegeNN blacksNNS IPRP tellVBP continueVBP behaveVBP mannerNN evenRB higherJJR educationNN,1
ADT guyNN couldMD shootVB anythingNN 140CD 410CD doubleJJ barrelNN,0
ThisDT greatJJ,0
IPRP dontVBP wantJJ blackJJ guyNN oneCD isntNN whiteJJ friendsNNS dontVBP eitherDT mustMD goingVBG wrongJJ girlsNNS,0
userNN saidVBD confuseVB doctorNN familyNN,0
TerribleJJ comingVBG getVB shortJJ holidayNN loneNN wolvesHeNN wantsVBZ goVB johnsNN castleNN seeVBP townAttachmentJJ 78266CD,0
decidedVBD startNN postingVBG thoughtNN IPRP sayVBP hiJJ IPRP midlandsVBP ukJJ,0
GreatNN,0
TheDT LebaneseJJ oneCD massacreNN directionNN,0
ItPRP congersVBZ imagesNNS blacksNNS chainsNNS whippingsNNS intentionNN,1
IsraelyRB indeedRB prepearedVBD GeorgianJJ attackNN,1
IPRP feelVBP whiteJJ teachersNNS especiallyRB whiteJJ kidsNNS wentVBD schoolsNNS,0
ButCC putVB togetherRB somethingNN closeJJ,0
JustRB showsVBZ thickJJ actuallyRB oneCD farmeroneNN bulletNN endNN starvingVBG askingVBG WHITESNNS feedVBP,1
mightMD printVB bwNN copiesNNS leaveVBP placesNNS getVBP firstJJ IPRP needVBP artistJJ,0
ButCC peopleNNS findVBP userJJ plantNN nativeNN negroesVBZ wantVB royaltyNN,1
AndCC anythingNN stayVB longJJ timeNN,0
talkingVBG yearsNNS filthyJJ muslimsNNS puttingVBG sightNN africaNN waysNNS worstVBP blacksNNS,1
LookNN picturesNNS,0
AnyoneNN knowVBP youthRB acitivitiesorganizationsNNS maybeRB areaNN,0
ThereEX integrationNN immigrantsNNS IrishJJ cultureNN,1
videosNNS pissVBP,0
TheDT problemNN whiteJJ menNNS asianJJ womenNNS comeVBP nonJJ whiteJJ babiesNNS poorJJ asianJJ menNNS laborsNNS wouldMD upsetVB peopleNNS,1
1990CD UnderIN mentorshipNN notedVBD anthropologistJJ spentVBD 16CD yearsNNS researchingVBG lastJJ remainingVBG mountainNN gorillasNNS,0
AllDT ukraineJJ fakeNN ukrainiansNNS,1
TheyPRP blackmailVBP shopownersNNS giveVBP protectionNN claimNN,0
WePRP knowVBP manyJJ ethnicsNNS neighbourhoodJJ soonRB turnVBP slumNN,1
everyoneNN IPRP SloveniaVBP IPRP utterlyJJ hateNN everyDT livingNN muslimJJ worldNN IPRP despiseVBP evenRB deadJJ onesNNS,1
ThanksNNS advanceNN,0
SeeVB instructionNN,0
IPRP readVBP 1500CD carsNNS participatedVBD,0
BecauseIN vileJJ plagueNN mankindIN oneCD reallyRB likesVB,1
HomosexualsNNS caMD ntVB undoJJ fightJJ hypocritesVBZ IPRP ratherRB openlyRB homosexualJJ menNNS sideVBP closetNN fagsNNS sexualJJ deviantsNNS skulkVBP pretendingVBG somethingNN,1
AllDT sayingVBG whiteJJ immigrationNN detrimentalJJ nationNN reasonsNNS givenVBN timeNN timeNN,1
