WhoWP getVBP handsNNS pmJJ sendVBP emailJJ pleaseNN,0
WonderingVBG IPRP getVBP homeschooledVBN,0
IPRP thinkVBP UKIN lostVBN causeNN londonNN madeVBD tonsNNS concessionsNNS nonVBP whitesNNS,1
provesVBZ ntJJ,0
audioNN playerNN linkNN,0
WithIN liberalJJ mediaNNS policeNN departmentsNNS reportingVBG blackJJ crimeNN givenVBN passNN ghettoNN waysNNS manyJJ timesNNS becomesRB acceptableJJ behaviorJJ realJJ consequencesNNS,1
TheyPRP aughtVBD ashamedVBN coveringVBG downplayingVBG storyNN predatorsNNS,1
SoRB looksVBZ likeIN lostVBD evenRB oneCD,1
ButCC IPRP couldMD choseVB eyeNN colourNN definitelyRB wouldMD GreenVB,0
LikeIN IPRP certainlyRB ntVBP especiallyRB litteredVBD memorialsNNS evenRB statuesNNS redVBD terroristsNNS,1
httpwwwcommercialappealcomnewsNNS emaincustodyNN NowRB littleJJ schoolNN teachesNNS,1
AllDT blacksNNS mestizosVBP prettyRB wellRB behavedVBN keepVB wayNN aroundIN,1
getVB touchJJ,0
TheyPRP ntDT lastJJ weekNN,0
IPRP sawVBD fridayJJ rightJJ impressionNN believeVBP oneCD,0
IfIN deafVBN wouldMD ntVB hearJJ multiculturalismNN enrichesNNS societyNN rubbishNN,0
IPRP feelVBP sorryJJ whitesNNS livingVBG,1
TheDT innocenceNN goneVBN,0
YouPRP findVBP worseJJR sinceIN ableJJ blendNN foolNN peopleNNS thinkingVBG genuineNN,1
newJJ inlawNN farRB leftVBD newJJ futureJJ inlawNN farRB rightJJ,0
IPRP goVBP eatJJ hagisNN sipNN whiskeyJJ thankNN,0
PelletsNNS flattenedVBD quiteRB nicelyRB,0
IPRP sayVBP takeJJ asianJJ obsessedVBN whiteJJ menNNS dumpVB thirdJJ worldNN asianJJ crapNN wholeJJ neverRB letVBP comeVB backRB,1
ItPRP belatedVBD wishesNNS IPRP wontVBP getVB chanceNN seeVB newJJ yearNN IPRP passVBP,0
compatibleJJ wayNN lifeNN greenJJ pleasantJJ isleIrishJJ peopleNNS whiteJJ ChristianJJ FFSNN,1
IPRP 12CD timeNN scareyNN IPRP aloneVBP,0
YouPRP needVBP whiteJJ cultureNN dictionaryNN,0
AndCC exactlyRB fallVB backRB commonJJ senseNN AndCC commonJJ senseNN saysVBZ nobodyNN hangingVBG aroundRB 40000CD feetNNS takeVBP tanNN,0
TooRB badJJ 98CD percentNN publicJJ schoolNN kidsNNS taughtVBD everythingNN truthNN,0
goneVBN IPRP findVBP,0
LivingVBG expensesNNS highJJ poorJJ choiceNN liveJJ nonwhiteNN suburbsNNS,1
IfIN anyoneNN tellNN happenedVBD lakeNN,0
ItPRP necessaryJJ hideNN behindIN liesVBZ falseJJ informationNN faceNN truthNN sideNN,0
TheirPRP$ groupNN peopleNNS behindIN scenesNNS orchestratingVBG destructionNN usingVBG nonJJ toolsNNS accomplishJJ agendaNN,1
runningVBG amokRB greatJJ countryNN,1
IPRP actuallyRB scaredVBD timesNNS,0
PutVB fatJJ idiotNN workNN wouldMD ntVB smirkingVBG playingVBG stupidJJ cameraNN welfareNN reviewNN hearingNN,1
NoDT wonderNN OfIN TheDT hatedVBD socialJJ engineersNNS,0
ApparentlyRB whiteJJ peopleNNS lastJJ goJJ raceNN datingNN anywaysNNS,0
IsVBZ finnishJJ versionNN fårNN fårNN,0
IPRP seenVBN SwedishJJ buildingsNNS similarJJ JapaneseJJ styleNN,0
hiJJ schoolNN zooNN suckNN hateJJ schoolNN whiteJJ trashNN oneCD raceNN mixersNNS wVBP whiteJJ powerNN timesNNS,1
gonnaVBD tryVB lieNN IPRP moneyNN IPRP probablyRB wholeVBD safeJJ fullJJ,0
colorNN resembleNN walkingVBG pileJJ fecesNNS armsNNS legsVBD evenRB stinkVB,1
NoDT bobNN sawVBD 20CD oddJJ yearsNNS agoRB animalJJ rightsNNS stallVBP londonJJ stuckJJ mindNN,0
YesUH ageNN 10CD neverRB sawVBD negroJJ realJJ lifeNN movedVBD horrifiedVBD amountNN nonwhitesNNS,1
YupNNS AfricansNNPS breedingVBG likeIN cockroachesNNS killingVBG fastRB enoughJJ stopNN growthNN,1
immigrantsNNS desperateJJ stayNN blameJJ governmentNN treatsNNS lordsVBP muckJJ welcomeJJ,1
ThatDT conclusionNN,0
IPRP believeVBP higherJJR sinceIN IPRP readVBP reportsNNS especiallyRB whitesNNS FreeJJ countedVBD latestJJS censusNN,0
MigrantsNNS livingVBG fearJJ racistNN bombNN attackNN TheyPRP threateningVBG leaveVBP doomedVBN,1
OfIN courseNN IPRP getVBP togetherRB bandNN throwNN niceJJ patrioticJJ partiesNNS,0
dogsNNS trackNN IPRP sayVBP,0
AndCC thinkVB allowingVBG nationNN hostNN biggestJJS sportingVBG eventNN planetNN,0
AndCC meanwhileJJ tryingVBG killVB futureJJ generationsNNS IrishVBP,0
ThatsNNS IPRP sayingVBG evenRB thoughIN toolsVBZ prettyRB advancedJJ knowledgeNN plantsNNS,0
TheDT chairmanNN oneCD yesVBZ memberNN certainJJ tribeNN delightVBD bringingVBG diversityNN benefitsNNS multiculturalismNN antiracismNN alongIN boatloadsNNS thirdworldersNNS,1
apeNN causeNN withoutIN ytNN protectNN raceNN probablyRB worldNN favourNN wipeNN kindNN faceNN EarthNN,1
tagetNN enFW påFW handelsskolenNN,1
SoundsNNS likeIN mightMD PalestiniansNNPS eitherCC varietyNN woodpileNN throwingVBG stonesNNS likeIN,1
NoDT IPRP hopeVBP negroRB rightJJ everRB,1
ThisDT nightNN IPRP gotVBD engagedVBN stuffNN,0
HispanicsNNS BlacksNNS AsiansNNS,1
OnceRB negrosJJ startVBP comingVBG bunchesNNS hellholeJJ whitesNNS leaveVBP startJJ newJJ communityNN,1
LearningVBG preserveNN foodNN buildNN trapsNNS,0
ItPRP nobleJJ ideaNN IPRP wouldMD ratherRB stayVB mostlyRB whiteJJ moveNN 35CD blackJJ,0
TheDT rawJJ footageNN beastsVBZ momentsNNS candorVB muchRB revealingVBG persuasiveJJ helpingVBG fellowJJ whiteJJ brothersNNS sistersNNS seeVBP truthJJ thousandCD booksNNS couldMD everRB,1
IPRP liveVBP largeJJ AmericanJJ cityNN gottenRB badJJ pointNN minorityNN,1
TheDT censusNN resultsNNS releasedVBD nextJJ yearNN,0
YesUH IPRP hopeVBP prayJJ countryNN stayVB cleanJJ longRB possibleJJ,1
webVBD siteNN wwwanuorgNN,0
IPRP thinkVBP appropriateJJ sitesNNS internationalJJ datingNN,0
SomeDT thingsNNS IPRP noticedVBD shopNN tailorsNNS dummiesVBZ blackJJ coupleNN mudNN restaurantsNNS germJJ blacksNNS fashionableJJ takingVBG rootNN,1
TheyPRP soundVBP naiveJJ learnVBP peopleNNS wantVBP intergrateJJ accumulateNN,1
AmericansNNPS IrishJJ understandVBP betterJJR beanersNNS 1stCD worldNN educatedVBN unlikeIN beanersNNS,1
bigJJ dealNN needNN talkVB yesUH nonwhiteNN mightMD wellRB fullyRB mongolVB,1
MostJJS whiteJJ girlsNNS taughtVBD brainwashedVBN loveIN blackJJ guysJJ wayNN properlyRB educateVB showNN savagesNNS trulyRB,1
IPRP wentVBD backRB cplJJ yearsNNS agoRB blackJJ verminNN everywhereRB,1
IPRP compoundNN bowNN IPRP boughtVBD manyJJ yearsNNS agoRB,0
ManyJJ AsiansNNPS seeVBP somethingNN memorizeVB restNN livesNNS askedVBD worksNNS useVBP creativelyRB drawJJ blankNN,1
IPRP refusedVBD swerveJJ truckNN awayRB scatteredVBN likeIN troopNN baboonsNNS chargedVBN lionNN,1
hearVBP,0
CouldMD greaterJJR emphasisNN functionalityNN sharedVBD stylesNNS architectureNN,0
IPRP knowVBP somebodyNN wantsVBZ perhapsRB moveVB wonderingVBG homoNN agendaNN schoolsNNS,1
IPRP wouldMD sayVB spreadJJ informationNN friendsNNS familyNN wellRB sendRB storyNN internetNN sitesVBZ startersNNS,0
ItPRP annoyingVBG liveJJ timeNN subhumanJJ monkeyJJ coonNN thinksNNS okayVBP hitVBN whiteJJ blondNN blueeyedVBD childNN,1
ThanksNNS greatJJ repliesNNS helpfulVBP,0
MoreoverRB childrenNNS programsNNS usuallyRB leadVBP nonWhitesNNS oftenRB mulattosVBP,1
GetVB rightJJ,0
IfIN likeJJ talkNN sendVBP messageNN,0
TheDT worstJJS cityNN IPRP everRB seenVBN personNN,1
NowRB hundredsVBZ yearsNNS thousandsNNS,1
YesUH gameNN prettyRB goodJJ trulyRB 100CD negroidJJ killingVBG actionNN akaNN miniNN ButCC wouldMD likeVB seeVB expansionNN setVBN nextJJ missionNN harlemNN laughNN wouldMD perfectVB,1
neanderthalensisNN dumbNN negroJJ subspeciesNNS negroidJJ speciesNNS neverRB whiteeuropeanVBP,1
ThereEX nameNN pastNN,0
ThisDT lastJJ strawJJ muchJJ damageNN civilizationNN ZionistsNNS,1
TheyPRP knowVBP pissesVBZ whitesNNS showingVBG disrespectJJ peopleNNS showsNNS respectVBP,1
AlsoRB underholdesVBZ afJJ faderenNNS StudentNN,0
guyNN stabsJJ studentNN slicesNNS throatVBP frontRB 30CD plusJJ studentsNNS facultyNN garnersNNS barelyRB mentionVBP,0
sadestJJS newsNN everRB heardVBD entireJJ lifeNN irelandNN whiteJJ countryNN likeIN sayingVBG worldNN endingVBG,1
lookingVBG goodJJ bookNN terrorNN laidVBN uponIN peopleNNS preferablyRB nationalistVBP leastJJS neutralJJ perspectiveNN,0
TheDT bestJJS wayNN preventJJ rapeNN succeedVB goalNN removingVBG whiteJJ countriesNNS,1
sorryNN forgotVBD putVBN imJJ westernJJ massNN teacherIN whiteJJ stronglyRB racismNN thatsNNS sayVBP somethingNN supportJJ whiteJJ racismNN,0
EverRB noticeDT wayNN mechanisationsNNS stateNN alwaysRB sideRB antifascistJJ goffersNNS,0
IPRP seeVBP futureJJ testingVBG,1
LetsNNS hearVBP fullJJ versionNN,0
ShockingVBG outrageousJJ feelingNN jmhoNN,0
TheyPRP actVBP quiteRB civilizedJJ videoNN supposeJJ wentVBD muggingVBG spreeNN,1
BULLNN,0
IfIN blackJJ sendVBP backRP,1
EgyptianJJ TVNN TheDT JewsNNPS GermansNNPS YouTubeVBD,1
OneCD timeNN cameVBD cryingVBG tellingVBG pavementJJ apeNN hitVBD tummyNNS,1
UPDATERB 1pmCD,0
IPRP likeVBP manNN angerNN resolutenessColudVB anyoneNN tellNN takeVB wholeJJ footageNN,0
YesUH homosexualJJ degeneracyNN foistedVBN uponIN silentJJ majorityNN,1
steelNN cageNN battleNN royalJJ matchNN multiplyNN carnageNN 1000000CD timesNNS getVBP,1
TheDT holocaustNN neverRB existedVBD exceptIN mindsNNS peopleNNS believedVBD,1
etcNN,0
IPRP goVBP cityNN yesterdayNN IPRP couldMD beliveVB happendNN IPRP thinkVBP mustMD seenVBN everyDT peiceNN dirtNN everyDT cornerNN globeNN horribleJJ,1
gotVBD awareJJ idiotsNNS absorbingVBG bsJJ littleJJ spongeNN brainsNNS,1
duNN erNN fornøydNN medVBD dinJJ detNN erNN ikkeNN dètNN detNN erNN snakkNN omNN såNN slappNN avNN kameratNN,1
WhenWRB IPRP aroundRB youngJJ peopleNNS rapVBP musicNN negroJJ cultureNN comesVBZ IPRP makeVBP gesturesNNS implyingVBG savageryNN blacksNNS,1
IPRP basicallyRB babysitterVBP apesNNS wentVBD nutsJJ franklyNN IPRP couldMD controlVB pressNN panicJJ buttonNN twiceRB getVB someoneNN helpNN,1
studentNN knowsVBZ IPRP gotVBD goVB schoolNN,0
TheirPRP$ resistanceNN immigrationNN preciselyRB exposedVBD nonWhiteJJ verminNN effectNN nationsNNS,1
FirstJJ impressionsNNS,0
YouPRP getVBP oneCD twinNN IPRP getVBP,0
neichzcheNN embracedVBD notionJJ raceNN evolveVBP struggleNN killNN weakerJJR elementsNNS keepVB contaminatingVBG geneNN poolNN oneCD couldMD sayVB breedingVBG programNN breedNN dumbVBZ ghettoJJ blacksNNS,1
somebodyhcfcalledputinaherololololThisherofinallytransformedformersovietjewnionNN russianjudeaInNN miserytornJJ countryareNN there70NN officiallyRB billionariesVBZ tensNNS fJJ thousandsNNS millionariesNNS tensNNS millionsNNS poorJJ miserableJJ lookNN pittanceNN garbageNN placesNNS,1
WhatWP loadNN crapWaterNN yeNN peopleNNS realJJ takenVBN nonRB IrishJJ rubbishNN,1
surpriseVB hatingVBG nonwhitesNNS stillRB wantVBP liveJJ countriesNNS madeVBD peopleNNS broughtVBD lowJJ nonwhitesNNS,1
TheyPRP livingVBG roomNN sittingVBG couchJJ implyingJJ coupleNN,0
PlayingVBG lightlyRB surfaceVBP flickeringVBG lambentNN flameNN lambentNN shadowsVBZ 2CD,0
ADT girlNN ridesVBZ trucksNNS placeVBP callJJ homeNN wrongJJ guyNN callNN,0
TheyPRP wouldMD performVB rapeNN testNN getNN evidenceNN immediatelyRB,0
httpprudentbearcomindexphpcomJJ artNN idNN 10187CD,0
IPRP weeksNNS agoRB,0
ItsPRP$ peopleNNS likeIN alongIN whiteJJ civilizationNN moralJJ natureNN keptVBD checkNN,0
FirstRB probablyRB wontJJ anythingNN secondJJ dontJJ startNN anythingNN,0
ThatDT findsVBZ glassesNNS stupidJJ jumpNN,0
pittsburghVBZ areaNN,0
IPRP guessVBP IPRP includedVBD warningVBG clickNN,0
ItPRP goodiesVBZ runVBN,0
AsIN farRB imNN concernedJJ soonRB littleJJ halfJJ breedNN bornVBN tiedVBN roundNN neckNN motherNN mulattoeNN flungNN nearestJJS riverLetsNNS seeVBP daddyJJ jumpsNNS saveVBP,1
IPRP believeVBP faithNN testedVBD askedVBD sacrificeJJ quranNN falselyRB claimsVBZ,0
TheDT rlmNN,0
ItPRP totalJJ disgraceNN taxpayerNN dollarsNNS goVBP promotingVBG degenerateNN filthNN,1
SoRB oxdrivenJJ ambulancesNNS donkeyNN poweredVBD policeNNS,1
DoVBP ntDT letVB poorJJ kidVB dieNN vainNN stillRB drawVBZ airNN,0
ADT federalJJ judgeNN closedVBD filthyJJ jewNN kosherNN slaughterhouseNN sayingVBG plantNN dirtyNN birdsNNS posedVBD healthNN riskNN communityNN,1
IPRP goneVBN publicJJ schoolNN lifeNN forceNN fedVBD crapNN sinceIN 7thCD gradeNN,1
HumansNNS hostsNNS victimsNNS choleraeVBP motileNN aerobicJJ organismNN,0
IPRP nigVBP needDT dayNN smokeVBD bluntsNNS drinkVB 40CD ouncersNNS,1
IPRP goingVBG sayVBP addedVBN lastJJ lineNN lookNN likeIN bunchNN frightenedVBN monkeysNNS gunsNNS,1
RacialJJ preservationNN beliefNN existenceNN certainJJ raceNN mustMD preservedVBN wellRB courseNN cultureNN,0
advertVBP tellyRB eveningVBG,0
TheseDT niggasNNS,1
ThereEX raceNN skinNN colorNN,0
hellRB soonRB possibleJJ,0
SurelyRB couldMD ntVB stopVB expressingVBG religiousJJ convictionsNNS couldMD,0
IPRP sawVBD whiteJJ blackJJ coupleNN dayNN nearlyRB wentVBD ballisticJJ gotVBD enragedJJ,1
WhyWRB takeVBP longJJ releaseNN,0
IPRP hopeVBP blackJJ creepNN getNN easyJJ,1
ThisDT wrongJJ,1
TVNN 4CD controlledVBD JewishJJ familyNN,1
IPRP recentlyRB boughtVBD bookNN fastRB shippingJJ greatJJ qualityNN,0
businessNN,1
TheDT reasonNN persecutionNN,0
HereRB freeJJ httpwnlibrarycomPortabelNN 20DocuCD eNN 20TitanspdfCD,0
IPRP wishVBP luckJJ wonderNN malesVBZ lustJJ womenNNS,1
AsIN britNN knowledgeVBP americanJJ lawNN somewhatRB lackingVBG evenRB knowVB holderJJR groidNN committedVBD treasonNN,1
AndCC stunkNN likeIN referNN blackJJ sweatNN,1
ShePRP cameVBD hateJJ AfricanJJ poachersNNS showedVBD mercyJJ towardsNNS,0
ThoseDT picturesNNS trulyRB beautifulJJ,0
IPRP lookingVBG forwardRB usingVBG sharpJJ rockNN tiedVBN stickJJ okNN IPRP promiseVBP IPRP wontVBP useRB wondrousJJ inventionsNNS stopVBP usingVBG everythingNN raceNN inventedVBD,1
HePRP spokeVBD eventNN drewVBD 600CD peopleNNS,0
ThisDT threadNN makesVBZ sadJJ angryJJ,0
TereasaNN,0
NotRB manyJJ,1
ADT pleasureNN guysNN,0
WasntIN somethingNN likeIN bigJJ bangNN burritoNN explodedVBD beansNNS flewVBD everywhereRB startedVBN reproducingVBG exponentiallyRB,1
dullNN sometimesRB,0
ADT 14CD yardsNNS 42CD feetNNS homeschoolNN mathNN assignmentNN couldMD 10CD 15CD problemsNNS learnedVBD fieldNN dayNN,0
ministersNNS watchVBP copNN bleedsNNS deathNN x202cNN rlmNN,0
YouPRP actedVBD likeIN,0
AsIN nationNN desperateVBP needVBN immigrationNN timeNN zeroCD toleranceNN policyNN illegallyRB,1
IfIN someoneNN busNN carryingVBG pieceNN couldMD takenVBN careVB savageNN managedVBD stabNN victimNN 5060CD timesNNS,0
WePRP spentVBD muchJJ timeNN effortNN worryingVBG AsiansNNPS HispanicsNNPS onesNNS carryingVBG ballNN,1
TheDT crashedVBD paradeVBD lastJJ monthNN lolVBD,1
AsiansNNS fairlyRB wellRB manneredJJ intelligentNN easierJJR whitesNNS getVBP alongIN,0
WhenWRB IPRP lookVBP ZimbaweeJJ IPRP thinkVBP,1
SomeDT kidsNNS threwVBD thirdJJ floorNN windowNN ontoIN teacherNN brokeVBD armNN,0
ADT puppetNN handsVBZ,1
DracoNN,0
ThisDT libtardsVBZ callVB usPRP whiteJJ supremacistsNNS getVBP awayRB,1
QNN IfIN hopVBD distanceNN 2CD feetNNS makesVBZ 2CD hopsNNS farRB hopVBP startingVBG pointNN finishingNN pointNN,0
preNN mergerNN 50CD,0
ThereEX lotsNNS brownJJ blackJJ kidsNNS systemNN gaysNNS couldMD adoptVB,1
IPRP boughtVBD shotNN 2000CD roundsNNS lastJJ yearNN,0
IPRP ratherRB cleanJJ dozenNN tioletsNNS dayNN walkVBP bathroomNN seeVBP mongrelJJ standingVBG mopNN givingVBG glassyeyedVBN stareNN,1
HePRP walksVBD uprightJJ humanJJ armsNNS legsNNS,1
PathologicalJJ killersNNS,1
2508CD,0
dontNN getVB coldJJ stepNN waterNN alwaysRB figuredVBD freezeNN buttNN,0
KeepVB emNN phoneNN longRB enoughRB disagreeJJ littleJJ,0
TheDT problemNN arisesVBZ WhitesVBZ marchJJ callVB racistNN,0
oneCD gaveVBD oneCD goodJJ sourceNN validatingVBG preposterousJJ claimsNNS cameVBD complainJJ startNN nameNN callingVBG stupidJJ liberalsNNS,1
httpwwwyoutubecomwatchNN featureNN vNN,0
HowWRB IPRP popVBP cityNN discussNN faceNN faceNN ratherRB skulkingVBG behindIN keyboardNN,0
IPRP wannaVBP lookVBP likeIN skinnyJJ whiteJJ ladyNN blackJJ beautifulJJ shakesNNS headVBP,1
TheDT calledVBD amnestyJJ immigrantsNNS fiveCD yearsNNS withoutIN statusNN resolvedVBD,0
acronymNN,1
BackRB IPRP kidVBD evenRB blackJJ folksNNS calledVBD IPRP zVBP caiJJ ntJJ waitNN IPRP zVBP gonnaJJ getVB sumJJ demNN niggahtoesNNS oranguzVBP foJJ sumNN peppahmintzNN deyNN shoaNN izNN gudNN,1
BetterRBR yetRB makeVB posterNN childNN daysNNS diggingVBG grubJJ wormNN dinnersNNS wouldMD actuallyRB goodVB,1
IfIN brownVBN flushNN,1
schoolNN boardNN completelyRB blindedVBD eventsNNS goVB schoolsNNS contactedVBN boyJJ knifeNN nNN neverRB evenRB informedJJ situationNN authoritiesNNS calledVBD eventhoughJJ schoolNN policyNN requiresVBZ situationsNNS,0
ButCC IPRP seenVBN severalJJ timesNNS pastJJ twoCD threeCD yearsNNS,0
ButCC welcomeJJ anywayRB,0
IPRP liveVBP tinyJJ assNN townNN oneCD 100CD whiteJJ folksNNS maybeRB lessRBR nearJJ manyJJ dirtsNNS aroundIN stickNN togetherRB comesVBZ townNN gottaNN backRB,1
AfricansNNS tallVBP thinJJ lankyNN prettyRB uglyRB beastsVBZ IPRP kindNN,1
SomeoneNN doneVBN peopleNNS tellVBP MexicansNNPS hispanicsNNS undercuttingJJ priceNN quotesNNS GoodJJ workingVBG PeopleNNS,1
IPRP supperVBP happyJJ urJJ schoolNN,0
IPRP referVBP primatesVBZ evolutionNN processNN littleJJ bitNN higherJJR evolutionaryJJ chainNN makesVBZ dangerousJJ whitesNNS animalisticJJ cousinsNNS,1
IPRP oneCD planNN hangVBD lastJJ jewNN gutsNNS lastJJ capitalistNN,1
YeahUH buyingNN lotNN housesNNS aroundIN areaNN probzNN houseNN massiveJJ inbredVBN familyNN comeVBN,1
thinksVBZ negroJJ thinksNNS lineNN trollNN confusedVBD blackJJ prowlingNN makeVBP reallyRB,1
wentVBD earlyRB harbourJJ boatsNNS cancelledVBD accountNN roughNN weatherNN,0
carbineNN oneCD mineNN 2CD,0
WellRB leastJJS dumbJJ negroesNNS gotVBD factNN evilNN rightRB thoughIN IPRP suspectVBP whiteyJJ jewsNNS oneCD primitiveJJ mindsNNS,1
WorksVBZ greatJJ simpleJJ useNN evenRB kidsNNS,0
IfIN helpsVBN feelVB betterRBR IPRP gotVBD acceptedVBN followingVBG schoolsNNS ckNN,0
whiteJJ menNNS asianJJ womenNNS actuallyRB hurtVB asianJJ peopleNNS societyNN sinceIN asiansNNS outnumberVBP whitesNNS,1
TwoCD daysNNS agoIN IPRP tappedVBD halfNN asianJJ halfNN mongrelNN biggerJJR,1
ThereEX manyJJ alternativesNNS adoptingVBG littleJJ mudNN babiesThereRB srrogateJJ mothersNNS invitroVBP fertilizationNN twoIfNN financialyNN possileIN waitNN tillNN,1
ADT primateJJ fistNN inventNN stickNN blackJJ stoleNN,1
IPRP thinkVBP 3CD cultureNN ManyJJ youngJJ blackJJ malesNNS growVBP fatherlessNN,0
apologizeNN lastJJ postNN IPRP drinkingVBG heavilyRB lastJJ nightNN callinNN geneticJJ lotteryNN winnerNN comeVBP IPRP fairJJ shareNN hardJJ timesNNS lastJJ weekNN yellowJJ personNN cameVBD placeNN workNN startedVBD makingVBG troubleNN,1
IPRP wishVBP buggerJJR backRB everRB hellRB neverRB comeVBN backRP,1
IPRP wonderVBP shegroidJJ cameVBD runningVBG,1
WhitesNNS happenedVBD,0
BumpNN,0
TheDT thingNN concernsNNS gotVBD houseNN councilNN thatsVBZ houseNN IrishJJ familyNN gotVBD,1
IPRP beatenVBP robbedJJ twoCD nativesNNS lastJJ yearNN lastJJ coupleNN yearsNNS IPRP watchedVBD downtownJJ turnNN blackJJ brownJJ yellowJJ townNN foodNN courtNN placeNN startedVBD remindJJ creatureNN cantinaNN starNN warsNNS,1
TheDT jewsJJ representNN everythingNN vileNN deviantJJ unnaturalJJ everythingNN anythingNN abominationNN IPRP hopeVBP burningVBG fatherNN hellNN,1
WulfiNN,0
wwwcalvineduJJ,0
MyPRP$ greatJJ grandJJ dadNN,0
SuchJJ shàmeNN allowedVBD blacksNNS brownsNNS destroyVBP everyDT lastJJ squareNN inchNN citiesNNS,1
InIN schoolNN teachNN makesVBZ blackJJ peopleNNS lookVBP badJJ ntNNS happenVB,0
TheseDT moslemNNS filthNN hackedVBD headsNNS tookVBD 30CD secondsNNS,1
ANYDT posterNN acceptIN priorityNN eitherCC delusionalJJ stillRB partlyRB brainNN washedVBD likesNNS eatNN BagelsNNS,0
InIN OnIN OfIN rlmVBD ItPRP wayNN blacksNNS reactVBP,0
YouPRP wiggerVBP stageVB,0
WePRP needVBP startJJ poolNN stormfrontNN useNN moneyNN buyNN placeNN,0
IPRP anotherDT,0
YourselfPRP,1
TheseDT figuresNNS showVBP oneCD couldMD talkVB needVB restrictJJ nonwhiteJJ immigrationNN currentJJ governmentNN largescaleNN repatriationNN nonwhitesVBZ absolutelyRB essentialJJ,1
peacefulJJ peopleNNS worldNN JewsNNPS makeVBP liberalsNNS wantedVBD genocideNN selvesNNS,1
ItPRP obviouslyRB misunderstoodVBD wouldMD keenVB learnVB,0
DoVB ntDT sitVB aroundRP argueJJ actNN likeIN patheticJJ tryNN shameNN,1
WhenWRB goesVBZ outsideIN subhumanJJ apeJJ thingNN usuallyRB,1
sarkanbaltiNN sarkansNNS miruVBP osJJ unJJ dzīvosNN klājNN pretīNN sarkanajamNN mērimJJ nāvesNNS sardzēVBP latvietJJ stājNN,1
IPRP wouldMD likeVB findVB documentNN cameVBD firstRB publishedVBN thankNN replyNN,0
IPRP guessVBP IPRP wouldMD destinedVB gasNN chambersNNS,1
cokeNN addictNNS tryVBP findVBP getsVBZ cokeJJ ratNN heroNN partyNN nigsNNS behindIN barsNNS,1
noticeRB primateVB IPRP meanVBP blackJJ kidNN armNN aroundIN whiteJJ girlNN,1
YeahUH rememberVB jewsNNS cunningVBG wouldMD probzVB slitherJJR wayNN justifyNN rightJJ bareNN armsNNS useVBP proJJ jewNN mediaNNS withoutIN doubtNN oldJJ holocaustNN excuseNN raceNN wouldMD blameVB usPRP brainwashedVBN youngJJ ageNN TVNN schoolsNNS jobNN wakeVBP comradeJJ defendNN fastNN becomingVBG minorityNN countriesNNS,1
InIN 15CD minutesNNS shooterRBR hittingVBG paperNN plateNN,0
IPRP relateVBP coonNN runiingVBG footballNN likeIN coonNN tvNN runningVBG policeNNS sirenNNS,1
ThisDT boardNN matureNN peopleNNS freeJJ joinNN leavereturnNN momentNN,0
LookVB happensVBZ WhitesNNS leaveVBP blackJJ CountriesNNPS aloneRB naturallyRB TheDT blacksNNS CountriesNNPS todayNN kneesNNS thankingVBG WhitesNNS tryingVBG civilizeNN,1
IPRP liveVBP nearIN,0
womanNN pullsVBZ gunJJ busNN anotherDT womanNN talkingVBG loudJJ phoneNN blackJJ manNN difusesVBZ situationNN,1
IPRP agreeVBP pointsNNS alsoRB othersNNS,0
PerhapsRB fourCD fiveCD percentNN humansNNS drivingVBG progressNN civilizationNN restNN supportingVBG civilizationNN brightJJ onesNNS workNN,0
OurPRP$ governmentNN practiceNN tearingVBG whiteJJ raceNN raiseNN nonJJ whiteJJ minorityNN racesNNS forcingVBG diversityNN multiculturalismNN whiteJJ peopleNNS throatsNNS,0
OnIN topJJ smallJJ fractionNN 40000CD activeJJ postersNNS 40000CD antisNN,0
MoreRBR blackonwhiteJJ savageryNN gangsNNS targetingVBG menNNS hateVBP crimesNNS BecauseIN 32CD gangbangersNNS arrestedVBN hateNN crimeNN roundupNN targetingVBG racistNN AfricanJJ immigrantsNNS,1
OneCD dayNN trueJJ peopleNNS comeVBP powerNN italyNN goVBP backRB cameVBD ItaliansNNPS,1
IPRP hopeVBP littleJJ groidJJ torturesNNS,1
ItPRP factNN ninetynineJJ percentNN talkNN seriousJJ illegalJJ activityNN craziesNNS governmentNN agentsNNS,0
WhatWP worseJJR factNN allowedVBD bringJJ violentJJ chaosNN belovedVBD homelandsNNS contaminateVB mindsNNS childrenNNS,0
IPRP thinkVBP connectionNN homosexualityNN countryNN largeJJ proportionNN paedophilesNNS representativesNNS ChristianJJ churchesNNS,1
ThisDT wontNN lastJJ jumpNN,0
IfIN interestedJJ emailNN claw9165yahoocomNN,0
JewsNNS demandingVBG worstJJS patientsNNS,1
YourPRP$ welcomeNN predominantlyRB IrishJJ ancestryNN,0
88CD imJJ lookingVBG whiteJJ powerNN femaleNN talkNN hangNN wouldMD likeVB hangNN talkNN pmIN liveJJ austinNN texaslookingVBG wpJJ girlNN nearIN austinNN 88CD,0
MaaaaanyJJ pindersNNS AsiansNNS,1
AnyDT purportedJJ holyNN bookNN saysVBZ vileIN despicableJJ thingsNNS talmudVBP saysVBZ cannotVBZ comeJJ placeNN goodnessJewsNNS convincedVBD superiorityNN thinkVBP trickIN loveVBP fidelityNN pretendingNN honorNN,1
ThereEX plentyJJ blacksNNS catholicJJ schoolsNNS areaNN,0
TheyPRP likeVBP virusNNS humanJJ getVBP insideJJ countryNN taintNN sicknessNN prettyRB soonRB wholeJJ countryNN goesVBZ hellJJ governmentNN triesNNS banVBP videoJJ gamesNNS knifeVBP crimeNN rapesNNS mindlessJJ violenceNN skyrocketedVBD,1
newsNN reportedVBD lastJJ nightNN beastVBD caughtJJ eatingNN partsNNS youngJJ manNN policeNN gotVBD ontoIN busNN apprehendNN,1
AsIN farRB goesVBZ anomalyJJ placeNN,1
sureJJ negroNN comingVBG,1
OrCC tryVB yellingVBG nigsNNS yaRB getVB suspendedVBN jumpedNNS hopefullyRB newJJ wnJJ friendsNNS yaVBP dieVB tryingVBG lolJJ battleNN cryNN,1
OrCC matterNN thinksNNS treeVBP,0
YouPRP searchVBP mapsJJ languageNN spokenVBN timeNN,0
IPRP manyJJ tastesNNS,0
HereRB possiblyRB bestJJS countyNN liveVBP oneCD considersNNS,1
70CD IPRP wouldMD sayVB sureJJ,1
ADT GloriousJJ usPRP usheredVBD TheDT DawnNN,0
IsVBZ coupleJJ secondJJ pictureNN darkNN yellowJJ backgroundNN femaleNN maleNN somethingNN looksVBZ likeIN designedVBN sendVBP messageNN,1
CarverRB muchJJ fraudNN,0
gladNN pointedVBD antiBullyingVBG campaignNN usedVBN promoteNN homosexualsNNS likelyJJ bullyRB anyoneNN disagreesNNS,1
TheDT storesNNS IPRP wentVBD nonRB nightNN sightsNNS modelVBD 775CD 860CD IPRP paidVBD 700CD nightNN sightNN modelNN newJJ saleNN sigsNNS,0
whiteJJ nationalistNN christianNN faithNN stillRB whiteJJ nationalistJJ racialJJ survivalNN antiNNS racistVBP christiansNNS trueJJ chirstiansNNS ememyVBP,1
YeahNN msnbcNN wouldMD airVB videosNNS likeIN getVBP muchJJ higherJJR ratingsNNS oleVBP negroJJ grumblingsNNS,1
IPRP gotVBD oneCD lastJJ schoolNN yearNN IPRP awayVBP,0
TheDT conceptNN honourNN respectNN feelingsNNS othersNNS,1
6CD uniformsNNS,0
LetVB nonwhitesNNS polluteVB bodiesNNS garbageVB,1
townNN savedVBD magicJJ negroesNNS AfreakkalandVBP,1
YeahUH goneVBN hellNN remainingVBG whitesNNS goneVBN becomeJJ zombieJJ townNN crumblingVBG buildingsNNS dealersNNS junkiesNNS,1
IPRP UkrainianVBP UkraineJJ nationalistsNNS rightRB wingVBG understandJJ whiteJJ raceNN nationsNNS alongIN whiteJJ nationsNNS supportNN joinNN togetherRB multiculturisticJJ agendaNN invadingVBG everyDT whiteJJ nationNN startNN powersNNS responsibleJJ genocideJJ startNN consideringVBG deportationNN nonNN whitesVBZ whiteJJ nationsNNS,1
IPRP wouldMD likeVB lookVB roundRP laterRB yearNN lookNN roundVBD likeIN beautifulJJ countryNN airNN googleNN,0
HighJJ timeNN getVB backRB motherNN fixNN messNN,1
InIN,0
ManyJJ alcoholicsNNS fallVBP zapoyNN drinkVBP 57CD litersNNS palenkaRB daylightJJ timeNN drinkingNN waterNN oldJJ breadNN zakusNN escapesVBZ showVBP extremeJJ europeoidNN genotypeNN,0
EspeciallyRB orientalsNNS lookingVBG whiteJJ,1
