Msg,Tag
I would rather white person high school diploma white high school teach kid read negro college degree teach kid read even getting paid ,1
sounds like government great job able maintain current situation,0
Notice one Hungarians gave one good source validating preposterous claims came complain start name calling stupid liberals ,1
YouTube Broadcast Yourself ,1
Like I certainly nt Ireland especially NI littered memorials even statues red terrorists ,1
Most school age youth cannot access main K K K site schools access Stormfront ,0
The non white homelands much trash crime non whites mainly choose stay away ,1
These Rapist techniques ,0
Just show Whites one common goal ,0
Have noticed white beat blacks usually end one punch leave ape alone ,1
Maybe blacks nt better body shaped hunt animals ,1
I hope black creep get easy ,1
Blut und Ehre ,1
sent ya pm ,0
I go city yesterday I could belive happend I think must seen every peice dirt every corner globe horrible ,1
The idea homeschooled kids nt get socialized ludicrous ,0
Quit eating mexican food places ,1
Keep Russia free dark skinned beings thank please forgive mistakes ,1
Those countries much better government terror made ,1
Once blacks showing cannot control ,1
Is nt EU wonderful ,0
It uncalled UnWhite uncivilized ,1
That truly sad I nt know anyone could destroy something old ,0
Face shaved moustache trimmed ,0
It sould made youtube video story put netImagine cop white dead guy black ,0
I retract always Always animal lacks skills properly raise half human child ,1
If kept check may living actual Planet Apes soon ,1
Well I wonder started messing daughter yet ,1
We little piece legislation called Prohibition Foreign Military Assistance Act This prohibits mercs operating South Africa pain five years hell kaffer jail ,1
The work place pensions advert pretty bad anyone seen ,1
Also sticking coat flourwater mixture like use large posters dries see damn near impossible remove later ,0
Thank Odin nt try come modern day ,1
As I said races mixed difficult white black Asian proves races exist ,0
Remind another Jew tool basically spitting graves millions people murdered real Communists ,1
One day I seen EBay I sure authenticity mask ,0
Put Shakespeare Shylock shame Mr Weiss whiskers would indistinguishable rat ,0
Forsetinn segir það hafa sent mikilvæg skilaboð til annarra þjóða að Íslendingar skyldu styðja sjálfsstæðisyfirlýsinguna ,1
11000 euro ing scum wonder anyone would get anything set polish area started begging would probably get ing beating ,1
Karina Sørensen er medlem af økontaktudvalget ,1
Some people really weird thinking Have Bullhead Az ,0
I feel sorry people living wish could move hopefully nt suffer like neighbours zimbabwe ,1
Toronto Police Investigating AltRight Posters Hate Crime ,0
Honestly better idea private schools people average parent poor teacher ,0
wwwhillsdaleedu St John College Annapolis Md,0
That ape tried gang lone white ,1
So use jew run media brainwashing service give credit soo black people ,1
Not good news happens European nations doubt pushed likes Jews like Summer Redstone MTV ,1
I seen guys lose girls high school lives ruined point switch schools teasing tormenting losing girl ,0
Maybe opened eyes see I ,0
Im young viciously angry I going lie apologize actions treat non whites like utter crap always always nt human eyes Anyone tries wipe race culture met hostility race rape abuse women met hostility contempt WPWW,1
My father born Germany My mother parent moved Ireland ,0
Since little kids nt want rude ugly black kid compared others even adorable kinda scary lol,1
The good thing Indians married women loose prostitution fails Indian areas ,1
I recommend Quex watch first ,0
It loads I Thailand Thaiguys running water screaming Tsunami tsunami behind one foot wave,0
So arid hot Mexican colorless ,1
I either North Florida Nigeria sometimes ca nt tell difference mothergrinninbirdyahoocom,1
Elk Hunter,0
Anybody half brain knows BS Negroes nt done anything development society let alone Europe ,1
Listen I admire wanting make negroes feel better evidence FOR race overwhelming ,0
They culturally raping european countries every way ,1
Faggots always pushing homosexual agenda ,1
WTF wrong Irish ,1
I seen negroes look undoubtedly act like ,1
By words deeds declare staunchly favor genocide people ,1
Hey I Mesa ,0
Irish There nothing wrong polite ,0
 Karogs sarkanbalti sarkans miru os un dzīvos klāj pretī sarkanajam mērim nāves sardzē latviet stāj ,1
I agree ,0
At 17 years old Travis Jones front judge times ,0
Sorry gay ,0
This struggle make self ,0
They contain songs many ballbreaking bands ,0
Goals,0
May New Year find us even unified ,0
All music good ,0
I would like express sick tired I biracial halfbreeds kids school boasting unique heritages ,1
comwatch v kBD6Gm6VoDM Then watch 8 min Obama AIPAC youtube ,0
Jews insane literal demonic DNA ,1
The Jewish race without doubt greatest threat survival White race ,1
So laughable ,1
But Wayne I want brown baby like girls estate ,1
I lame I know thought I could get one setting 88 2508,0
print get comic stores get lot coverage population oppinion ,0
I lot albums left house I bought grandfather estate passed away ,0
As I commented days ago thread massive race ethnic mixing tends preceed massive race ethnic war ,1
But knows ,0
He listed friends ,0
Theyre trying turn Internet mirror version television words turn wasteland celebrity worship wipe potential medium informing educating ,0
I shocked see blacks moved Holland S,1
I guess I lucky friends white see problems I ,0
Hey Braveheart I almost 20 years old I 5 6 blondblue 120lb female ,0
YouTube MACEDONIAN FANS IN CROATIA And YouTube Izlezi momce MACEDONIA VS GREAT BRITAIN 23082010,0
It outstanding ,0
The species constantly grabs crotch front others waves arms around furiously 1 monkeys 2 blacks 3 Need I say ,1
One Chinese get teeth country take ,1
theres working class chav ones breeding yet aspire act like blacks needed direction national service ,0
Well exactly pic check new avatar ,0
The reason want ban cross repersents race Christian faith ,0
When people wake ,1
I blame Ottawa like cities multicultural hell ,1
I read try add words learn well ,0
It wasnt really dangerous perse stinky dumb poor 5 white kids outcasts made hooligans crazy ,1
Yeah remember jews cunning would probz slither way justify right bare arms use pro jew media without doubt old holocaust excuse race would blame us brainwashed young age TV schools job wake comrade defend fast becoming minority countries,1
least reported wonder many cases like one happen USA England etc never reported ,0
Im yer side ,0
Iron sights ,0
This wrong ,1
Many Asians see something memorize rest lives asked works use creatively draw blank ,1
I hate word racist makes people called racist think something wrong immigrants coming something wrong,1
God I hate Canada ,0
This nt local 4 diamond Hilton situated sunny beach ,0
Black people biggest pawns ever everyone uses crime always fall guyItalian mob uses dirty work mexicans use japanese use chineseNow know whos name ,1
How anyone teach discuss past events leaving race people responsible majority strife amongst Europeans ,0
That cheap low I seen around task transparent laughable ,0
Voice opinions without riding coat tails others ,0
It goes show IRA criminals freedom fighters claim ,1
Can someone tell Me I find mp3 CEBEPHIbE BPATA ,0
If I could create disease wipes Black I would ,1
This another case hits stomach hard ,0
I pm suggestion place go I want post I think nonwhites read site proceed try move ,1
But like I said many times haplogroup type ALONE tell describe ones whole genetic map one looks like ,0
Holla ,0
The vegitation lot tree thorny burrs ,0
Have fun trying convince Europeans unite one government EU collapses ,0
Traditionally always lot despite fact NE Asians extreme version breeding strategy ,1
To hell making stand think go southwest go offenceive drive every race Mexico ,1
Garners major news media attention weeks ,0
Hey Welcome Stormfront ,0
Sørensen 19 år er født 8 april 1982 Kolding ,1
It important people realize gays want gay marriage desire sort government paperwork seeking right adopt defenseless children ,1
Just shows absurdity Obamamania athletic white woman attacks one libtard proclaim holiness another libtard may worse ,1
Wow hundreds dollars per day spent hacking attacks ,0
YouTube Broadcast Yourself ,1
Arab militaries incompetent ,1
Progun Jamie Gilt shot fouryearold son Putnam County Florida Daily Mail Online,0
nobody said I like I dont see reason like honest WE HAVE ENOUGH CULTURAL HERITAGE FOR HUNDREDS OF GENERATIONS WE SHOULD BE PROUD OF WHAT WE DID NOT OF WHAT SOME AUSTRIAN DID ,0
The times changing ,0
May get mad cow disease ,1
First rations food need water need ways get food along way guns ammo fishing lines traps nets etc ways get water containers purification tablets filters etc ,0
I always thought Ireland last white country left ,0
By fruits ye shall know ,0
No white person ever compared black useless races ,1
Its funny languages similar ,0
well hey skinhead holy war need start gruop join law church creator attack,0
That Norweigian black metal band Emperor ,0
Good shape ,0
The person also make history field ,0
It great meeting guys last night ca nt believe many us managed hook nearly entire crew see days ,0
I ca nt wait till take country convert Islam ,0
I happy part girls cannot wait get started ,0
Having worked around blacks previous job every stereotype hear true ,1
Theyre coming woodwork oppose white unity White History Month ,1
My mother teacher fair back thought colored folks wonderful misunderstood creatures teaching majority non white class couple years longer thinks great,0
Why would gooks want look white ,0
I cali moved utah get away filth ,1
Formed aeons ago vaporous state HESHE ,0
Eventually wo nt able tell sad ,1
Piece deserves shot ,1
Do nt come hard alienate keep light hearted attitude let know find actions disgusting ,1
Why would I want contribute Kneegrow spic wellbeing ,1
Seems like black criminals get sympathy msm innocent white women ,0
Attitude everything ,0
Theres something gross assault senses sound European romance language coming mouths savages ,1
Many Jews Red Army many wanted opportunity rape murder whites guise war ,1
The Third Reich one world white racial state ,0
People sticking white men ,0
Well actually young people converted ease ,0
Hey guys please go help us send Mexicans back Mexico ,1
In Limerick caught knife Jail loads women sent prisonVery violent place afraid ,0
They like virus human get inside country taint sickness pretty soon whole country goes hell government tries ban video games knife crime rapes mindless violence skyrocketed ,1
They nt band group like white pride group pretty big tv quite times ,0
 Bernt Anker Hoffman PackIce 1929 ,0
Warning Graphic ,0
im going moving southern california soon washington wondetring many people seattle tacoma area thanks steven,0
I post much I I BNP supporter expert ,0
hey hows live georgia wanna talk PM like talk maybe ill see POWDERLY KY NORDICFEST ,0
I bet see Mexicants space Google Earth photo ants picnic table CYF salt earth,1
BaoFeng 左眼技术 采用左眼专利技术 利用cpu和gpu有效提升画质 在线高清 shd专利技术 1m带宽 流畅播放720p高清视频 3d技术,1
Some kind hard follow japanese interesting ideas relationships dialogue making sense general ,0
They dress like blacks talk Ike act stupid ,1
Double Standard ,0
Francesca Ortolani aka Aufidena YouTube Francesca Ortolani Aufidena In deinen Augen YouTube Tomorrow Belongs Me YouTube Aufidena When moon comes YouTube Aufidena Towards Light YouTube Francesca Ortolani The Scarecrow,0
These things make sick ,0
Look evil slave ship evil slave master forcing blacks leave utopian paradise Africa httpwwweuropeandailynewsorgwpanmigrantsjpg,0
One day true people come power italy go back came Italy Italians ,1
4,0
TAKE COVER YouTube UPDATE 1pm CST Meltdown Outgassing ,0
But must need able name characteristics credibility need collect anthropological genetic evidence prove white race ,0
They wo nt rest till wiped us face earth,1
Obama membership Prince Hall blacks lodge become next president according guy youtube httpwwwyoutubecomwatch v nLfRsReGII Zagami youtube ,0
wwwcalvinedu Christendom College Front Royal Va,0
I excellent credit money would never live Southwest ,1
TF ,0
White nationalism superiority 14 words ,0
heard radio local council decided give housed emergency accomodation promise house new social housing development area ,0
could debate nigerian woman pity listening good laugh listening person trying hold civilised conversation,1
My prayers go parents fighting back abomination nature ,0
When I watch things like I pray God vengeance sub humans even asked forgiveness ,1
I even thought showing paper sell outside Heathway train station following saturday,0
There places walk around day see single white face ,1
You find worse since able blend fool people thinking genuine ,1
Sort back handed compliment antiWhites keen come tell us lost heart hearts even must know constructed temporary ripped day ,1
May need turn savages loose justice take care ,1
Yes negroes busy last weeks expect nothing done crime committed,1
Im ugly I first get morning I face mother could love ,0
Their identity Liberal Tribe seek morally support members tribe ,1
Call jackass tell hundreds thousands foreign nationals invaded country laid seige cities May 1 ,1
Latha math dhuibh agus dè tha dol agad fhèin PhàdruigHello Pat ,0
They completely different us living within sight us go back Africa die ,1
WhiteUtopian,0
Whites hide white cities towns neighborhoods etc ,0
I spend huge amount time playing daughter reading teaching read Hop Pop among others etc ,0
Sorry last comment published 2 times I thought published I problem internet ,0
When I age I close Swedish female friend whose Swedish family friends I also met looked far better contestant ,0
This precisely frustration brings White person round white nationalism obviously exactly right place ,0
Still little bit truth slipping Israeli mouth Surprised thread moved news ,1
May wigger sister parents haunted death rest lives effect hands actions sister daughter murdered beast ,1
I ca nt find actual picture anywhere lots references ,0
They mutilate best see see goyim slaves also marked ,1
Situation Switzerland terrible blacks muslims everywhere We great Country great People monkeys transforming Switzerland zoo law respected ,1
Therefore everyone thread holocaust survivor ,1
He telling truth usual filthy jews need clamp soon possible ,1
put kids ophanage arrest whore mother point biracial kids 8 kids suffer lives due whore,1
Lets clear Neolithic farmers ,0
We turn cold useless parts Canada dumping ground Jews arm Indians keep line ,1
If brown flush ,1
Good time progressive libtards got generations young white minds perverted pseudoeducation ,1
I made copies passed em friends family ,0
Huh ,0
It carried Ireland English Invaders came nt wanted steal Irish land Irish lives ,0
There lots brown black kids system gays could adopt ,1
If already done check Stormfront South Africa section International Forums ,0
God bless hell blacks ,1
If stopped worthless thing would starve ,1
The moment I saw hammer sickle cover I practically threw game back onto shelf walked away ,0
You worried affirmative action liberals spot ,1
More Jamaica YouTube Fighting rages Jamaica Notice video made AlJazera Major Chimpout Warning ,0
Note mention part four ,0
I green eyes well mine blue ring around outside ,0
Do nt sit around argue act like pathetic try shame ,1
You telling 78 kids 6 Frankfurt foreigners ,1
High mortality rate like country war ,0
And Asiacourt beautiful safe WHITE area Scarborough last checked garbage infested Chinease outpost ,1
Later I went get beer I opened door yep guessed blood geyser ,0
nah man enough ,0
Save Ireland job works MSI saying important job trying stop Immigration invasion Ireland ,1
I disgusted amount white hate brown love teachers try pump 16 year olds head ,1
I wonder like ,0
Mate Britain ,0
They better daughters disowned instead parading kid around town looks nothing like ,1
 As I watch safety front computer monitor ,0
Why White people used say sex sin used mystery I saw children browns mixed race children popping around ,1
The Brown Black filth starting creep Orillia Midland sadly ,1
No bad never lower self level self denial blindness ,0
I suppose concept male cow female cow producing MORE cows repeating process much understand ,1
httpwwwabc25comGlobalstoryasp S 5352185 Non whites commit far crimes whites year never considered hate crime alot never spend time jail ,1
I Birmingham even nicer suburban area I getting darker darker ,1
httpwwwhardylawnetTruthAboutBowlinghtml,0
simple white genetic code doesnt include racial commitment crime glad reasons society turned take stand defend race must secure existence people future white childrendavid lane white racial loyalty starts keep white,1
Yeah London gone hell remaining whites gone become zombie town crumbling buildings dealers junkies ,1
YouTube White family beaten mob blacks YouTube Black gang Des Moines Iowa chants It Beat Whitey Night assault white people YouTube Black Man Punches Blind White Woman On Bus,0
Mostly playing loud kurdish music ,0
You know nightmare day wake black muslim running country ,1
Rap acronym Retards Attempting Poetry ,1
Thats ends leave blacks alone guess ,1
looking sisters brothers hang get know cant semm find area ,0
Unfortunately poor White families parents work ,0
I boat extent ,0
Joy To The World Celtic Christmas Music YouTube As I Went Out Walking Celtic Christmas Music YouTube Gra Mo Chroi The Love My Heart wwwcelticchristmasmusicorg Irish Celtic Christmas Music YouTube While Shepherds Watched thier Flocks Night YouTube King College Cambridge Choir King College Christmas Carols YouTube Merry Christmas love Jesus ,0
She week school thanksgiving kids school still 2 days went schoolOn way back explaining side mothers side heritage explaining different countries told get map Europe color countries ,0
Full Story httpwwwabqtribcomnews2006maruringtraffichttpwwwabqtribcomnews2006aprionofreturnhttpwwwabqtribcomnews2006aprusofficialshttpwwwabqtribcomnews2006aprtedonmurderhttpwwwabqtribcomnews2007aug astorgacase,0
Its going take everyone working together beat New World Order ,1
This jew idiot spewing nothing propaganda ,1
Innocent whites including white children murdered heartless groid savages ,1
httpwwwstltodaycomstltodaynew A OpenDocument,0
I Bear compound bow I bought many years ago ,0
Animal Grief 19th Century Old Shepherd Chief Mourner Edwin Henry Landseer 1827 ,0
I hope classes future Russia,1
 My message UPA Bandera scum Polish American small town politician Pennsylvania ,0
So please Zuma good little kaffir take land,1
Do notice primate I mean black kid arm around white girl ,1
Kokkepige Stuepige Barnepige Tjenestepige Tienestefolk Huus jomfure Housesomething ,1
Send message plan come make arrangements meet,0
WRS 1488,0
Just watch North America like black sport players slang ,1
I dont see people ignore issue much longer ,0
I dont think work moot much libtard allow going long,1
Because IllyrianCelt tribes Dalmatie Japods etc lived present day Croatia Slavic Croats arrived assimilated IllyrianCelts end Germanic influx Frankish empire Holy Roman Empire AustroHungarian Empire ww1 ww2 period ,0
I feel like I pull passport I want walmart ing pakis,1
They Brown Lines ,1
Det er forresten en ting til Órkneyjar vil si deg Tack så mycket ,1
Only f n jew would nerve hide away black country fugitive US law making campaign promises time suing company defrauded ,1
3 3 related images One Savannah Most Wanted Captured 2nd Marine charged Las Maracas shooting WNCT George Crocker 52 minutes ago 21 year old Erwin Rodriguez Jr Camp Lejeune charged one count Assault Deadly Weapon Intent Kill Inflicting Serious Injury ,0
At least Germans movies dont speak English American accent like old WW2 movies ,0
They scared Nationalism whites ,0
Youre right ,0
When I around young people rap music negro culture comes I make gestures implying savagery blacks ,1
Its common whites love ethnics nt know seen pc image tv ,1
Glad people still opened homes let kids trick treat even usual DieVersity infesting area ,1
Thanks,0
Shows sub human group negroid belong poor horse got infection dirty pervert ,1
She probably victim groid rage rape also ,1
Also us like believe genocide another race abortion Black race 92 abortion clinics Black communities nt believe race mixing ,1
The outline events boys fathers interesting ,0
Blacks seem hell bent embarrassing acting like animals everywhere go pretty typical behaviour ,1
There extremely genetic markers restricted 1 specific area let alone 1 specific nation ,0
httpwwwgreatschoolsorgcgibin r855students 99 negro ,1
Ginger candy sold internet relief pregnant women morning sickness symptoms ,0
Want libtard oppose abortion ,1
It unfair representation nation Some random bulgarians IMG httpphotosbakfbcdnnethphotosaksnc3hs477snc326143100549093315633100000816283788132896985315njpg IMG ,0
All jews I ever known anything money I say good jews,1
Want libtard support White Nationalism ,1
We trying get people every White nation around world distribute White Nationalist flyers Saturday night October 13th ,0
General1812 I think maybe starting cold feet race feed die ,1
The sheer disrespect standing making clean mess laughing ,0
id like kids eventually sterlization great really use ppl produce kids wackos nutjob herditary ,1
Also sad see much pre made crap grocery buys ,0
Never Enough YouTube FPV Hexakopter flight base village Whitefish Mountain Ski Resort ,0
They behind crucifixion amongst admit ,0
No need allow FACTS get way good White guilt message jew laughs loudly ,1
I want see styles clothes wear etc ,0
Nevermind found new page Knew groid report rape ,1
love jews get taste thier vile medicene I hope every one young old starve cold,1
open new shop somewhere get son interested education hates school help mor ein community try whiten things ,1
Spectators ran onto field began beating protesters ,0
It would far first time jews come fake hate crimes besides general guilty proven innocent ,1
They close many believe interbred ca nt interbreed chimp ,1
Did note info Israel ,0
I sin fritid går Karina Sørensen på jagt med sin far dyrker styrketræning eller nyder tilværelsen med sin kæreste ,1
I allways stare first serious eyes long distance ,0
So nt complaining mud races ,1
Lack compassion seems go hand hand lack White blood ,1
Thank kind words hope meet new white world one day soon ,1
Exactly especially since photos White White instances Black Black ,0
There two outspoken artists Steve Hofmeyer Sunette Bridges ,0
It always screamed Grow ,0
There problems different classes inside race white since whites joined fight nonwhites enemies ,1
Pornography prostitution outlawed jewish filth naziorguk,1
Damian Brown 26 taken custody East Baton Rouge Parish sheriff deputies charged identity theft officials Scotlandville Elementary say put three different social security numbers applications ,0
This false front jews present world jews quite varied opinions beliefs ,1
The Black race yet invent kind civilization ,1
Beware falling house prices Negroes bring another reason never find living near politicans ,1
The Prime Miss Jean Brodie Trailer YouTube,0
If lies money would richest negro world,1
Racily little changed ,0
If Canada small nonwhites would everywhere many whites live rurally small towns nt see racial disaster unfolding Canada ,1
I feel though border much much south ,0
I luck meet africans past I promise black worse cancer world ready sell sister imagine Countries ,1
This thread reminds post old board ,0
I wonder paint plus 1million illegals working service industry living bosses cupboards ,1
I sort hoping bring back Ebola spread around kind rest undesirables wanted ,1
times Whites forced live around lot blacks ,1
No I hope negro right ever ,1
Are normal people left ,0
I least never willingly pay see propaganda maybe watch free show influence jews got white genocide people ,1
Angry sheboon trashes liquor store ,1
What amazing picture ,0
fag jew teacher told pricipal white power markings binder backpack suspended 1 week ,0
Africans Ireland treated like paedophiles ,1
If ever ride L Chicago pay attention color codes ,1
This typical Afrikaans music ,0
If want hear black intellectual lol sounds like check woman video trying debate Dr William Shockley ,1
String em ,1
Waiting buy new product almost always good idea let someone else experiment ,0
The big black females pushed way Houston city counsel meeting said white teachers used quit wonder sent us replace teachers bunch dumb blacks ,1
We work together look blacks cant We think individuals things right told asians cant,1
We simply enough ,0
Antiracism CODE WORD antiwhite max,0
SA model World ,0
Id like add media reporting paper diabolical ,0
Maybe spread HATE intolerance ,1
Cheers,0
How earth Swedes result race treason ,1
Just shows thick actually one farmerone bullet end starving asking WHITES feed,1
This disgusting negro makes us white people look bad ,1
Deport Indians back India make pay trip ,1
He live forums day job ,0
Hell tend give tinker darn friends ocasionally smoke weed ,0
The liberals going get panties bunch people like saying must learn defend ,1
