Msg,Tag
Also check website ,0
Every word truth ,0
Not many ,1
The problem many white liberal self hating traitors side Jews nonwhites ,1
They aught ashamed covering downplaying story predators ,1
Demarco Harris facing life prison killing Trisha Babcock,0
You forgot add spread disease poor hygiene causes pest infestations rampant drug use sexual assaulting white women children ,1
I wish luck wonder Jew males lust White women ,1
Більше читайте тут ua ua Google translate works kinda ,1
Yes indeed yes jew ,0
Jag har inte själv varit med någon gång men jag har stor respekt för de som deltar ,1
YouTube Original Romper Stomper Soundtrack The Smack Song Irish white black fact vote S F YouTube Romper Stomper Fourth reich fighting men,0
Yes skin color ,0
They may something Gay Men Will Marry Your Girlfriends YouTube PS Please nt bite head mostly entertainment purposes ,0
Before coming Whites Africa wasis history ,1
In I came across twisted new buildings located ,0
PM ,0
White Watch,0
Every action taken reveals completely unacceptable citizen White societies All blacks browns wreck destroy done ,1
hmm wonder get jump river put ad TV billions gold bottom river ,0
Homosexuals practice perverse lifestyle destroys body mind soul drug use merely two paths destructive end ,1
need feel skin next time wont give land subhuman muslim dogs ,1
Also contradict ,0
How Jews God people tring kill ,1
Dont take wrong pig pig country actress played part show ,1
A public execution animals would go LONG way point justice done would never bring girl back I guarantee would send message ,1
Probably good idea call kid teachers find learning dont cause kids fall behind classwork though send message school dont intend educate kids might get back bit ,0
My children like whites I problem question But spread articles sites already know,0
Whites glory impossibly large hordes nonwhites ,1
Except course pander filthy sons daughters Satan like ol Sandra ,1
heil sisters brothers lit see makes I nt care looks I happy puppy WHITE PRIDE thin right skin kkkk AN ever We family war gods race stand tall proud ARYAN 88 Goldenboy 88,0
The future long sit wait overrun subhumans ,1
Here old school picture think 1994 ,1
Im looking forward seeing western media apartheid twist story whilst ignore racist pension land reform genocide ,0
I really worried one I thought bunch groids going hop cars signifying town get excited women remove clothing ,1
Do nt make start copy pasting DOJ statistics ,0
Take slow gradual hell make watch MTV hours thing animal planet gradually introduce views ,1
Indeed quite odd something like posted forum ,0
At least far I tell ,0
Paris weekly riot fest ,0
The way Jews run government ,1
The day I chose child I hope many schools like across North America ,0
The reason dropped school either drop got kicked always fought packi gang school never going back auto class handed n igger monkey wrench told name suited aswell nonwhites hated wore nazi punk white pride patch coat backpack got fight black chick next day butchy sister caught hall way said school gonna fight told u wanna fight gonna fight right right school u gather rest u monkies uneven fight huffed stormed away neevr get fight last straw first day school forgein substitute teacher talkin guy case turning around getting work done ask times finially stood said look white ur black telling u whut ohhh man guidance conslour nt like principal nt school happened month ago people went school n igger try rob knife point forest gf sat back watched friend came jumped personally went chick ran caught smashed head tree thats stories got dont time,1
Let see get zero ,0
Hopefully traitors encircled Westminster palace ,1
And David Irving site offers Hitler Table Talks ,1
I little kid I used school somehow spoke jew dude got narcissistic laugh every blonde joke favorite blond went donate semen using mouth container sad blonds fault also let happen ,1
The thought Africans space laughable ,1
Wow,0
Sounds like heavenly community ,0
Except peanut butter,0
I readNesta Webster Gary Allen Douglad reed Protocols over30 yrs ago I feel sorry cannot work roundit throughit ,0
They cultural threats,1
The problem blacks heads hey already known ,1
Your White went black school problem ,1
Ever noticed always say Romans Greek armies No one says oh I wonder many non Whites Goth Gaul armies ,0
Looks like JJT taken lead ,0
Oh I nt know Look possibility sentence use values ,1
The census results released next year ,0
Certain cultural practices tell volumes people nt ,1
It built contractor New England ,0
So Stormfront Ireland solely responsible racist attacks Ireland lol Ted right work Kikes ers never happy ,1
I wonder one guys Jew ,0
Can finally bury holocaust ,1
If search around probably find hoax 20th century free net ,1
Shocking ,0
I really hate rap music ,0
Well nothing White Nationalism ,0
So new rules Free Speech Blacks Browns ,0
I saw white black couple day nearly went ballistic got enraged ,1
Theres aborigional day black pride month ,0
Also I agree fair monkeys compare black people ,1
Breaks heart ,1
I going go old man ,0
I going beat dyke fag coon ,1
I believe posted sound victim face blurred ,0
nice kick nuts always work I find dirty move kick another man knackers black nt equate standard,1
Well never give The jews keep trying opening borders sending third world minions European people WE WILL NEVER CAPITULATE ,1
When ever I see white children murdered sub humans makes angry I could cry ,1
Have ever spent time outside Vancouver area ,0
Their nonwhite societies failing every area yet trying force White civilization accept backward nonwhite culture ,1
You wigger stage ,0
Black Asian immigrants coming borne breading patterns threat gene pool white Europeans polish people ,1
Somehow I think maybe troll ,1
Residents racism organised march demonstration whatever keep killers ireland bring ,0
Larger fish eat smaller fish step big eating small go chain mercury becomes concentrated thus larger fish chance mercury ,0
Indeed need feed educate police ad nauseum ,1
Also lots bear ,0
Well least dumb negroes got fact Jews evil right though I suspect whitey jews one primitive minds ,1
Many masters desire ,1
May always Rest Peace prayers go ,0
Do post VNN ,0
Freundschaft Sleipnir Nemesis withmit English andund Deutsch Lyrics YouTube,1
Well entire world brainwashed JudeoAmerican films today everyone Jew every corner house ,1
Im glad hear brothers ready fight like lets hope future immigrants right get something good enough finally leave,1
Verl RechtsRocker lebt bürgerlich Verl Neue Westfälische Nachrichten aus OstwestfalenLippe Bielefeld Gütersloh Herford Paderborn Höxter Warburg News Meldungen Informationen Neue Westfälische Verl For days Yule Zionist controlled press Antifa scum laying siege Marco Sleipnir family home ,1
Dont eat Snickers candy bar turn negro Also obligatory White doofus guy end ,1
I extreme mini blizzard cookie dough Dairy Extremist ,0
crap blacks tougher stornonger etc crap aint matter street new ball game,1
We put torches go home suck Jew dcK JUST LIKE YOU ,1
Get watching monkeys throw ball around get real hobby God sake ,1
Here logic whites corrupt whores Jewish supremacists therefore Whites oppose Jewish supremacist extermination Whites JS efforts control humanity future ,1
I meet lot Chechen weeks back shocked see light skinned light brown hair blue eyes European facial features ,0
They probably highmaintenance one crappy old East German Trabants though ,1
Not mention nt belong anyway ,1
Now hundreds years thousands ,1
The Juden never stop race mixing yet nt want ,1
Anything goes days make Whites look like total jack asses ,0
Crippin nigga ,1
httpswwwyoutubecomwatchvfRh48AdAS1A RACIST HATE CRIME YouTube What Do About Racist Behaviour ,0
The final solution goyim problem ,1
And general idea pick anyone site thats logged say hello ,0
Hi everyone I Slovenia I utterly hate every living muslim world I despise even dead ones,1
I never started dont contend addiction drugalcoholsex free whole life ,0
Yes everyone check videos great way introduce people idea open White Nationalist community PLE ,0
If makes brainwashed ,0
Shoot Private Message nearby interested thanks ,0
As nation desperate need immigration time zero tolerance policy illegally ,1
Ta ra aye ,0
Lady Gaga ,0
Because communist party almost jew kill gentile stood way property jew communist wanted ,1
Three posters ready definitely antiracemixing ,1
In reality money charade ,1
They sleep dirty floors dirty houses dirty kids eating dirty plates driving dirty cars sitting dirty tables dirty manners dirty way talking dirty way living wear dirty clothes dirty smiles allaround dirty nasty people ,0
My wife showed Kibble n Bits commercial last night wherein mixed couple presented normal ,1
I hope little groid tortures ,1
Can warning pictures like posted please ,0
After 7 kids poor neighborhoods start showing usually poor blacks ,0
Last thing want moving reserves ,1
I heard white guy killed race traitor slut nig nog boyfriend ,1
If I feel threatened especially fools bet I quick kill ,1
I honestly hate Indians Muslims really anything brown black yellow coloured skin I hate ,1
Its people like face represents filth Islam ,1
Terrible Tommy coming LimerickHe get short holiday lone wolvesHe wants go King johns castle see townAttachment 78266,0
Hails,0
Knock Out With Knife Hands US Marines YouTube Kelly mccanjum grover uses lots strikes area teaching combatives,0
First give us sars standing watching law get broken WTF ,1
Homosexuals stay closet ,1
Who hell cares kosher ,1
I went outside niglet mom told daughter hit first ,1
Im high school senior ,0
Wonderful people great food ,0
We want real teachers white teachers like white schools ,0
If prepared make effort holding faith Ireland future leave board ,0
Visit used book stores Riverside ,0
But Truth Fiction site also says false ,0
Well family tree comes Macedonia also white part anyway ,0
Wasnt something like big bang burrito exploded beans flew everywhere started reproducing exponentially ,1
Its comes u least expect always someone everyonethat belief ,0
The crossdressers faggots sure hiding identity ,0
Who would know exploiting people nt give crap member tribe ,0
All ukraine RussiaPolandRomania fake ukrainians ,1
I always wanted log cabin though ,0
Sounds like Jew teacher ,1
It coincidence attack packs side herd every ethical question inferior know illsuited standing alone thinking complex scenario settle upon internally consistent position ,1
Hello Everyone Stormfront Have heard lot good things forum I decided take plunge ,0
THe thing asking alright remain afterwards ,0
So far today I come across words scum slut bitch ,1
Yeah I saw news segment mixed race couple lost home mudslide ,1
Made Dream YouTube Vocalise Jackie Evancho â Vocalise Official Audio HD 2015 YouTube,0
Two black fag holding hands ,1
The concept honour respect feelings others ,1
Send PM going ,0
And flood white countries much ,1
Brown eyes Brown hair make less white someone blonde hair blue eyes ,0
Can mod also change thread title says 10th dont want people showing 10 days late,0
I also unfortuantely spent 78th grade 95 monkey house ,1
Children like animals respond appropriate feed back ,0
When whites today much white guilt laid upon feel act black sexual relations children blacks accepted problem white race memo ,1
May victims war whites rest peace ,0
Welcome SF ,0
I assume concept PLE might willing invest one ,0
If means exterminating blacks Africa gorillas healthy big nature preserve I nt oppose ,1
I wonder retaliation Loyalist mobs attacking Catholic homes little interference PSNI last week ,0
Thats I nt display ,0
Humans negroes use restaurants entirely different ways ,1
white race soon brink minority years nothing done stop vile hordes invading lands I one want live city like Bradford Birmingham outnumbered 2 1 worse,1
I hope find ,0
I hate see beautiful white females become victims sick violent merciless animals ,1
Blacks shoot funny thing seem able hit little innocent law abiding child walking home church help take sick mother ,1
Teach strong healthy let watch television reason let watch good morale shows maybe Brady Bunch ,0
Holocaust business ,1
Their stories told instead showing pics non WHITE garbage took I going post pics forgotten ,1
Boy blacks get awful mad sign saying No black Africa becomes wrong ,1
So long httpghettobraggingrightswordpresscom exists I think blacks subhuman savage beasts selfcontrol rabid dog refer ,1
The islamic disease even dangerous obvious black yellow disease ,1
BTW TY compliment ,0
use way intimidae jew show still people aginst originate Roman called wariors salute,1
These figures show one could talk need restrict nonwhite immigration current government largescale repatriation nonwhites absolutely essential ,1
Hi looking round site finally got round registering nice see place openly discuss beliefs ,0
Instead athletic negro Holyfield 11 kids Mike Tyson 7 kids Riddick Bowe 5 kids George Foreman 10 kids procreate like apes spread athlete genes along ,1
As went dubious deeds set museum alarm system ,0
played fox news todaysaid went ape schmidt pun intended baffroomsfox news sucks least people get couple seconds real news secondly ive never heard sheboon beforea new specie chimpout family ,1
Oh wait thats whites kind like zoo ,1
You got wrong ,0
I guess I known many bleeding heart liberals NW get answer thread ,0
It fault parents nt take active role children education though I think stupid kids stupid parents fault schools let illiterate kids go next grade ,0
A lot white women trying create danger drawing people countries ,1
You take negro Africa grow Boston Orlando still reverts innate negro ways moment hits native African soil ,1
It annoying live time subhuman monkey coon thinks okay hit Aryan white blond blueeyed child ,1
A dog collar toddler ,0
HIV job fags keep searching cure never find one keeps changing mutating already 60 percent faggot apes AIDS continues grow ,1
I would nt surprised government took taxes pay checks Trudeau could feed house rapeugees flooding country ,1
It amazing stupid liberals even nearly murdered white Mr Begley still ridiculous loving fool ,1
Just another day ,0
Jeffrey McAdam fatally shot rest stop along Interstate 80 Iowa County ,0
Services account 626 GDP Construction manufacturing utilities 25 GDP Fish fish processing 99 Agriculture 18 Main exports Fish crustaceans 63 2000 Aluminum 194 Tourism Accounted 14 foriegn exchange It looks like pretty modern economy many low skill jobs available ,0
A becsület napjás videó nagyon tuti mindig amikor nézek felvételeket vagy ismerőseim barátaim mesélik hihetetlen sajnálom h tanév pont úgy esik h nem tudok ott lenni ,1
You went ,0
Blacks woman pulls gun bus another woman talking loud phone black man difuses situation ,1
Since learning English second language would reason changing German ,0
I study three half years I start working masters electrical engineering Feels like never ends ,0
I stillz listens da Eminem WuTang Klan Big Up sheot bitches know ta reprazent ,0
The common definition Racist Someone White Skin ,0
Click FREE download colorfully illustrated 132 page ebook Zionistengineered INTENTIONAL destruction Western civilization ,1
It may small local scale I contribute every day ,0
I like genres put Lovecraft list authorsbooks read ,0
All none whites scores start 70 passing grade 72 ,1
This coming week I sliding hundreds fliers windshield wipers cars mall parking lots Houston area ,0
Peter suprise first make comment thread ,0
Justin Trudeau shows international community incompetence arrogance takes lead nation days ,0
Of course sucks perhaps left winged government throw money away immigrants aid african countries,0
If continues worshipping negroes homos odds good scenario repeat ,1
Its matter time become hell hole like Sweden UK ,1
Oh better believe ,0
Trying find buy copy White Power either ships England bought England,0
It symbol demonstrating lack oxygen head members ,1
httpwww1channelch,0
It way ,1
2 gradesage groups Whatever works 3 discipline tactics I nt know ,0
I hope goes well Sweden I lived loved ,0
Is anywhere central London still 95 white ,0
Very good school alot whites hispanics blacks many asians ,0
Och nu har jag ocksa forlorad min Svensk Medborgarskap och far inte har en nya Passport ,1
I searched User CP section cannot find way ,0
Every day little garbage,0
I assume went High Caliber gun show Houston I usually go Conroe I know feeling last two three times I nt get much see anything really caught eye ,0
Same Europe evil yellow invasion ,1
Okay I go logic means willing give piece land ,0
So according logic since blacks NAmerica hundreds yrs allowed stay yes whites leave africa ,1
Why every flyer White languages small print yet native language large print top translations ,0
Welcome cape town women ,0
Not mention fact I never heard anywhere ,0
Should locked wonder long end serving maybe week lucky country ,0
Ireland strange place ethnics pakis But main ethnic problem Chinese Africans Did see much race mixing among men I last time,0
Im south shore ,0
I reply many users written incorrect posts I nt time right ,0
thats good cleaning moscow way like capital thay would clean banana republic Washington DC send blacks welffare resipiance mexico list Detroid 2056,1
I driving near USC It ALL darkies ,1
Oh cannot post subject moment time AREA WHATEVER So I wait maybe untill next spring I go LODZ And JP wait untill starts school winter Bratislava THEN post PLEASE SIR,0
One troll duty several hours partner crime takes next shift ,0
Do huge numbers various turd urine coloured rainbow third worlders like many parts Canada ,1
When I hear term American I think yahoos every color rainbow start wars Middle East Israel benefit ,1
OragusI live San Bernardino send pm evllzrd1out ontario mills eh ,0
I believe another Leader arise going get lot worse beforehand ,0
saw hershey commercial tv ca nt find jewtube shows White woman happily sharing candy mop headed groid male escalator guess I wo nt buying stuff ever,1
Most time quiets sheep want intergrate children makes new generations thugs prostitute ,1
And SA went First World Botha rule deKlerk nt count Third World begger horde ,1
httpyoutubecomwatch v gdYJjUNx6E The maker video may Jewish sure big kosherlookin nose ,1
Meh,0
These areas name preserve rich wont find single white working class person living thereWe might look blacks pakis scum want living near us upper class feel exactly us,1
bloody right mate hey dont get wrong use short cuts time sometimes jus goes 2 far,0
The thing concerns got house council thats house Irish family got ,1
We need eliminate elements white race ,1
Ive always said black people make perfect slaves anyone cannot take responsibility master lives already slave ,1
I swear I would get tee shirt wear school ,0
SAfrican police clash poor protesters Top News Reuters Hand country Muds expect ,1
Yeah msnbc would air videos like get much higher ratings ole negro grumblings ,1
Perhaps I retire ,0
Go major retail mall Kitchener farmers market etc absolutely teeming non whites asians blacks hispanics muslims colours God knows else race mixers yes I hate say I saw day many white women race mixing white men ,1
In battle languages English ,0
Should I go 45 knock em I go 9mm hi cap since like infestation ,0
Adopt musical style hand gestures poison soul ,1
I would hate live Dublin foreigners ,1
Of course obvious Belgians outscored Americans ,1
 I wanna look like skinny white lady black beautiful shakes head ,1
The race traitors sicken ,1
I knew would find new Irish cultural enrichers behind I read story yesterday ,0
ye mention look bit like traveller knew wonder gave wash would really white guy red hair ,0
joined site hours ago ive visiting hand interesting topics things dont see mainstream anymore actualy hell saying never ever seen main stream EVER damn shame ,0
relized fear one morning blare fox hounters sound chasing poor bloody fox safer dressed like hounds ,0
Slavery word special meaning Americans ,1
They deserve ass kicking ,1
The next generation humanity thank infected flawed genetic structure ,1
I nt realize offending pointing often Asians Jews get surgery look White ,1
London nowadays dangerous tourists Zimbabwe Like poster says nt go London go someplace else much better like Bath Stratford Upon Avon Shakespeare Birthplace Londonistan craphole,1
Get hands get one fits ,0
They dung stupid able tap market ,1
They forced wear hijab show different us ,1
Please hurt fine masons first hand maps locations cupped oil wells ,0
An ape without penis never able pass others ,1
I Ukrainian Ukraine nationalists right wing understand white race nations Europe North America Australia South Africa along white nations support join together Marxist multiculturistic agenda invading every white nation start powers responsible genocide start considering deportation non whites white nations ,1
Here examples Gregorian Chant YouTube Gregorian Chant Benedictinos YouTube Notre Dame Gregorian Chants 122806 YouTube ChantCD St Thomas Aquinas Seminary Gregorian Chant,0
They make want go reach people ,0
It come surprise Jews start embracing degeneracy promote goes around comes around ,1
More blackonwhite savagery YouTube Racist Black gangs targeting White men hate crimes Baltimore YouTube White Boy Beat Up Because Slavery YouTube 32 gangbangers arrested hate crime roundup targeting Whites Latinos YouTube Violent racist African immigrants,1
I need get pics tonight I get done shaving ,0
And singers Leaves Eyes ,0
This home town people locals help find want ,0
https wwwstormfrontorgforumt384418 https wwwstormfrontorgforumt291185 https wwwstormfrontorgforumt113191 https wwwstormfrontorgforumt46864 https wwwstormfrontorgforumt101175 https wwwstormfrontorgforumt118865 https wwwstormfrontorgforumt142566,1
Seriously guy VERY primitive even Black ,1
It goodies run ,0
And list middle names son ,0
Id like see report unemployment rates things across UK compared places highest numbers immigrants ,0
So therefore dumb brutes like blacks ,1
The thing manipulated minds foreigners reckon live amongest superiour pagan blood ,1
Daniel Ramsey Shot killed house front wife Valentine Day two negro burglars ,0
With age enjoyed One fish Two fish Red fish Blue fish ,0
What tens millions negroes nothing criminals parasites nothing breed criminals parasites ,1
Jews poisoning wells since Biblical times ,1
I say let let rant mouth Mudslums ,1
The jew media likes prop whites becoming minority non sense want try scare whitey media plays fears average retard thinks hispanic latino race play word play titles like white hispanic white non hispanic magic show nothing But Whites becoming minority Europe homeland much serious issue concerns greatly ,1
These idiots hasten Armageddon get free ride heaven ,1
Rüütel sem staddur er hér á landi í opinberri heimsókn ásamt eiginkonu sinni Indgrid Rüütel sagði ennfremur að mikill ótti hafi verið við að Sovétríkin beittu landið hervaldi eftir sjálfsstæðisyfirlýsinguna ,1
httpwwwoccultopediacomfferalchildrenhtmhttpwwwlinglancsacukchimplaE44kamalahtmhttpwwwoccultopediacomwwildpeterhtm Aragorn,0
The Russian Navy Tall Ship display San Francisco years ago ,0
BTW wrong Mildura I went mid 2000 nt nonWhite sight late last year I went I saw islanders indians asians whatever crap little johnnie could get dumped country ,1
Only surreptitious hidden cameras worked ,0
Dessert ,0
The Official Website British People Party A unpleasant truths zionist ass lickers DUP,1
I never accepted government checks ,0
Then create Marxist style school system dumb reduce obedient global citizens ,1
Hey live smithfield lived newport news jefferson mercury ,0
All time white wife drooling flirting ,0
You realize going convincing loyal board members terrific joys diversity cultural enrichment say Somali Muslim refugees bringing White communities ,0
Mexicans real prone diabetes I want help get Hell soon possible ,1
They preach diversity professor jobs government jobs makes White Liberal Neighborhoods gated communities TOO white need Black flavor home joy diversity right White daughter bedroom ,1
Every cultured society things therein created whites ,1
Welcome Fritz Klingingberg loyaldefender c13 anyone else may started posting recently ,0
Shows superiority ,1
And person stop check old man alright looks like white station ,1
He walks upright human arms legs ,1
The filthy ape gave horse infection ,1
Someone looking take things seriously active sometimes hard find ,0
It became way years years ago joe louis ran camp ghetto kids ,0
The majority stupid real Negroes ,1
Until I believe I taunt school already goof,0
I nt think ,0
If stand asians would find school breath fresh air ,1
ASIAN security guards ,1
We want assimilation ,1
And nonsense ,0
Tight good abs ,0
I think Klan best social club whole militant thing tends turn people makes look crazy,0
4 cyclinder motorcycle Historic vehicle Laurin Klement T B 18991903 YouTube Historic vehicle Torpedo V4 1909 YouTube Historic vehicle Torpedo V4 1909 httpthekneeslidercomimages2012rightsidejpg Handlebar camera mount ride video ,0
Why earth swedish parents letting Kids grow ethnic school ,1
Rüütel talaði um hve erfiðir tímar hefðu verið þegar sjálfstæðisyfirlýsingin var gefin út ,1
I vancouver wa singer coming white power band looking meet one boyfriend man white,0
Did see anything white faces non racially edited video ,0
Even stop pouring intention going back poland ,1
