Msg,Tag
Amazing 5 young bucks break little girls home beat child half death killing expected believe nt take turns finally killing ,0
Seems like cowardly way fight ,1
We looking building mud free zones way taking key locations building refuge racial kindred ,1
These people scum ,1
We kill Whites go back eating cow dung ,1
NUCLEAR PLANT HAS FULLY EXPLODED ,0
They need give mandatory DNA tests kick France ,1
Probably especially legitimate refugees war conflict opposed fake black brown refugees flooding country ,1
My earliest known paternal ancestor Norman knight sent two sons across Channel 1066 ,0
I ing tired moderation place ,0
Go either school board education tell want remove childShould papers need sign ,0
ive seen whole thing remember part started talk BLACK MALES showed bunch news clips saying suspect black male etc acting like suppose feel sorry innocent like said dont think one black person interviewed ,0
I got impression trying sell something ,0
I hope Ukrainians become experts identifing toxic mushrooms springing ,1
I wonder percentage San Francisco people HIV positive straight ,0
Its time nation take matters hands throw government stop white genocide deport immigrants establish government help indigenous white Britons rebuild country ,1
We spent time trying get Negroes learn read ,1
Welcome CA1784 ROY BROWN Th0r dan23uk ourtimewillcome Glasgow Girl ,0
These feral negroes stalk white women rape kill one seems willing stop ,1
Lunch 15 minutes recess 15 minutes ca nt talk class little time available school ,0
Where white woman go public fear assault muds ,1
Has anyone able locate clip photgraph father ,0
YouTube Broadcast Yourself ,1
For White students test starts 40 passing score 99 ,1
I would never homeschool kids send public schools ,0
When goes outside subhuman ape thing usually ,1
Lying Marxists ,1
In Sweden people receives SVT 1 SVT 2 TV 3 TV 4 Kanal 5 ZTV SVT 1 SVT 2 state owned mostly show socialistic propaganda ,0
Non Whites hate White people plain simpleThey taught birth White people cause problems world every bad thing happens evil racist White people ,0
I one plan hang last jew guts last capitalist ,1
Racial preservation belief existence certain race must preserved well course culture ,0
Can suggest locals get behinds lets traitors know antiwhite festival welcome town 828,1
I think cases infected people area yeah Id take school ,1
Classical music amazing good gym I play metal new band I started listening called Spellblast fits bill nicely ,0
 YouTube,1
White Asian DOES NOT make white babies ,1
LOL GJ brother 10 points Uber humans 10 sub human ape creatures truly one bad mofo whitey crakker man,1
It hate disagree ethnic scum hate crime attack us ,1
I handing mine proper authorities ,0
Only mind INTERNATIONAL JEW could evil machination ticker tape parade lies cooked ,1
All describe sisters ,1
Oh yes skin us alive given chance ,1
I feel sorry little sister maybe saved becoming wigger look older sister example ,0
Always back parking space possible makes easier get away trouble ,0
White person hurrying catch TTC Scarborough ,0
Most white girls taught brainwashed love black guys way properly educate show savages truly ,1
It nature Jews desecrate traditions sorts push women make fools ,1
If nt act soon bread us ,1
Nothing ever harmful society jews savage beasts thoughtless gimmiegrunts ,1
I gone public school life force fed crap since 7th grade ,1
Yeah I mention places like Beaver Falls Aliquippa chockfull filthy I mean filthy n ,1
I sat 5 minutes took dog walk ,0
For perspective I wrote final paper English class basically Revisionist perspective Holocaust I outspokenly debated polisci teacher accordingly ,0
Okay good maybe come bursting onto scene like parties Denmark Norway ,0
white nationalist christian faith still white nationalist racial survival anti racist christians true chirstians ememy,1
httpmoviesnytimescom20090206movies06shorhtmlYouTubeNewBoyhttpwwwgetthebigpicturenetblogmnewboyhtml,0
The regime wants Germans hate bad already brown Muslims ,1
This guy seems get otherwise Sorry jigs,1
No instead pump whitey full chemicals via food chain reduce collective IQ level blacks ,1
In Eternal Combat Satanic Spirit The physical incarnation creation Demiurge The Jews ,1
Americans Irish understand better Spaniards beaners US Ireland 1st world educated unlike beaners ,1
I game far violent sick game I ever played ,0
Denmark 23 2001 11 2002 09 2003 06 2004 assuming population 54 million Good job Denmark ,1
I called told next time save come go attorney see anything stir pot ,0
2508,0
Im heading DC put sign White House gates read No savage negro BEASTS White House ,1
Black womenon London transport ,1
The claim years ago India White Mans land mixing Negro ,0
Its disgrace sister waiting list 6 years giving away houses scumbags,1
An Irish prison like luxury hotel come thats even get sent prison thats get nt flee country thats get caught crime crime pay Ireland ,1
I nt drink vodka sound like I ten years older even worse ,0
The worst thing happened internet freedoms albanians used spare time selling drugs learn use computers ,1
httpwwwbelfasttelegraphcouknepstory655156 And usual loyalist reaction freedom Nationalists attack Harryville Catholic Church hold pickets people pray inside parade goes ahead give abuse threaten attack Catholics Ballymena ,0
All liberals care Diversity ,1
I added AIM yet catch online ,0
Nigdy nie spotkalem zadnego w Londynie ,1
Nothing unusual except said back window ,0
My son university College Liberal Arts CLA awards BA degrees ,0
Good thread good points ,0
somebodyhcfcalledputinaherololololThisherofinallytransformedformersovietjewnion russianjudeaIn miserytorn countryare there70 officially billionaries tens f thousands millionaries tens millions poor miserable look pittance garbage places ,1
YouTube Brussels 911 For free Europe Islamization,1
Traitors pathetic ignorant fools negroes fools starting literally bite hands feed ,1
I doubt Los Angeles cess pool ,1
Hes retarded feral negro yes feral humans cannot talk occasionally pop abandoned children ,1
Perhaps proud indigenous inhabitants Dublin nt want culture enriching ruining tripe like ,1
Fast food whites ,0
But one talks real problem ,0
Liberals change facts fit deluded narrative intelligent people change narrative fit facts ,1
hey five years searching I finally fell love ,0
Anyone visited PLEUK web site time invited return new introduction The history Britain history held living space ,0
How great think mixed child ,1
I tried click link see pictures nothing ,0
When homos tried fag pride parade Serbia years ago beaten ,0
Just wondering hope take slogan way back Africa ,0
one one many bet white girls wiggers go crazy young coon whichever school wigggers outnumber metalheads normal whites,1
I know non white got 5 A 4 B robably cheated 2508,1
Wake White People ,0
And nice picture ,0
Another songwriter encouraged many people come If going San Francisco sure wear flower hair ,0
That sheet paper I take meant bull sheet poster said ,0
yeah maybe Jewish They warm old money printing press might feel like getting low ,1
Apes even instinct basically leave dead ,1
Finns Sweds become even closer start become true brethren nations like always ,0
Hi I Nor Cal many like minded people ,0
The thing Negroes wishful want ,1
Maaaaany pinders Asians ,1
hi south london hope make many like minded friends got bored listening lefties need talk real people,0
Bugsy89,0
Im living Burnaby see Chinamen everywhere happened great colony built British Empire ,1
Striking nt even dominated grappling rules minimal let alone ,0
They white nations ,1
exactly I said I meant every word thought I might enough two talking behind back like jew expect say nice life ,1
And negroes history starts written word ,1
But I never liked working metal much wood ,0
A puppet hands Jews Zionist Jewish States America Bolshevik Soviet Union ,1
Powerful video shows primitive beasts ,1
Im allowed use negro inventions ,1
As brit knowledge american law somewhat lacking even know holder groid committed treason,1
The ugly black always black ,1
If want good intro take antiWhites check Beefcake Bootcamp ,0
Their aggressiveness massive reason success ,1
Hungarians ,0
The BLMtards crashed LBBQWTF parade last month lol ,1
Rosanna Davison I think name ,0
She gets cussed every day ,0
You stop getting dead pig bury underground mosque built ,1
We nt need scum ,1
88 In end victory,0
Thats either White guy exposed nuclear fallout Black guy many Blacks see Tour de France ,0
Hopefully wo nt settle US black communities pick bad habits ,1
As said irish media scared please give us interviewThings going bad media lies belived irish people ,0
Blue Bell ice cream one showing five kids one black playing fields barn ,0
Look Don McAlvany Revolution Betrayal The terroristpig caught redhanded tens thousands grenades antipersonnel mines ,0
Yeah I think much better back home ,1
I would love see video Somalis blown apart torpedo see bodies scrap metal fly hundreds feet air ,1
See South Africa glimpe OUR future beasts Memphis run directly ground ,1
HIVAIDS nt killing fast enough ,1
There lots groups suit tie thing still haters MSM averge public ,0
Since Die Stem racist ,0
Going ,1
It became booming black town ran straight ground ,1
They scum traitors ,1
I read newspaper Grays Harbor county Washington State test scores going ,1
love knowing guys opinions stuff like think girls dress etc thank person started thread excellent get insight male minds ,0
Not sell car ended court 500euro lighter pocket latest meeting Negro ,0
LOL ye gorgeous great talent well ,0
When asked I knew holocaust lie answer truth would laws saying lie ,1
Incredible range animals got ,0
Or try yelling nigs ya get suspended jumped hopefully new wn friends ya die trying lol Rohawa battle cry ,1
This girl almost made another human sacrifice false god ,1
Most probably next generation Whites wont much difference native population ,0
Liberals illusion genes pick select genes get passed think passes good ones ,1
These niggas ,1
I want meet single women Wichita area friendship maybe ,0
I beginning wonder posts defending greatest racetraitor puppetofJewry Great Britain ever produced ,1
Living expenses Stockholm high poor Swedes Whites choice live nonwhite suburbs ,1
The worst thing present immigration spread country ,1
sure anti liberal prime minister openly supports israel sends cards holiday laughing stock aryan race mention also openly support sand people ,1
Yes homosexual degeneracy foisted upon silent majority ,1
Jews demanding worst patients ,1
 Work harder white boy brother needs new truck ,0
The peanut butter important time machine used go back teach ancient Incans make ,0
way win opening eyes whites cant softly ,0
Light explosion first reached planet Earth 30000 years ago ,0
 You ca nt make stuff Go drink drown sorrow living among primitive Asians ,1
Allow apologize last post I drinking heavily last night callin genetic lottery winner come I fair share hard times last week yellow person came place work started making trouble ,1
ya lazy drugattics cant get real job deal drugs jump job job job ,1
For liberals ranting tribalism behave tribal manner ,1
The Chechen beast one committed killing name Allah Russian brothers like theater Moskva ,1
EUwe say anymore piece scum coming country long EU passport,1
In England whole cities almost majority ethnic hundreds schools white children ,0
Let order pizza delivered try assault driver one know catch us ,0
Classic brainwashing ,1
I nt know person said ever leaves house I ever see black guys Mexicans everywhere ,1
Sometimes I wonder Because Whites much smarter find harder run together opposed independently ,1
Most dont even work I doubt pushed high positions society ,1
Check youtube channel found agree says Diversity DESTROYS Social Cohesion West YouTube,1
The biggest problem new yorkThere blacks streets new york think nigeria ,1
Its disgusting foreigners come stamp feet jump good Irish families get want ,1
The absurd thing I ever heard nig say I quote ,1
The whites asians evoluated blacks still behind ,1
That might Blacks smaller brains IQ 1530 points lower White people average ,1
Then look forward cases MultiDrug Resistant MDR Extensively Drug Resistant XDR TB become common diseases ,1
In fact home involvement Nigeria criminalized ,0
My advice go bulk gym take martial art nt feel intimidated blacks currently ,0
N,0
Looks like Jews good broken car garage I laugh saw ,1
Since new let direct site also good info puts paper called Nationalist Times ,0
They criminals ought jail put tracking bracelets smart ones cut rape rob dumb ones nt care leave ,0
Yes age 10 never saw negro real life moved Holland horrified amount nonwhites ,1
Behind bulletproof glass dozen armed guards maybe 50 yards away ,0
This 4th attack teacher last 2 weeks ,0
The link appears broken ,0
httpwwwazcentralcomnewsarticlglary1219html About 10 pm Dec 9 police called Ed Fish Chips 306 N Central Ave reported armed robbery police said ,0
Him wife kids absolutely place white nation disgusting put end thousands years evolution selfish ,1
Sounds like instincts good smart ,0
Ive day today I nt seen single one em ,0
They need sent back Afreka along Joos control politicians ,1
It become unbearable seriously changing person watching country decimated ,1
Some candle light good drink forbidden flag wall Triumph des Willens telly ,0
Originally good luck symbol ,0
Ð Ð Ð 34 YouTube,1
I suppose I get loose ends ,0
httpuserserolscominterlaccorreshtm Check schools offer high school level courses credit school accept check ,0
Better overly polite White guy offering tell word Joseph Smith nignog car jacking ,1
I feel dirty touching railing one things ,1
10242010 MONTEREY PARK Calif KABC Deputies arrested suspect connection double murder couple Hawthorne ,0
Does nt sound like I missing much anyway ,0
That would nt nice ,0
They eventually kill whites go back jungle ways ,1
At least shop white counter rule ,1
Compared stunningly beautiful white Swedish females barfy mixed breed dog ,1
I wish mods saw way friend Lycurgus might one day find unmoderated ,0
Maybe H K impressed rap video ,0
Nordic someone heritage sub race category one person heritage put ,0
Love looking old photographs ,0
That changes live around ,1
Well done ,0
yes dying way could beat problem voting BNP next election,0
We know many ethnics neighbourhood soon turn slum ,1
Partly visible partly invisible times PLEs based upon standard community organizing practices even take account factor opposition ,0
Our school systems nothing breeding grounds slave system zionist determined create ,1
This really European news everybody know years Lebanese arabs intimmidating white women Cronulla beach cowardly attack two white lifesavers Lebanese got yesterday ,1
It took Labour ten years bring immigrants cough invaders ever migrated last 5 thousand years ,1
unless tourist study year two please go back Russian dont need want slavs,1
I would nt marry asian even cirurgy ,1
oddly would find worst black since Negroes inferior scum bag humanoid race planet ,1
White women okay promote males still carrying sins Grandfathers 3 ,0
Thor Soderberg 43 shot killed 61st Racine ,0
Tuleistu minu kõrvale ,1
talking years filthy muslims putting sight africa ways worst blacks ,1
I go sleep I wake reasonably early morrow ,0
The best way prevent Black White rape succeed goal removing white countries ,1
 bulgar turkic peice ustasha KOSOVO belongs SERBİA get used however much hate serbs also way Makedonia belongs Greece bulgayria,1
The blacks browns detroying sweden nobody anything madex madex madex,1
That every groid wish anyways ,1
Why would want see pollution spread gene pool ,1
This overcome White privilege,1
Liberal PC word Rapist ,1
Hopefully video wake abit youtube twHzXN3kNTs youtube youtube DiLbAEQqrqY youtube youtube x9QNKB34cJo youtube youtube LZf Ag7SmxI youtube Oppression Violence ,0
So even shown n bad light I would hope would bring lots new members time come show non white races take much raise,1
Same wolves dogs wolves coyotes ,0
I would nt even consider knackerspykies Irish respect race loyalty Ireland put like dogs ,1
The white man future Canada sure country flooded nonwhite immigrants ,1
Brutal Expanding Reach Of Mexico Drug Cartels YouTube Dispatch Expanding Reach Mexico Drug Cartels YouTube Stratfor Insight Mexican Drug Cartels,0
man video went along got fearful would tag end stating video assaulted murdered glad turned better ,0
The ragheads dont numbers kick Ireland yet know ,1
They know destory civilization ,1
ApÃ ro gÃ ant trois jeunes soupÃ onnÃ de viol https wwwstormfrontorgforumt809905,1
The problem well eventually run places hide game,1
They dont hire whites bring 50 work visa kinda crap ,1
We spent much time effort worrying Blacks Asians Hispanics ones carrying ball ,1
Now spitting nt ladylike pretty funny gets point across languages left behind go away safely ,0
Is crime particular problem live ,0
And I guess nothing wrong ,0
I doubt though ,0
You know get past violent animal acts intimidation soft jaw ,1
welcome promote white unity british occupation nireland another issue cannot succeed promote hate whites fundamental tenet white nationalism something think ,0
Something must done halt terrible wave immigrants entering Britain ,1
Just super max mean never among us ,0
Probably comes Regina ,1
I could nt imagine living conditions drugs filthy negros everywhere ,1
If really want change bad grammar habit simply practice home work cubicle say loud would could 100 times day phrase yes total 300 times per day part normal everyday speech ,0
And nonwhites mostly unjustifiably abusive ,0
Such shàme allowed blacks browns destroy every last square inch cities ,1
God Bless,0
I prefer male teachers girlfriend says likes female teachers ,0
Its easy multiply African genes incredibly pronounced ,1
We huge Asian problem ,1
Hey Blue email PM want chat ,0
Anyone Ireland got flags please say got I want ,0
So good guy ,0
If chance check might find site interest ,0
She may may Jew certainly stupid seems think Blacks wo nt kill alongside every White get dirty hands muppet ,1
Nope prisoner means belive wp try dress much like one cannot due parents job ,0
When sent n iggers space space ships started blowing ,1
If Orthodox Churches mobilized Reds could smashed cradle ,0
Maybe could get together ,0
You like Jager ,0
Well makes fact scum sending millions kin country taking jobs White inhabitants killing people mongrelizing race alright ,1
The UAF bunch middle class faggots EDL steam every time show counter demonstration soon run home daddy ,1
To sum situation Sweden complete disaster ,1
His website also interesting ,0
The problem white men asian women come non white babies poor asian men labors would upset people ,1
The Negro generally terrified Whites second stand usally back away thats unless carrying gun point savages rarely reluctant use ,1
Maybe put em prison fifty right front Sid figure cost admission,0
It taken 14 months arrive point ,0
Interesting article evil persons keep telling truth want surrender Danish ,1
course wo nt want steal land would nt stop dead neither would ,1
Taking authorities worst thing ,0
I respond Armenian scum stop,1
But worst thing americans britons wants yet make see Basayev like freedom hero ,0
The blood hundreds white women hands white liberals ,1
They sound naive learn people want intergrate accumulate ,1
The country significant babyboom Estonia TFR 12 1998 17 year httppubstateepxweb2001DialoBirthslang1AlsoCzechRephasitsfertilityratesignificiantlyincreasedhttpwwwczsoczengcsunsfinformaceaoby032008doc Denmark Norway year probably record high TFR level since early 1970 ,0
YouTube Broadcast Yourself ,1
Lay cart back India poop Ganges river next dead grand parents ,1
Aragorn,0
Beautiful Sweden poisoned ArabMuslim trash ,1
The doctors juju voodoo seem left mud huts moved office buildings built White people cities built White people ,1
There small Nigerian man lived town year ,0
My wife spend time UP Hospital Philadelphia thank God I licensed carry Pa Downtown Philadelphia becoming cesspool ,1
I hear loud clear I still nt able meet anyone ,0
YouTube huge help learning start primitive fires learning gut animals fish ,0
 Those evil Whites ,1
Hiya new sick watching country become infected disease multiculturalism ,1
7 minutes gorgeous ,0
I understand White Christians would stick Israel like guys video This happened Atlanta past weekend Palestinian state unrest In Atlanta Georgia ,0
httpbmxsocietycomuploadsmonthl9887thumbjpghttpbmxsocietycomuploadsmonthly052010post2192127351673801thumbjpg Another photo showing nice rims billet axle spacers USA made Paul rear derailer ,0
Reflections 1970s Image Credit Copyright Jimmy Walker Explanation The 1970s sometimes ignored astronomers like beautiful grouping reflection nebulae Orion NGC 1977 NGC 1975 NGC 1973 usually overlooked favor substantial glow nearby stellar nursery better known Orion Nebula ,0
New Supreme Court Justice Lord Dyson JC Article ,0
Does anyone else ever feeling Churchill fighting Germans rather NS acted like surprised Nurnberg trials ,0
Making history none ,0
Protesting funeral ,0
It failed due lack funding ,0
Some things I noticed shop tailors dummies black couple mud restaurants germ blacks fashionable taking root ,1
And second whites smarter asians ever look bodybuilding contests see whites maybe one 2 blacks ,1
hello I Rome ,0
Често сам виђао и 828 HBH Heil Blood Honour iveo Krv Čast ,1
I support 100 ,0
I worried nt well ,0
Good luck bugchasing homo ,1
Thanks imported filth like land current occupation ,1
He allowed wife bring black male home daughter ,1
Toy Crane Commercial BMO Harris Bank YouTube,0
And anyone wonders white students avoid UC Berkeley ,0
act negros aids right reproduce die way take care kid I cant believe millions crazy,1
In Vancouver ,0
good luck NoRemorseNoRegrets hopefully good news job lets hope dont become another figure stat ,0
The LAST thin I want go website ,0
Is nt terrible ,1
Until explain meaning statement I consider outdone every troll ,0
Would arrested shot themkilled property ,0
If jew pieces garbage hell cares happened ,1
YouTube Broadcast Yourself ,1
I made visit LA I words describe racial situation city ,1
Pakis forcing culture us ,1
Fine long nt parade city demand gay rights keep closed god damnit homosexuality nt exatly something proud,1
Racist attack tv show south africa BBC YouTube,0
He pathetic little chimp ,1
If continues England become cesspool sh pardon English,1
Coming town near soon ,0
The majority people photos threat America Ukraine opinion ,1
A man electrocuted couple weeks ago courtney campbell causeway trail ,0
As soon get little smarter figure attach pics one nt work ,0
It really pisses liberal leftist,1
Stormfront ,0
Careful man People SF nt like Asians bashing ,0
Interesting see someone radio outfit praise figure amazing show dedicated uncovering facts regarding antiGerman filth ,1
Any purported holy book says vile despicable things talmud says Mary Jesus cannot come place goodnessJews convinced superiority think trick God love fidelity pretending honor ,1
More impulsive Negro stripping ,1
Valgt Fredericiakredsen Vejle Amt som Folketingets yngste medlem nogensinde ,1
Source,0
I always considered teaching one professions I would like get neighbourhood like never kids like disgust ,1
Nevertheless Regency Victorian era reports abound dogs wasted away master graves cats refused eat drink upon death mistress even pet monkey committed suicide ,0
I noticed lot fat little white girls monkey boyfriends ,1
Your enemies plain simple jews try destroy us immigration jew would able get far many look white ,1
About Chinese remain country good become illegal immigrants white nations bad ,1
It bothers much makes want vomit white woman lay beast need try come back go black wanted back ,1
Precisely,0
I met saw lot teachers worked black schools horror stories ,0
How much want bet nt black male running operation You count white people innovative,1
I Can tell right black mob threatening life burning town I going start shooting ,1
I would curious know Missouri get house cheap ,0
Metal Honor Poland Defensor 14 Poland Ekspansja Poland Hools Attack Poland Kolovrat Russia Moscow Band Russia Ancestors Slovakia Conflict 88 Czech NSBM Arkona Poland Gontyna Kry Poland Inferium Poland Kataxu Poland Thunderbolt Poland Veles Poland Wojnar Poland Wolf Moon Poland vocals Szczecry Honor Woodtemple Poland I used download Kazaa I got tired adware viruses I got ,0
Tight good pals ,0
I see coming ,0
Mound Misshapened Aluminum ,0
There different versions bad comes race traitors date non white bad matter nonwhite asian black arab,1
Hello I Mike I reading board time finally got around registering ,0
How much longer going wait take care ,1
Scum ,1
This offtopic since brought forth I suppose answered ,0
White kids need interact kneegrows non white kids lost real come time leave home ,1
If raheem gat wit 17 bumps jose dised front OG peeps capped dat bitch twice den double tapp hector jus cause dere monique pregnant say raheem baby daddy much welfare get multiply food stamps X project housing add free utilities stolen cars drugs sold find still poor,1
The Indian teenager showing Caucasian American girl dissolve cow dung water use broom spread filth floor house ,1
I live Argentina forgotten white country southernmost tip S America ,0
Hell I rather clean dozen tiolets day walk bathroom see mongrel standing mop giving glassyeyed stare ,1
