Msg,Tag
Put mudraces countries build fence around wait decade two soon back state found numbers decimated diseases wars ,1
I hope farms burn nappy headed children squandle flames ,1
But adopting kids answer NO ,1
Enjoy multiculturalism shoved throat fighting Israel black Asian new best friend ,0
Note I ca nt guarantee later editions book even coverage word problems ,0
deserve least taste helping white liberals Jews push us I nt think allow destroy though ,1
I relate coon runiing football like coon tv running police siren ,1
I nt know afrocant nt slather skin several times day cocoa butter lotion takes definite crocodilian appearance ,1
Sexual assault suspect caught cellphone video YouTube Rape Suspect Caught On Cellphone Video Arrested News Story KTVU San Francisco Dion McDaniel mugshot,0
Im Winnipeg become cesspool ,1
Most white kids know believe superior freak whenever black guy fighting white ,0
Theres way stop coming Canada needed proof ownership house India africa etc enter tourist visa ,1
Hate Asians ,0
another article mail today side bet allowed stay think money people soak irish people madness wwwfaemcom,1
With liberal media police departments reporting black crime given pass ghetto ways many times becomes acceptable behavior real consequences ,1
I would like help project ,0
Same basketball baseball ,0
Besides would even bother help ,1
sure I got mate look like magazine though coz scans photocopies looks like find em post,0
It nt really mean anything ,0
If non white town everyone knows ,0
It works ways ,0
It mere coincidence Liberal Party color Blue ,1
 The case Elmira man accused strangling stabbing pregnant exgirlfriend moved one step forward Friday morning ,0
No wonder races achieve nothing ,1
httpnewsbbccouk2hiafrica6217719stm There folks Nigeria acting like one big ghetto queen squeezing baby negroes bigger handout government ,1
Yeah could amount black rapists Nordic countries privileged enough ,1
A pile burned offerings ,0
There things stop rapes occur blacks non whites con white women girls getting cars etc For start teach women respect ,1
Or hide behind link something ,0
23 year old man went missing walking river 2 miles ,0
We know hates Christains anyone else ,0
Well done people IrelandLet hope start people waking dangers mulitracial society ,0
I wonder one victims opened door apartment reason ,0
I White I believe White people know difference right wrong matter say political positionsWe facing genocide people infighting loved non Whites ,1
The remoteness weather desirable ,0
Maybe Centre spent money buying Nogger Black ice cream keep people away seeing awful racist product 100,0
Were letting creatures flow openly air sea ports performing much background test ,1
In BB ,0
Also atrabiliar ahtruhBILyar Origin 1645 55 L atra bili black bile ous ra bil ious ness n ,0
white men asian women actually hurt asian people society since asians outnumber whites ,1
2 Lethargic syn inactive ,0
Who else THAT house block ,0
im history year cant really talk last year cause forgot remember would biased cause didnt join national socialism coupla months ago dont even know could really say joined like u fill form something ,0
It noble idea I would rather stay mostly white Missouri move 35 black South Carolina ,0
I know probably I never met Black IT professional nt exclusively sales ,0
My children allowed even watch never mind play ,0
Theyre cowards simpletons utterly incapable generating reasoned argument free sententiously repeated stock phrases scarewords like racist ,1
I wonder Jewish Media always pretends blood thirsty third world savages victims Whitey fault ,1
Fogalmam sincs hogy mennyi lehet itt ,1
And Rose Powell anything stay long time ,0
The snake chased ,0
I mean seriously farcical ,0
Ca nt comment contents yet ,0
Depending part Scotland going I might bad news Kaffirs ,1
Any kind civilization Negroes today gift White race ,1
They allegiance Ukraine allegiance god money power eternal enslavement hated goyim ,1
I feel sorry families Jews Art Katz would preach Jesus died Jew first time shoving nonJewish wife faces ,0
They go around school acting like half Whitehalf black half Whitehalf asian something proud ,1
No need invite foreign hordes onto soil bang shead My head hurts ,1
The worst thing every single one beautiful cities ALL countries look like ,1
 Lives Canada right ,0
Well said Ghost dont bother dudehe one always last word go ,0
used post years back kruger reason cant register name goes new one 88 know meet,0
I open landing window earlier stench cooking overpowering ,0
I substitute teacher Jackson Mississippi Public School System late 1990 ,0
All tim hortons staffed nast filipinos every single town full Indians asians ,1
Honestly mostly come odd funny looking ,1
good know many proud white people carry fight salute ,0
We start gangs kill rob homes liberals wanted diversity ,1
Hi great hear u ,0
Normal,0
Five years ago zero apathetic refugee children Sweden ,1
httpwwwirishdemocratcoukanonnousmysticismhttpwwwmidnetieconnollyirishdndecjan98htmlsinnfeiniravisitAuschwitzhttpwwwutvinternetcomnewsroom id 52367 pt n,0
Alot blue missing always goes bang fits pants pocket better Taurus tip ,0
Its good add hint truth essay maybe better I high school every teacher I liberal antiracist could barely accept truth ,1
These latest statistics Ethnic groups Irish 874 white 75 Asian 13 black 11 mixed 11 unspecified 16 2006 census even seven percent poles add mud races would equivalent ,1
This I need something else ,0
It welcome change see fellow WN seeing hundreds lefty bastards going see RATM ,1
Im sure Jews Scandinavia dumb education systems ,1
I never seen Asian woman dating Asian manThey like white man reforce wiggers detrimental towards causeCpamikei,1
The German men sound sexy ,0
Miami I nt know Don stand living Hispanic 279456 700 Black alone 64993 163 White alone 47622 119 Asian alone 3649 09 Two races 2642 07 Other race alone 676 02 American Indian alone 361 009 Native Hawaiian Other Pacific Islander alone 58 001 Read Miami Florida FL profile population maps real estate averages homes statistics relocation travel jobs hospitals schools crime moving houses news sex offenders,1
So even though study based upon differences every individual found enough data conclude specific races indeed different genetical coding almost accident ,0
So sick way working I remember I growing Winnipeg little shops white runned owned would hire people community great helped people kept streets safe even though others would cause bull wasnt anything ,1
Although many asked us put aside politics thread see HATE FITS IN WE NEED THE HATE WAVE TO CONTINUE ,1
Does anyone want meet somewhere within next weeks ,0
Everyone Ireland duty make life difficult blacks possible children kind future ,1
I taught question everything teach ,0
I bet wouldnt done crap black person black power black fists panthers use written back pack ,1
In fact buy California fruit tasted illegal alien DNA ,1
Planet apes ,0
There IQ pretty worthless nt discovered cure cancer MS Parkinson HIV ETC bah I see numbers ,0
Probably good idea keep TV ,0
I followed link BDP tried check policies shown lot Latin translates total gobbledegook ,0
I bet Liberal men sure proud daughter ,1
Deanna Spingola Dr Lorraine Day Zionism Holocaust Aids Vaccines YouTube Deanna Spingola Dr Lorraine Day Zionism Holocaust Aids Vaccines Listenwatch full interview Deanna Spingola Dr Lorraine Day Zionism Holocaust Aids Vaccines Free Download Streaming Internet Archive wwwDrDaycom wwwGoodNewsAboutGodcom,1
The Lone Ranger black Annie little black girl There black Vikings Spartacus black Hercules black The jews two choices past historical figures Make black make crazy genocide White maniacs like Christopher Columbus,0
Regurgitation good info better ingestion jewishdisinformation ,1
I looked discussion obvious outnumbered nonwhites race traitors follow followers types ,1
hope one day able see finland withouth ing monkey ass soumalian im glad finland lowest immigrate europe kick ing soumalians ass ,1
Are sure guys department public health pest control trying fumigate ,0
I dont know whether welcome laugh ,0
YouTube Broadcast Yourself ,1
Look happens Whites leave black Countries alone naturally The blacks White Countries today knees thanking Whites trying civilize,1
I agree Asian nations relatively stable compared Africa S America I wonder Asians even come America ,0
Those visionary responsible negroes ,1
Hopefully nt get intimidated enemies land freedom antifa scum ,1
He suspected taking crap high atop empire state building years ago right open people walking around ,0
Why kick Africans ,1
Her tainted feet place Sweden ,1
YouTube Broadcast Yourself ,1
Green eyes though ,0
If Christian anyway use Christian Identity excuse ,0
Shes lucky I bet careful next time ,0
What Hell Sweden ever anyone deserve kind treatment ,1
Let nonwhites pollute bodies garbage ,1
They always take something someone else make ,1
So everytime I typed forum appeared I decided join learn Aryan race ,0
Stop race mixing discourage practice ,1
They would rather look black stories ,0
May put away good ,1
When I look Zimbawee Mugabe I think Ape Gorilla ,1
miscegination killer races destroys perfectly good DNA even nonwhite DNA might need diversity day save entire species would shame DNA destroyed becasue leftist ideal bullsnot,1
Muds nt respect anything including respect therefore anyone else ,1
Zdrowie ,0
In dark days jewishMarxistmafia dominated materialistic societies everyone anyone bank note traded ,1
Are asking Africans South Africa hate White people much murdered 40 thousand since end White rule ,1
Its old symbol Nazi chose around long time represented strong Aryan roots ,0
We far closer neanderthals apes ,1
Politifuldm ,1
I suppose okay everyone else call anything want ,0
Congrats ,0
Does surprise jews promote faggotry ,1
Watching videos makes feel like im going explode hatred creatures ,1
get saying thousands non irish never contribute anything land ,1
Angela Spain murdered home drifter negro ,1
A mud mud mud ,1
seven billion Humans planet Open borders H1b visas fake social security numbers colleges hiring foreign nationals White Legal Americans Obama Amnesty line apathetic public well dye skin black unlearn english might get good job ,1
What condition White Western World day Hitler stupid war condition today ,0
Apparently Jews ca nt take truth spoken ,1
And growing numbers probably gonna happen europe,0
Hell teacher like ,1
When someone going stand laws Executive Orders ,0
Then make boys football reason ca nt wrestling ,0
I feeling though propaganda photos like reverse desired effect ,0
The school systems broken ,0
And meanwhile Gerry Gerry Dingleberry trying kill future generations Irish ,0
Sometimes Europeans look alike ,0
WTF Well done liberals ethnically cleansed 20000 yr old race beautiful unique white people country This sick vile crime I crying look pictures nt care laugh say gay cry people longer exist 100yrs 20000 yrs destroyed 100 My beautiful race dying nt know,1
Too many libtards I would nt waste time ,1
The jew attempting make condemned beg noose ,1
I hate fox news throw jew stick every chance get makes unwatchable ,0
Wow Video ton insight I surprised Mexican realize bull bias us whites,0
How dare give us evidence crimes tape ,0
I wanted get opinions Stormfront members Jewish crap son brought home public school ,1
The antiwhites using education decades brainwash Whites race ,1
I disagree never justify race mixing Some girls may brainwashed media also condemning kids furture generations kids non white future ,1
No wonder bad shape tribe charge White House Congress ,1
Thanks advice keep mind ,0
The White race best Creator made Whites He made better He made races ,1
False information bad science right ,0
To white patriots watch ENDGAME ALEX JONES OR ENDGAME PRISON PLANET learn agenda criminals Jewish bankers ,1
Unfortunately I nt kept maddening story hate crime charges filed black apes ,1
I heard friends Boston trueBlacks attack Irish America shamrock tattooHow long happens Ireland ,1
14 88 ,0
Why dont put spot drop bombsI serious making fools Irish ,1
All plus tens thousands relatives get stay ,1
Sry I didnt respond sooner right im using free aol accounts,0
Sadly I think government would step tried stop lesser races moving land ,1
That Great ,1
Theres old style weapon called monkeys clawfist seamen would make rope lead shot ,0
The fact Whites stood attacked group Mestizos far disturbing attack ,0
YouTube Broadcast Yourself ,1
With exception two mestizo teachers teachers kindergarten white ,0
I guess Jews rabbi guy says must serve Jews Iraqi Jew ,1
Marxist Subversion happened ,1
The email account nt even exist anymore ,0
zpridez NO big deal I got driftIMO If bellyaching Black peoples et al continue negateor ignore present Products Progress within society doomed ,1
God sickening see young lives taken feral negroes ,1
Here could see rest adverts campaign httpwwwjetlageandocomarchivesscpfesalbinojpghttpwwwjetlageandocomarchivesjardinerojpghttpwwwjetlageandocomarchivesscpfesgemelasjpg supossed fun one black man another purpose ,0
Spanish NOT language ,0
I hope Labrat get back I liked site ,0
Edit alright I ,0
The bad thing sick animals infect whites ,1
I escorted campjail 2 polish policeman denyingquestioning hoaxacuast illegal ,1
SOLIDARITY WITH MARCO ,0
TNB ,1
I vision left christian screeching meek shall inherit earth member peaceful religion goes chopping humour ,0
One thing seemingly cannot graspthat JEWS messiah kingdom earthly ,1
The supposed trauma fictional event passes thru generations genocide people met mass apathy ,0
Ive never London I heard like spot white man every girl almost little niglet half breed ,1
Well see gotten first base ,0
And job lets monitor Jewish supremacist control talk radio ,0
To means Jewish supremacists never allow Whites say ,1
I beaten robbed two natives last year last couple years I watched downtown turn black brown yellow town food court Portage place started remind creature cantina star wars ,1
Intelligent parents usually intelligent kids two good looking people procreate usually results good looking kids genetic luck ,0
Since family fundimental founding forming TEXAS I actively trying find work place live ,0
Maybe something Soviets even funds keep ample supply food toilet paper country ,1
65 media coverage britain BBC openly biased towards left others nt much better ,0
Oh irony ,0
lookin white friends online mexico would like meet people interested nordic black metal holocaust send mails attack,0
Hi Im tv free nt kids yet reading mending sewing menting board games radio study extra curricula actives Good planning FREE jewv existence,1
When populations seperated racial mixing occurs genocide ,1
A weeks ago started looking got pictures LOADS mobile numbers far reds SO naive ,1
I know exactly saying I hate see worthless apes benefit great things whites ,1
These high school curriculums encouraging white girls hate white males males ,0
Bad home defense pity probably spectacular manstopper soft lead hollow base Foster slugs flatten quickly ,0
Another black trying convince black slaves forcefed animal lard huge tubes hands feet cut could work cotton fields without running away,1
Does surprise White hating nonwhites still want live White countries made GREAT White people brought low nonwhites ,1
Lervik sound like name person rather name place ,0
On maps northern packice border ,0
hi school zoo suck hate school white trash one race mixers w white power times,1
I find funny obsessed many posters White area Whiteness gauged skin color alone ,0
Because vile plague mankind one really likes ,1
We handwritten account Battle Shiloh 4th Tennessee ,0
My daughter said touched apeling back hit ,1
I remember first job window factory I one whites working ,0
In eyes Jew libtard race problem problem us ,1
oh dear isnt terrible well suppose leave go somewhere valued,1
Cut Shoot Texas TX 77303 profile population maps real estate averages homes statistics relocation travel jobs hospitals schools crime moving houses news,0
Its like choices white genocide candidate 1 2 3,0
800 Demonstranten gegen NPDKundgebung Aus dem Land SchleswigHolstein KN Kieler Nachrichten Kiel Kurd PKK demostration today ,1
Well got aware idiots absorbing bs little sponge brains ,1
These disgusting perverted white men different white women sex black men bigger penis ,1
Are suggesting nt appreciate ,0
88 Kelly 2056,0
If monkeys property call animal control defend family property whatever means possible simply talking sense monkey pointing stop misbehaving ,1
So looks like Blacks lost even one LOL Diablo,1
I could never picture site one women Holy Rus shacking Islamic mud fithy impoverished godforsaken mountainous hole ,1
As soon found child mulatto wet back I suddenly found repulsive shall never watch anything ,1
Didnt Sextus solve problem thousand years ago amongst Romans forbidden law ,0
If 100 stupid people alone forest honor willing work together create civilization form type hierarchy ,0
I reported time ago negroes even strip bricks home away work ,1
They probably stole bunch stuff ,1
He flagged reported skyyjohn Channel YouTube EstablishedMencom sent blind date ,1
I know I keep hoping I wake one day multiracial hell Canada terrible nightmare never happens ,1
Im one brother I suggested first post use Stormfront casual second source bulk people use sort Dungeons Dragons fantasy football league real interest active ,0
It necessary hide behind lies false information face truth side ,0
Im surprised C18 wasnt mentioned always OB smash EVIL neo nazis Yellow press best,1
httpscipiouarkeducdm4item vie ISOBOX 1 REC 2,0
There many race mixing ads TV gets overwhelming ,1
Well us Chicago based people get together toast disgustingly loving soon couple round good brew ,0
well liberals would go ape crazy ,1
would move surrey outside Kingston upon Thames ok Kingston infested outer areas bad inner London joke,1
These two elements comment quite baffling ,0
Pathological killers ,1
I read web site long ago called TFPorg,0
The media wants bury story care homo killers getting sick fetish young boys fufilled ,1
Im running giving muds ,1
8000 later paid byJiffylube car good new ,0
There multitudes great people hearty welcome us ,0
Trudeau white Obama nt care people Canada third world crap allowing Canada,1
httpwwwkrepublisherscom02Jour seyKTextPDF Molecular genetic methods supported observations relatively small difference Hungarian Indian groups Central Europeans differ ,0
High time get back mother Affika fix mess ,1
Been A week since I put poison body I feel gread better every day dont craving anymore Now I realize stupid start first place PS Thanks suport,0
So African ,0
help Quebec would like say congratulation pitbullAG hope lot new white resident city,0
Those Jewish murderers millions Whites forgiven ,1
live block muslim mask every friday rule streets think walk anywhere want white give look klike pass black neighborhood nigs,1
French Spanish offered one french teacher opposed 4 Spanish teachers number students able take French VERY limited ,0
South Africa returned Stone Age 20 years ,1
Sooner later black one say mother er madick ,1
sort understand coming plenty whites sold us river speak although jew always background complicated ever find truth somalians scumalians ,1
Nearly everyone better high speed rail ,0
IV ,1
I think might one two groups still active I idea Maybe check Daily Stormer Book Clubs ,0
Post freely forums ,0
I wanted run politics well I realized hope society way liberal ,0
I think funny premed student nt black person within hundred miles classes ever ,1
I needed 3 places last night including one Christmas Gothard Sisters 2014 Show Teaser YouTube,0
As far im concerned soon little half breed born tied round neck mother mulattoe flung nearest riverLets see daddy jumps save ,1
hey im new site im looking beutifull aryan woman spend days withim columbus ohiolooking mate live columbus surrounding areas im 30 yrs old look 20 light brown hair blue eyesproffesional service technician alot interest looking fr near get ahold eric,0
Stop showing South Asian functional illiteracy ,1
I think people marry race ,1
I wondering anyone else trouble accessing wwwirelandawaketk click click comes DotTK registration page Anyone help ,0
Absolutely whenever see dirty white coon dreadlocks get urge grab flea blanket head head butt senseless,1
I feel pain ,0
Keep hearing wonderful someone even likened Christ ,0
Disgusting perverted ,0
Older folks interesting much offer ,0
And words wisdom come man thinks another mans anus well made used vagina ,1
Fair enough ,0
I live Oslo racemixing huge problem ,1
I got sloppy seconds Muslims used girl ,1
I wanted say hello The Jew Evil ,1
They taking advantage overwelcoming nature far long ,1
This place looks like interior needs little finishing appears built survivalist ,0
Decaying rotting malls inhabited rats wild dogs homeless former retail employees blight suburban landscape decades ,0
Happend day class black one backed ,1
I could go hours pointing wigger flaws im even gonna waste time ,0
They pretty nice looking important name Jew ,0
Thanks encouragement ,0
MVI 0147 Dead Pig Stops New Mosque Construction ,0
Also work core upper body ,0
Agreed,0
He despised EU nationalist therefore stood everything EU ie pro family values proud culture etc ,0
Yes noticed I live ,0
I miss Dr Pierce much ,0
Has anyone else noticed blacks mainly wait opponent gets tired preserving energy attack opponent weak ,1
It easier races follow herd Whites ,1
Idiotic,0
My wife favorite place Ireland Kingdom Cloghane Village O Connor pub I hope place nt invaded ,1
You know talk gun control people go buy ,0
Pm chat wish ,0
Why Stormfront section type thing ,0
I hope I see day thease worthless pieces crap OUT OF HERE ,1
The site 2 days online ,0
You might want check gave pretty good review truckATVsnow mobile gun backup takes standard ARM16 magazines ,0
Medlem af DFUìs bestyrelse ,1
Yet blacks get friends jump ,0
Imagine steel cage battle royal match Wrestlemania multiply carnage 1000000 times get ,1
I eventually came conclusion jews behave like criminal syndicate respectable religion ,1
I know somebody wants perhaps move Alberta wondering homo agenda schools ,1
Prostitution drug getting everywhere dealers Senegal Guinea Nigeria dirty prostitutes fom Cameroun ,1
How watch short film working together chat later ,0
Good fences make good neighbors ,0
Everything symbiosis western nation becoming Hate Sign How come anything represents Jewish Muslim traditions symbol hate ,0
In light wonder Hitler considered champion German people ,0
Yes thank reported vile sicko ,0
immigrants desperate stay blame government treats lords muck welcome SFI Pluirin ,1
This tip iceberg ,0
Reproducing ,0
88,0
I nt want throw life away ,0
Seeing teams white nations black players ranks depressing site seeThey representing best nations worst,1
Laugh ape cause without yt protect race Asians probably world favour wipe kind face Earth ,1
Two days ago I tapped half asian half White mongrel bigger ,1
Big talk none balls tell skin face ,0
I likely moving belfast ,0
live near albany could hang u u want could beat upsome unpure infidels would like,1
She looks like African blood maybe makeup ,1
I spent quite bit time April driving around new van ,0
Id love live Ontario ,1
She white looks somewhat average white Swedish girl I think ,0
Its weird Indians dot extent feather I deal hate blacks whites find blacks lazy worthless ,1
You AREN T White ,1
We encourage people boycott black businesses start rumours blacks working shops AIDs probably true ,1
Mass white immigration Ireland current scourge slashed 9597 ,1
A good old bit nostalgia days hardly blade grass coon pitch ,1
Glædelig jul ,1
She quickly see info good hate nonexistant ,0
But unfortunately Maine become dumping ground Somalis African trash ,1
They rather sit front computer wearing Brownshirt uniform taking pics webcam ,0
Construction Workers React Wrecking Ball YouTube,0
sure I take note I continue point refuse disclose info may give away position topics relating WN ,0
Yeah one ever hear ,0
Your history teacher zionist butt heads want ,1
Look white liberals done ,1
I stopped one day looking job holidays I left immediately I saw barely find straight person summer ,1
Definitely dad said city growing nonwhites Chinese family running Chinese restaurant everyone else white ,1
I believe Kitchener overwhelmingly white city ruined ,1
Those countries mentioned mongrel offspring whites Aryans Arabs funny East claim Aryans talk white people came mixed Aryans apparently East light skin blue eyes ,1
The thing care welfare mooching rest us ,1
Im sure negro coming ,1
June 6 2010 6 20 pm EDT See full article Mississippi man faces sixth capital murder trial 1996 shootings CNNcom,0
Seems aluminum lighter softer prone distortion creates friction well corroding easily ,0
Egyptian TV Host The Jews Are Using Holocaust Suck Blood Germans YouTube,1
I realized stormfront idea white looks like flawed ,0
Oh look Al Qaeda ,0
There London areas could described nothing less little islamic republics ,1
They instead decide convenience low risk unenlightened selfinterest ,1
black security guards racist look evil always giving dirty looks white customers especially polish customers ,1
You got right one goLets hope gets well soon way home If nt apes great Country count blessings,1
88,0
You admit look like scrawny desert chicken hence use name Roadrunner ,0
